      -----------------------------------------------------------      
     |                   =====================                   |     
     |                           x T B                           |     
     |                   =====================                   |     
     |                         S. Grimme                         |     
     |          Mulliken Center for Theoretical Chemistry        |     
     |                    University of Bonn                     |     
      -----------------------------------------------------------      

   * xtb version 6.7.1pre (5071a88) compiled by 'Marcel@Raven' on 2024-07-23

   xtb is free software: you can redistribute it and/or modify it under
   the terms of the GNU Lesser General Public License as published by
   the Free Software Foundation, either version 3 of the License, or
   (at your option) any later version.
   
   xtb is distributed in the hope that it will be useful,
   but WITHOUT ANY WARRANTY; without even the implied warranty of
   MERCHANTABILITY or FITNESS FOR A PARTICULAR PURPOSE.  See the
   GNU Lesser General Public License for more details.
   
   Cite this work as:
   * C. Bannwarth, E. Caldeweyher, S. Ehlert, A. Hansen, P. Pracht,
     J. Seibert, S. Spicher, S. Grimme, WIREs Comput. Mol. Sci., 2020, 11,
     e01493. DOI: 10.1002/wcms.1493
   
   for GFN2-xTB:
   * C. Bannwarth, S. Ehlert and S. Grimme., J. Chem. Theory Comput., 2019,
     15, 1652-1671. DOI: 10.1021/acs.jctc.8b01176
   for GFN1-xTB:
   * S. Grimme, C. Bannwarth, P. Shushkov, J. Chem. Theory Comput., 2017,
     13, 1989-2009. DOI: 10.1021/acs.jctc.7b00118
   for GFN0-xTB:
   * P. Pracht, E. Caldeweyher, S. Ehlert, S. Grimme, ChemRxiv, 2019, preprint.
     DOI: 10.26434/chemrxiv.8326202.v1
   for GFN-FF:
   * S. Spicher and S. Grimme, Angew. Chem. Int. Ed., 2020, 59, 15665-15673.
     DOI: 10.1002/anie.202004239
   
   for ALPB and GBSA implicit solvation:
   * S. Ehlert, M. Stahn, S. Spicher, S. Grimme, J. Chem. Theory Comput.,
     2021, 17, 4250-4261. DOI: 10.1021/acs.jctc.1c00471
   
   for ddCOSMO and CPCM-X implicit solvation:
   * M. Stahn, S. Ehlert, S. Grimme, J. Phys. Chem. A,
     2023, XX, XXXX-XXXX. DOI: 10.1021/acs.jpca.3c04382
   
   for DFT-D4:
   * E. Caldeweyher, C. Bannwarth and S. Grimme, J. Chem. Phys., 2017,
     147, 034112. DOI: 10.1063/1.4993215
   * E. Caldeweyher, S. Ehlert, A. Hansen, H. Neugebauer, S. Spicher,
     C. Bannwarth and S. Grimme, J. Chem. Phys., 2019, 150, 154122.
     DOI: 10.1063/1.5090222
   * E. Caldeweyher, J.-M. Mewes, S. Ehlert and S. Grimme, Phys. Chem. Chem. Phys.
     2020, 22, 8499-8512. DOI: 10.1039/D0CP00502A
   
   for sTDA-xTB:
   * S. Grimme and C. Bannwarth, J. Chem. Phys., 2016, 145, 054103.
     DOI: 10.1063/1.4959605
   
   in the mass-spec context:
   * V. Asgeirsson, C. Bauer and S. Grimme, Chem. Sci., 2017, 8, 4879.
     DOI: 10.1039/c7sc00601b
   * J. Koopman and S. Grimme, ACS Omega 2019, 4, 12, 15120-15133.
     DOI: 10.1021/acsomega.9b02011
   
   for metadynamics refer to:
   * S. Grimme, J. Chem. Theory Comput., 2019, 155, 2847-2862
     DOI: 10.1021/acs.jctc.9b00143
   
   for SPH calculations refer to:
   * S. Spicher and S. Grimme, J. Chem. Theory Comput., 2021, 17, 1701-1714
     DOI: 10.1021/acs.jctc.0c01306
   
   for ONIOM refer to:
   * C. Plett, A. Katbashev, S. Ehlert, S. Grimme, M. Bursch,
     Phys. Chem. Chem. Phys., 2023, 25, 17860-17868. DOI: 10.1039/D3CP02178E
   
   for DIPRO refer to:
   * J. Kohn, N. Gildemeister, S. Grimme, D. Fazzi, A. Hansen,
     J. Chem. Phys., 2023, just accepted.
   
   for PTB refer to:
   * S. Grimme, M. Mueller, A. Hansen, J. Chem. Phys., 2023, 158, 124111.
     DOI: 10.1063/5.0137838
   
   with help from (in alphabetical order)
   P. Atkinson, C. Bannwarth, F. Bohle, G. Brandenburg, E. Caldeweyher
   M. Checinski, S. Dohm, S. Ehlert, S. Ehrlich, I. Gerasimov, C. Hölzer
   A. Katbashev, J. Kohn, J. Koopman, C. Lavigne, S. Lehtola, F. März, M. Müller,
   F. Musil, H. Neugebauer, J. Pisarek, C. Plett, P. Pracht, F. Pultar,
   J. Seibert, P. Shushkov, S. Spicher, M. Stahn, M. Steiner, T. Strunk,
   J. Stückrath, T. Rose, and J. Unsleber
   
 * started run on 2025/12/08 at 00:34:34.306     
   ID    Z sym.   atoms
    1    6 C      1-50
    2    1 H      51-66
    3    8 O      67-70

           -------------------------------------------------
          |                Calculation Setup                |
           -------------------------------------------------

          program call               : xtb "C:\Users\LENOVO GAMING\Documents\GitHub\molecular-conductivity-sim\dataset\1nm-4Odoped-5percent.xyz" --opt --parallel 4
          coordinate file            : C:\Users\LENOVO GAMING\Documents\GitHub\molecular-conductivity-sim\dataset\1nm-4Odoped-5percent.xyz
          omp threads                :                     4


           -------------------------------------------------
          |                 G F N 2 - x T B                 |
           -------------------------------------------------

        Reference                      10.1021/acs.jctc.8b01176
      * Hamiltonian:
        H0-scaling (s, p, d)           1.850000    2.230000    2.230000
        zeta-weighting                 0.500000
      * Dispersion:
        s8                             2.700000
        a1                             0.520000
        a2                             5.000000
        s9                             5.000000
      * Repulsion:
        kExp                           1.500000    1.000000
        rExp                           1.000000
      * Coulomb:
        alpha                          2.000000
        third order                    shell-resolved
        anisotropic                    true
        a3                             3.000000
        a5                             4.000000
        cn-shift                       1.200000
        cn-exp                         4.000000
        max-rad                        5.000000


          ...................................................
          :                      SETUP                      :
          :.................................................:
          :  # basis functions                 232          :
          :  # atomic orbitals                 232          :
          :  # shells                          124          :
          :  # electrons                       240          :
          :  max. iterations                   250          :
          :  Hamiltonian                  GFN2-xTB          :
          :  restarted?                      false          :
          :  GBSA solvation                  false          :
          :  PC potential                    false          :
          :  electronic temp.          300.0000000     K    :
          :  accuracy                    1.0000000          :
          :  -> integral cutoff          0.2500000E+02      :
          :  -> integral neglect         0.1000000E-07      :
          :  -> SCF convergence          0.1000000E-05 Eh   :
          :  -> wf. convergence          0.1000000E-03 e    :
          :  Broyden damping             0.4000000          :
          :  net charge                          0          :
          :  unpaired electrons                  0          :
          ...................................................

 iter      E             dE          RMSdq      gap      omega  full diag
   1   -133.8452712 -0.133845E+03  0.497E+00    1.13       0.0  T
   2   -133.8887420 -0.434708E-01  0.327E+00    0.95       1.0  T
   3   -133.7477908  0.140951E+00  0.197E+00    1.22       1.0  T
   4   -133.9612437 -0.213453E+00  0.371E-01    1.01       1.0  T
   5   -133.9698593 -0.861563E-02  0.161E-01    1.04       1.0  T
   6   -133.9711328 -0.127355E-02  0.838E-02    1.02       1.0  T
   7   -133.9715327 -0.399820E-03  0.395E-02    1.03       1.0  T
   8   -133.9715944 -0.617168E-04  0.203E-02    1.03       1.0  T
   9   -133.9716089 -0.145733E-04  0.821E-03    1.03       1.5  T
  10   -133.9716118 -0.286754E-05  0.284E-03    1.03       4.2  T
  11   -133.9716121 -0.246107E-06  0.130E-03    1.03       9.2  T
  12   -133.9716122 -0.930238E-07  0.483E-04    1.03      24.7  T
  13   -133.9716122  0.168541E-09  0.294E-04    1.03      40.7  T

   *** convergence criteria satisfied after 13 iterations ***

         #    Occupation            Energy/Eh            Energy/eV
      -------------------------------------------------------------
         1        2.0000           -0.7372229             -20.0609
       ...           ...                  ...                  ...
       114        2.0000           -0.3958034             -10.7704
       115        2.0000           -0.3944993             -10.7349
       116        2.0000           -0.3846404             -10.4666
       117        2.0000           -0.3720534             -10.1241
       118        2.0000           -0.3674580              -9.9990
       119        2.0000           -0.3545924              -9.6489
       120        2.0000           -0.3227775              -8.7832 (HOMO)
       121                         -0.2850993              -7.7579 (LUMO)
       122                         -0.2726082              -7.4180
       123                         -0.2647564              -7.2044
       124                         -0.2588580              -7.0439
       125                         -0.2514637              -6.8427
       ...                                ...                  ...
       232                          0.7448297              20.2678
      -------------------------------------------------------------
                  HL-Gap            0.0376781 Eh            1.0253 eV
             Fermi-level           -0.3039384 Eh           -8.2706 eV

 SCC (total)                   0 d,  0 h,  0 min,  0.245 sec
 SCC setup                      ...        0 min,  0.000 sec (  0.000%)
 Dispersion                     ...        0 min,  0.001 sec (  0.408%)
 classical contributions        ...        0 min,  0.001 sec (  0.408%)
 integral evaluation            ...        0 min,  0.016 sec (  6.531%)
 iterations                     ...        0 min,  0.174 sec ( 71.020%)
 molecular gradient             ...        0 min,  0.052 sec ( 21.224%)
 printout                       ...        0 min,  0.001 sec (  0.408%)

         :::::::::::::::::::::::::::::::::::::::::::::::::::::
         ::                     SUMMARY                     ::
         :::::::::::::::::::::::::::::::::::::::::::::::::::::
         :: total energy            -131.793450914931 Eh    ::
         :: gradient norm              0.047507680669 Eh/a0 ::
         :: HOMO-LUMO gap              1.025274563130 eV    ::
         ::.................................................::
         :: SCC energy              -133.973547660110 Eh    ::
         :: -> isotropic ES            0.044766510936 Eh    ::
         :: -> anisotropic ES          0.007765428674 Eh    ::
         :: -> anisotropic XC          0.039198164952 Eh    ::
         :: -> dispersion             -0.129530496193 Eh    ::
         :: repulsion energy           2.180096745179 Eh    ::
         :: add. restraining           0.000000000000 Eh    ::
         :: total charge              -0.000000000000 e     ::
         :::::::::::::::::::::::::::::::::::::::::::::::::::::

      ----------------------------------------------------------- 
     |                   =====================                   |
     |                        A N C O P T                        |
     |                   =====================                   |
     |               Approximate Normal Coordinate               |
     |                Rational Function Optimizer                |
      ----------------------------------------------------------- 
      ----------------------------------------------------------- 
     |                   =====================                   |
     |                        A N C O P T                        |
     |                   =====================                   |
     |               Approximate Normal Coordinate               |
     |                Rational Function Optimizer                |
      ----------------------------------------------------------- 

          ...................................................
          :                      SETUP                      :
          :.................................................:
          :   optimization level            normal          :
          :   max. optcycles                   210          :
          :   ANC micro-cycles                  20          :
          :   degrees of freedom               204          :
          :.................................................:
          :   RF solver                   davidson          :
          :   write xtbopt.log                true          :
          :   linear?                        false          :
          :   energy convergence         0.5000000E-05 Eh   :
          :   grad. convergence          0.1000000E-02 Eh/α :
          :   maxmium RF displ.          1.0000000          :
          :   Hlow (freq-cutoff)         0.1000000E-01      :
          :   Hmax (freq-cutoff)         5.0000000          :
          :   S6 in model hess.         20.0000000          :
          ...................................................

generating ANC from exact Hessian ...
Using Lindh-Hessian (1995)
 Shifting diagonal of input Hessian by   9.615808102188992E-003
 Lowest  eigenvalues of input Hessian
    0.000000    0.000000    0.000000    0.000000    0.000000    0.000000
    0.010000    0.010300    0.010757    0.011092    0.011630    0.013180
    0.014047    0.015410    0.016120    0.016336    0.017100    0.019500
 Highest eigenvalues
    2.082256    2.093391    2.110198    2.139947    2.151783    2.167904
 

........................................................................
.............................. CYCLE    1 ..............................
........................................................................

 iter      E             dE          RMSdq      gap      omega  full diag
   1   -133.9716122 -0.133972E+03  0.105E-04    1.03       0.0  T
   2   -133.9716122 -0.127045E-10  0.853E-05    1.03     140.0  T
   3   -133.9716122 -0.476888E-09  0.442E-05    1.03     270.3  T
     SCC iter.                  ...        0 min,  0.045 sec
     gradient                   ...        0 min,  0.050 sec
 * total energy  :  -131.7934509 Eh     change       -0.3646505E-08 Eh
   gradient norm :     0.0475107 Eh/α   predicted     0.0000000E+00 (-100.00%)
   displ. norm   :     0.3488754 α      lambda       -0.9077729E-02
   maximum displ.:     0.2970669 α      in ANC's #32, #35, #47, ...

........................................................................
.............................. CYCLE    2 ..............................
........................................................................

 iter      E             dE          RMSdq      gap      omega  full diag
   1   -134.0568466 -0.134057E+03  0.136E-01    1.03       0.0  T
   2   -134.0569005 -0.539128E-04  0.822E-02    1.02       1.0  T
   3   -134.0568797  0.208414E-04  0.602E-02    1.03       1.0  T
   4   -134.0569868 -0.107060E-03  0.935E-03    1.03       1.3  T
   5   -134.0569898 -0.300423E-05  0.580E-03    1.03       2.1  T
   6   -134.0569924 -0.260760E-05  0.152E-03    1.03       7.9  T
   7   -134.0569924 -0.567407E-07  0.102E-03    1.03      11.7  T
   8   -134.0569925 -0.541924E-07  0.503E-04    1.03      23.8  T
   9   -134.0569925 -0.148183E-07  0.177E-04    1.03      67.6  T
     SCC iter.                  ...        0 min,  0.123 sec
     gradient                   ...        0 min,  0.047 sec
 * total energy  :  -131.7998005 Eh     change       -0.6349606E-02 Eh
   gradient norm :     0.0231560 Eh/α   predicted    -0.5091479E-02 ( -19.81%)
   displ. norm   :     0.2367072 α      lambda       -0.2500269E-02
   maximum displ.:     0.2028424 α      in ANC's #32, #18, #35, ...

........................................................................
.............................. CYCLE    3 ..............................
........................................................................

 iter      E             dE          RMSdq      gap      omega  full diag
   1   -134.1058990 -0.134106E+03  0.963E-02    1.03       0.0  T
   2   -134.1059469 -0.479256E-04  0.596E-02    1.02       1.0  T
   3   -134.1059753 -0.283254E-04  0.411E-02    1.03       1.0  T
   4   -134.1060133 -0.380214E-04  0.852E-03    1.02       1.4  T
   5   -134.1060150 -0.175199E-05  0.550E-03    1.03       2.2  T
   6   -134.1060175 -0.245636E-05  0.140E-03    1.02       8.5  T
   7   -134.1060176 -0.103948E-06  0.755E-04    1.03      15.8  T
   8   -134.1060176 -0.261157E-07  0.361E-04    1.03      33.1  T
     SCC iter.                  ...        0 min,  0.109 sec
     gradient                   ...        0 min,  0.047 sec
 * total energy  :  -131.8011431 Eh     change       -0.1342571E-02 Eh
   gradient norm :     0.0064726 Eh/α   predicted    -0.1320276E-02 (  -1.66%)
   displ. norm   :     0.0269317 α      lambda       -0.6020024E-04
   maximum displ.:     0.0158372 α      in ANC's #32, #18, #26, ...

........................................................................
.............................. CYCLE    4 ..............................
........................................................................

 iter      E             dE          RMSdq      gap      omega  full diag
   1   -134.1074631 -0.134107E+03  0.154E-02    1.03       0.0  T
   2   -134.1074647 -0.153626E-05  0.101E-02    1.02       1.2  T
   3   -134.1074661 -0.145093E-05  0.635E-03    1.03       1.9  T
   4   -134.1074667 -0.642749E-06  0.220E-03    1.02       5.4  T
   5   -134.1074669 -0.193039E-06  0.135E-03    1.02       8.9  T
   6   -134.1074671 -0.162360E-06  0.308E-04    1.02      38.8  T
   7   -134.1074671 -0.675041E-08  0.980E-05    1.02     122.0  T
     SCC iter.                  ...        0 min,  0.090 sec
     gradient                   ...        0 min,  0.042 sec
 * total energy  :  -131.8011833 Eh     change       -0.4019007E-04 Eh
   gradient norm :     0.0028302 Eh/α   predicted    -0.3013638E-04 ( -25.02%)
   displ. norm   :     0.0131806 α      lambda       -0.1707926E-04
   maximum displ.:     0.0072353 α      in ANC's #18, #40, #63, ...

........................................................................
.............................. CYCLE    5 ..............................
........................................................................

 iter      E             dE          RMSdq      gap      omega  full diag
   1   -134.1062459 -0.134106E+03  0.980E-03    1.02       0.0  T
   2   -134.1062462 -0.372565E-06  0.628E-03    1.02       1.9  T
   3   -134.1062464 -0.194512E-06  0.421E-03    1.02       2.8  T
   4   -134.1062469 -0.429908E-06  0.118E-03    1.02      10.1  T
   5   -134.1062469 -0.732793E-07  0.649E-04    1.02      18.4  T
   6   -134.1062470 -0.380552E-07  0.157E-04    1.02      75.9  T
     SCC iter.                  ...        0 min,  0.082 sec
     gradient                   ...        0 min,  0.042 sec
 * total energy  :  -131.8011930 Eh     change       -0.9675811E-05 Eh
   gradient norm :     0.0007327 Eh/α   predicted    -0.8567541E-05 ( -11.45%)
   displ. norm   :     0.0052755 α      lambda       -0.8015052E-06
   maximum displ.:     0.0031886 α      in ANC's #32, #40, #12, ...

........................................................................
.............................. CYCLE    6 ..............................
........................................................................

 iter      E             dE          RMSdq      gap      omega  full diag
   1   -134.1055097 -0.134106E+03  0.328E-03    1.02       0.0  T
   2   -134.1055097 -0.132123E-07  0.197E-03    1.02       6.1  T
   3   -134.1055097  0.377857E-07  0.141E-03    1.02       8.5  T
   4   -134.1055098 -0.689801E-07  0.213E-04    1.02      56.0  T
   5   -134.1055098 -0.400294E-08  0.607E-05    1.02     196.8  T
     SCC iter.                  ...        0 min,  0.070 sec
     gradient                   ...        0 min,  0.047 sec
 * total energy  :  -131.8011937 Eh     change       -0.7497990E-06 Eh
   gradient norm :     0.0002565 Eh/α   predicted    -0.5561391E-06 ( -25.83%)
   displ. norm   :     0.0015897 α      lambda       -0.9166752E-07
   maximum displ.:     0.0011400 α      in ANC's #18, #40, #22, ...

   *** GEOMETRY OPTIMIZATION CONVERGED AFTER 6 ITERATIONS ***

------------------------------------------------------------------------
 total energy gain   :        -0.0077428 Eh       -4.8587 kcal/mol
 total RMSD          :         0.0717973 a0        0.0380 Å
 total power (kW/mol):        -3.3881182 (step)  -21.4891 (real)
------------------------------------------------------------------------

 ANCopt (total)                0 d,  0 h,  0 min,  0.946 sec
 optimizer setup                ...        0 min,  0.001 sec (  0.106%)
 model hessian                  ...        0 min,  0.042 sec (  4.440%)
 ANC generation                 ...        0 min,  0.008 sec (  0.846%)
 coordinate transformation      ...        0 min,  0.000 sec (  0.000%)
 single point calculation       ...        0 min,  0.887 sec ( 93.763%)
 optimization log               ...        0 min,  0.008 sec (  0.846%)
 hessian update                 ...        0 min,  0.000 sec (  0.000%)
 rational function              ...        0 min,  0.000 sec (  0.000%)

================
 final structure:
================
70
 xtb: 6.7.1pre (5071a88)
C           -5.61731539157411        3.65350667710278        0.00037996436159
C           -0.71958723620787        4.89275666356450       -0.00009602113177
C           -4.88048368011791        4.77424905455737        0.00038153958510
C           -2.84630782580432        3.63224513891429        0.00012087629873
C           -4.96218391122162        2.36907724618806        0.00022635703784
C            4.97016018334258        4.76149383754747       -0.00022895806059
C            0.63286741757318        4.90455741415741       -0.00018814446498
C            0.71348571588688       -4.89915153609159        0.00002924743898
C            2.80405399272628        3.69326432458452       -0.00018205641089
C            4.92560452287368        2.43451320591968       -0.00006045374633
C           -3.51541566174873       -2.46088560875301       -0.00010609094035
C           -1.40430306783818       -3.70794682913235       -0.00009072436582
C           -1.45150595842554        3.66964747168601       -0.00000462436127
C            0.69630536730390        2.46221429420559       -0.00009870224620
C            2.81697121657606        1.23177125088635       -0.00005351519887
C           -5.66818577118651       -3.56221771906040       -0.00023294126230
C            4.94637932509431        0.01530793970900        0.00008563295967
C           -3.63553545078591       -4.86750403659006       -0.00026069478674
C           -3.54490240406772        2.40787100917965        0.00012779062906
C            4.97285973145330       -2.41096463003229        0.00018890866215
C           -1.40570832139440        1.21405173681566       -0.00002386909065
C            0.70601985117515        0.00201056610022       -0.00004857278160
C            2.82261064537756       -1.21719151771813        0.00004247630102
C           -5.63066148660180        1.15489687649110        0.00017444793058
C            2.84982844770516       -3.64849686994028        0.00011790477966
C           -3.51310511839068       -0.02464402676234        0.00000411526443
C            4.86461071697287       -4.81836014945355        0.00026338818633
C           -1.39458289810157       -1.24645822296479       -0.00005909994876
C            0.72276760647864       -2.46279629594117       -0.00000990733339
C            3.63448555585036        4.87197756467363       -0.00026341759390
C           -4.91132433961759       -0.03996667460851        0.00004614981005
C           -2.78628065074222       -1.24724960663094       -0.00005558039940
C           -0.69641054462499       -2.48675706835497       -0.00005900283063
C            1.44265142054652       -3.68482545559030        0.00004399873360
C            1.40318591887194        3.70222830530948       -0.00016226361237
C            3.50836707564567        2.46092304151750       -0.00010194295131
C           -4.92590299011772       -2.40058425832808       -0.00012271469894
C            5.62123598098582        1.25053448111626        0.00004396521200
C           -2.84226737786567       -3.70561161367973       -0.00015307715965
C           -0.64665082443718       -4.90613174888789       -0.00004427928477
C           -0.71715901328194        2.44709699857299       -0.00004632675413
C            1.40302292709228        1.23453226568043       -0.00007262538321
C            3.53311299266093        0.00998055844133        0.00002435368005
C           -5.00637760056622       -4.78949810993351       -0.00030949205131
C            5.64271811292373       -1.21746503710669        0.00017912426047
C           -2.81524105069014        1.20160286884486        0.00003223306145
C            5.61035708749738       -3.70610482055050        0.00026657384049
C           -0.69315332421902       -0.01037087633522       -0.00004939520486
C            1.41632724934323       -1.23076609970271       -0.00000923702732
C            3.54125539331339       -2.43543469184247        0.00011552056718
H           -6.69257926866920        3.70705495696149        0.00049732879837
H            1.26633542927244       -5.82603978837748        0.00007739089307
H           -6.74474613146298       -3.50721371179164       -0.00026012187814
H           -3.17219152919948       -5.84043370688421       -0.00031753076871
H           -6.70852828234085        1.12176714131336        0.00023321798509
H            5.27441979846560       -5.81798546106845        0.00031528035613
H           -1.15833839941602       -5.85514284042783       -0.00005169827246
H           -5.59288787902047       -5.69624603985566       -0.00040459643736
H           -1.27881509685367        5.81592585119513       -0.00009795845045
H           -5.30430902032894        5.76819124661376        0.00049711223038
H            5.64164370262593        5.60736947723278       -0.00028645482862
H            1.14666477248857        5.85299742893956       -0.00026872397693
H            3.19644620399151        5.85413434910035       -0.00035655324510
H            6.69980065339028        1.27559164066089        0.00008704625327
H            6.72274094392061       -1.20584366994902        0.00023873722749
H            6.68547539566672       -3.77011049318025        0.00032184032703
O            5.65019942007053        3.59735742857886       -0.00011746405288
O            3.51716922095979       -4.84431683590864        0.00019356297411
O           -3.53633406869668        4.81962247704399        0.00023802290792
O           -5.60267142050494       -1.21100773797165       -0.00003127556034
 
 Bond Distances (Angstroems)
 ---------------------------
C1-C3=1.3413         C1-C5=1.4419         C1-H51=1.0766        C2-C7=1.3525         C2-C13=1.4254        C2-H59=1.0793        
C3-C1=1.3413         C3-H60=1.0805        C3-O69=1.3449        C4-C13=1.3953        C4-C19=1.4097        C4-O69=1.3733        
C5-C1=1.4419         C5-C19=1.4178        C5-C24=1.3860        C6-C30=1.3402        C6-H61=1.0800        C6-O67=1.3482        
C7-C2=1.3525         C7-C35=1.4279        C7-H62=1.0787        C8-C34=1.4164        C8-C40=1.3602        C8-H52=1.0792        
C9-C30=1.4419        C9-C35=1.4009        C9-C36=1.4194        C10-C36=1.4175       C10-C38=1.3732       C10-O67=1.3701       
C11-C32=1.4158       C11-C37=1.4118       C11-C39=1.4151       C12-C33=1.4115       C12-C39=1.4380       C12-C40=1.4176       
C13-C2=1.4254        C13-C4=1.3953        C13-C41=1.4261       C14-C35=1.4273       C14-C41=1.4135       C14-C42=1.4166       
C15-C36=1.4103       C15-C42=1.4140       C15-C43=1.4162       C16-C37=1.3785       C16-C44=1.3943       C16-H53=1.0780       
C17-C38=1.4076       C17-C43=1.4133       C17-C45=1.4158       C18-C39=1.4069       C18-C44=1.3731       C18-H54=1.0776       
C19-C4=1.4097        C19-C5=1.4178        C19-C46=1.4098       C20-C45=1.3686       C20-C47=1.4435       C20-C50=1.4318       
C21-C41=1.4123       C21-C46=1.4096       C21-C48=1.4167       C22-C42=1.4160       C22-C48=1.3992       C22-C49=1.4228       
C23-C43=1.4180       C23-C49=1.4063       C23-C50=1.4144       C24-C5=1.3860        C24-C31=1.3947       C24-H55=1.0784       
C25-C34=1.4076       C25-C50=1.3963       C25-O68=1.3694       C26-C31=1.3983       C26-C32=1.4223       C26-C46=1.4109       
C27-C47=1.3391       C27-H56=1.0804       C27-O68=1.3477       C28-C32=1.3917       C28-C33=1.4233       C28-C48=1.4212       
C29-C33=1.4194       C29-C34=1.4183       C29-C49=1.4138       C30-C6=1.3402        C30-C9=1.4419        C30-H63=1.0754       
C31-C24=1.3947       C31-C26=1.3983       C31-O70=1.3599       C32-C11=1.4158       C32-C26=1.4223       C32-C28=1.3917       
C33-C12=1.4115       C33-C28=1.4233       C33-C29=1.4194       C34-C8=1.4164        C34-C25=1.4076       C34-C29=1.4183       
C35-C7=1.4279        C35-C9=1.4009        C35-C14=1.4273       C36-C9=1.4194        C36-C10=1.4175       C36-C15=1.4103       
C37-C11=1.4118       C37-C16=1.3785       C37-O70=1.3686       C38-C10=1.3732       C38-C17=1.4076       C38-H64=1.0789       
C39-C11=1.4151       C39-C12=1.4380       C39-C18=1.4069       C40-C8=1.3602        C40-C12=1.4176       C40-H57=1.0782       
C41-C13=1.4261       C41-C14=1.4135       C41-C21=1.4123       C42-C14=1.4166       C42-C15=1.4140       C42-C22=1.4160       
C43-C15=1.4162       C43-C17=1.4133       C43-C23=1.4180       C44-C16=1.3943       C44-C18=1.3731       C44-H58=1.0799       
C45-C17=1.4158       C45-C20=1.3686       C45-H65=1.0801       C46-C19=1.4098       C46-C21=1.4096       C46-C26=1.4109       
C47-C20=1.4435       C47-C27=1.3391       C47-H66=1.0770       C48-C21=1.4167       C48-C22=1.3992       C48-C28=1.4212       
C49-C22=1.4228       C49-C23=1.4063       C49-C29=1.4138       C50-C20=1.4318       C50-C23=1.4144       C50-C25=1.3963       
H51-C1=1.0766        H52-C8=1.0792        H53-C16=1.0780       H54-C18=1.0776       H55-C24=1.0784       H56-C27=1.0804       
H57-C40=1.0782       H58-C44=1.0799       H59-C2=1.0793        H60-C3=1.0805        H61-C6=1.0800        H62-C7=1.0787        
H63-C30=1.0754       H64-C38=1.0789       H65-C45=1.0801       H66-C47=1.0770       O67-C6=1.3482        O67-C10=1.3701       
O68-C25=1.3694       O68-C27=1.3477       O69-C3=1.3449        O69-C4=1.3733        O70-C31=1.3599       O70-C37=1.3686       
 C  H  Rav=1.0786 sigma=0.0014  Rmin=1.0754  Rmax=1.0805    16
 C  C  Rav=1.4066 sigma=0.0233  Rmin=1.3391  Rmax=1.4435    63
 O  C  Rav=1.3603 sigma=0.0110  Rmin=1.3449  Rmax=1.3733     8
 
 selected bond angles (degree)
 --------------------
C5-C1-C3=119.65                H51-C1-C3=120.47               H51-C1-C5=119.88               C13-C2-C7=121.40               
H59-C2-C7=120.71               H59-C2-C13=117.90              H60-C3-C1=123.58               O69-C3-C1=125.26               
O69-C3-H60=111.16              C19-C4-C13=121.24              O69-C4-C13=118.63              O69-C4-C19=120.13              
C19-C5-C1=115.46               C24-C5-C1=124.14               C24-C5-C19=120.40              H61-C6-C30=123.72              
O67-C6-C30=125.02              O67-C6-H61=111.26              C35-C7-C2=122.15               H62-C7-C2=118.95               
H62-C7-C35=118.91              C40-C8-C34=121.28              H52-C8-C34=118.20              H52-C8-C40=120.52              
C35-C9-C30=124.80              C36-C9-C30=115.09              C36-C9-C35=120.12              C38-C10-C36=121.50             
O67-C10-C36=120.86             O67-C10-C38=117.64             
 
 selected dihedral angles (degree)
 ---------------------------------
H60-C3-C1-C5=180.00           H60-C3-C1-H51=  0.00          O69-C3-C1-C5=  0.00           O69-C3-C1-H51=180.00          
C19-C5-C1-C3=  0.00           C19-C5-C1-H51=180.00          C24-C5-C1-C3=180.00           C24-C5-C1-H51=  0.00          
C35-C7-C2-C13=  0.00          C35-C7-C2-H59=180.00          H62-C7-C2-C13=180.00          H62-C7-C2-H59=  0.00          
           -------------------------------------------------
          |                Final Singlepoint                |
           -------------------------------------------------

          ...................................................
          :                      SETUP                      :
          :.................................................:
          :  # basis functions                 232          :
          :  # atomic orbitals                 232          :
          :  # shells                          124          :
          :  # electrons                       240          :
          :  max. iterations                   250          :
          :  Hamiltonian                  GFN2-xTB          :
          :  restarted?                      false          :
          :  GBSA solvation                  false          :
          :  PC potential                    false          :
          :  electronic temp.          300.0000000     K    :
          :  accuracy                    1.0000000          :
          :  -> integral cutoff          0.2500000E+02      :
          :  -> integral neglect         0.1000000E-07      :
          :  -> SCF convergence          0.1000000E-05 Eh   :
          :  -> wf. convergence          0.1000000E-03 e    :
          :  Broyden damping             0.4000000          :
          :  net charge                          0          :
          :  unpaired electrons                  0          :
          ...................................................

 iter      E             dE          RMSdq      gap      omega  full diag
   1   -134.1055098 -0.134106E+03  0.262E-05    1.02       0.0  T
   2   -134.1055098  0.103171E-10  0.224E-05    1.02     533.5  T
   3   -134.1055098 -0.253806E-10  0.123E-05    1.02     969.5  T

   *** convergence criteria satisfied after 3 iterations ***

         #    Occupation            Energy/Eh            Energy/eV
      -------------------------------------------------------------
         1        2.0000           -0.7422863             -20.1986
       ...           ...                  ...                  ...
       114        2.0000           -0.3944067             -10.7324
       115        2.0000           -0.3928593             -10.6902
       116        2.0000           -0.3850900             -10.4788
       117        2.0000           -0.3723279             -10.1316
       118        2.0000           -0.3672898              -9.9945
       119        2.0000           -0.3539956              -9.6327
       120        2.0000           -0.3212591              -8.7419 (HOMO)
       121                         -0.2836051              -7.7173 (LUMO)
       122                         -0.2713440              -7.3836
       123                         -0.2627112              -7.1487
       124                         -0.2565651              -6.9815
       125                         -0.2494367              -6.7875
       ...                                ...                  ...
       232                          0.7751973              21.0942
      -------------------------------------------------------------
                  HL-Gap            0.0376540 Eh            1.0246 eV
             Fermi-level           -0.3024321 Eh           -8.2296 eV

 SCC (total)                   0 d,  0 h,  0 min,  0.097 sec
 SCC setup                      ...        0 min,  0.001 sec (  1.031%)
 Dispersion                     ...        0 min,  0.002 sec (  2.062%)
 classical contributions        ...        0 min,  0.000 sec (  0.000%)
 integral evaluation            ...        0 min,  0.012 sec ( 12.371%)
 iterations                     ...        0 min,  0.040 sec ( 41.237%)
 molecular gradient             ...        0 min,  0.040 sec ( 41.237%)
 printout                       ...        0 min,  0.002 sec (  2.062%)

         :::::::::::::::::::::::::::::::::::::::::::::::::::::
         ::                     SUMMARY                     ::
         :::::::::::::::::::::::::::::::::::::::::::::::::::::
         :: total energy            -131.801193711577 Eh    ::
         :: gradient norm              0.000255920137 Eh/a0 ::
         :: HOMO-LUMO gap              1.024617442286 eV    ::
         ::.................................................::
         :: SCC energy              -134.107450436225 Eh    ::
         :: -> isotropic ES            0.042189389468 Eh    ::
         :: -> anisotropic ES          0.008716188991 Eh    ::
         :: -> anisotropic XC          0.035556106311 Eh    ::
         :: -> dispersion             -0.131015233977 Eh    ::
         :: repulsion energy           2.306256724648 Eh    ::
         :: add. restraining           0.000000000000 Eh    ::
         :: total charge              -0.000000000000 e     ::
         :::::::::::::::::::::::::::::::::::::::::::::::::::::

           -------------------------------------------------
          |                Property Printout                |
           -------------------------------------------------

    * Orbital Energies and Occupations

         #    Occupation            Energy/Eh            Energy/eV
      -------------------------------------------------------------
         1        2.0000           -0.7422863             -20.1986
       ...           ...                  ...                  ...
       108        2.0000           -0.4138902             -11.2625
       109        2.0000           -0.4122437             -11.2177
       110        2.0000           -0.4095028             -11.1431
       111        2.0000           -0.4033313             -10.9752
       112        2.0000           -0.4017513             -10.9322
       113        2.0000           -0.3970594             -10.8045
       114        2.0000           -0.3944067             -10.7324
       115        2.0000           -0.3928593             -10.6902
       116        2.0000           -0.3850900             -10.4788
       117        2.0000           -0.3723279             -10.1316
       118        2.0000           -0.3672898              -9.9945
       119        2.0000           -0.3539956              -9.6327
       120        2.0000           -0.3212591              -8.7419 (HOMO)
       121                         -0.2836051              -7.7173 (LUMO)
       122                         -0.2713440              -7.3836
       123                         -0.2627112              -7.1487
       124                         -0.2565651              -6.9815
       125                         -0.2494367              -6.7875
       126                         -0.2416671              -6.5761
       127                         -0.2335773              -6.3560
       128                         -0.2238950              -6.0925
       129                         -0.2219087              -6.0384
       130                         -0.2175355              -5.9194
       131                         -0.2125322              -5.7833
       ...                                ...                  ...
       232                          0.7751973              21.0942
      -------------------------------------------------------------
                  HL-Gap            0.0376540 Eh            1.0246 eV
             Fermi-level           -0.3024321 Eh           -8.2296 eV

     #   Z          covCN         q      C6AA      α(0)
     1   6 C        2.904    -0.066    29.637     8.926
     2   6 C        2.911    -0.035    28.876     8.812
     3   6 C        2.813     0.101    25.747     8.314
     4   6 C        2.885     0.121    25.350     8.254
     5   6 C        2.985     0.019    27.575     8.614
     6   6 C        2.814     0.096    25.861     8.332
     7   6 C        2.912    -0.038    28.946     8.822
     8   6 C        2.913    -0.035    28.864     8.810
     9   6 C        2.981     0.007    27.851     8.657
    10   6 C        2.884     0.132    25.112     8.216
    11   6 C        2.995    -0.014    28.340     8.733
    12   6 C        2.975     0.001    27.992     8.679
    13   6 C        2.976    -0.017    28.437     8.747
    14   6 C        2.989     0.002    27.971     8.675
    15   6 C        2.992    -0.002    28.072     8.691
    16   6 C        2.914    -0.063    29.572     8.917
    17   6 C        2.980     0.012    27.733     8.638
    18   6 C        2.918    -0.047    29.174     8.857
    19   6 C        2.992    -0.016    28.394     8.741
    20   6 C        2.980     0.017    27.617     8.620
    21   6 C        2.991    -0.005    28.141     8.702
    22   6 C        2.992    -0.004    28.110     8.697
    23   6 C        2.993    -0.002    28.059     8.689
    24   6 C        2.914    -0.073    29.828     8.956
    25   6 C        2.887     0.123    25.299     8.246
    26   6 C        2.991    -0.020    28.494     8.756
    27   6 C        2.814     0.098    25.816     8.325
    28   6 C        2.991    -0.004    28.121     8.699
    29   6 C        2.992     0.000    28.012     8.682
    30   6 C        2.903    -0.065    29.619     8.924
    31   6 C        2.875     0.138    24.982     8.194
    32   6 C        2.998     0.003    27.942     8.671
    33   6 C        2.991     0.004    27.932     8.669
    34   6 C        2.979    -0.014    28.359     8.735
    35   6 C        2.975    -0.003    28.103     8.696
    36   6 C        2.992    -0.013    28.325     8.730
    37   6 C        2.878     0.136    25.023     8.201
    38   6 C        2.916    -0.075    29.882     8.964
    39   6 C        2.977     0.004    27.941     8.671
    40   6 C        2.915    -0.037    28.919     8.818
    41   6 C        2.992    -0.000    28.030     8.685
    42   6 C        2.990    -0.000    28.027     8.684
    43   6 C        2.993    -0.007    28.180     8.708
    44   6 C        2.918    -0.031    28.780     8.797
    45   6 C        2.918    -0.058    29.451     8.899
    46   6 C        2.997    -0.004    28.115     8.698
    47   6 C        2.903    -0.066    29.639     8.927
    48   6 C        2.993    -0.003    28.102     8.696
    49   6 C        2.989    -0.008    28.202     8.711
    50   6 C        2.990    -0.014    28.348     8.734
    51   1 H        0.926     0.048     2.345     2.395
    52   1 H        0.926     0.041     2.441     2.443
    53   1 H        0.926     0.045     2.388     2.417
    54   1 H        0.926     0.036     2.501     2.473
    55   1 H        0.926     0.048     2.341     2.393
    56   1 H        0.926     0.052     2.297     2.370
    57   1 H        0.926     0.034     2.529     2.487
    58   1 H        0.926     0.037     2.496     2.470
    59   1 H        0.926     0.038     2.478     2.462
    60   1 H        0.926     0.055     2.253     2.347
    61   1 H        0.926     0.050     2.322     2.383
    62   1 H        0.926     0.030     2.583     2.513
    63   1 H        0.926     0.043     2.408     2.427
    64   1 H        0.926     0.044     2.397     2.421
    65   1 H        0.926     0.031     2.575     2.509
    66   1 H        0.926     0.044     2.391     2.418
    67   8 O        1.709    -0.214    17.551     5.656
    68   8 O        1.709    -0.205    17.420     5.635
    69   8 O        1.708    -0.203    17.373     5.628
    70   8 O        1.709    -0.228    17.780     5.693

 Mol. C6AA /au·bohr⁶  :      93501.827709
 Mol. C8AA /au·bohr⁸  :    2504483.971307
 Mol. α(0) /au        :        495.158073


Wiberg/Mayer (AO) data.
largest (>0.10) Wiberg bond orders for each atom

 ---------------------------------------------------------------------------
     #   Z sym  total        # sym  WBO       # sym  WBO       # sym  WBO
 ---------------------------------------------------------------------------
     1   6 C    3.966 --     3 C    1.705     5 C    1.138    51 H    0.967
     2   6 C    3.957 --     7 C    1.649    13 C    1.198    59 H    0.968
     3   6 C    3.911 --     1 C    1.705    69 O    1.108    60 H    0.958
     4   6 C    3.842 --    13 C    1.340    19 C    1.261    69 O    1.029
     5   6 C    3.937 --    24 C    1.406    19 C    1.238     1 C    1.138
     6   6 C    3.884 --    30 C    1.704    67 O    1.093    61 H    0.960
     7   6 C    3.969 --     2 C    1.649    35 C    1.203    62 H    0.963
     8   6 C    3.957 --    40 C    1.593    34 C    1.240    52 H    0.968
     9   6 C    3.917 --    35 C    1.330    36 C    1.243    30 C    1.148
    10   6 C    3.891 --    38 C    1.464    36 C    1.230    67 O    1.031
    11   6 C    3.976 --    39 C    1.270    37 C    1.259    32 C    1.215
    12   6 C    3.960 --    33 C    1.304    40 C    1.255    39 C    1.187
    13   6 C    3.971 --     4 C    1.340    41 C    1.211     2 C    1.198
    14   6 C    3.971 --    41 C    1.273    42 C    1.256    35 C    1.219
    15   6 C    3.976 --    36 C    1.262    42 C    1.248    43 C    1.243
    16   6 C    3.959 --    37 C    1.428    44 C    1.366    53 H    0.968
    17   6 C    3.954 --    38 C    1.283    43 C    1.263    45 C    1.249
    18   6 C    3.973 --    44 C    1.509    39 C    1.312    54 H    0.963
    19   6 C    3.980 --     4 C    1.261    46 C    1.247     5 C    1.238
    20   6 C    3.964 --    45 C    1.505    50 C    1.175    47 C    1.130
    21   6 C    3.979 --    41 C    1.261    46 C    1.257    48 C    1.231
    22   6 C    3.961 --    48 C    1.298    42 C    1.241    49 C    1.204
    23   6 C    3.970 --    49 C    1.279    50 C    1.238    43 C    1.233
    24   6 C    3.969 --     5 C    1.406    31 C    1.345    55 H    0.966
    25   6 C    3.858 --    50 C    1.329    34 C    1.273    68 O    1.038
    26   6 C    3.980 --    31 C    1.300    46 C    1.245    32 C    1.186
    27   6 C    3.912 --    47 C    1.718    68 O    1.097    56 H    0.959
    28   6 C    3.981 --    32 C    1.330    48 C    1.210    33 C    1.207
    29   6 C    3.974 --    49 C    1.262    33 C    1.245    34 C    1.242
    30   6 C    3.976 --     6 C    1.704     9 C    1.148    63 H    0.961
    31   6 C    3.877 --    24 C    1.345    26 C    1.300    70 O    1.060
    32   6 C    3.959 --    28 C    1.330    11 C    1.215    26 C    1.186
    33   6 C    3.984 --    12 C    1.304    29 C    1.245    28 C    1.207
    34   6 C    3.970 --    25 C    1.273    29 C    1.242     8 C    1.240
    35   6 C    3.973 --     9 C    1.330    14 C    1.219     7 C    1.203
    36   6 C    3.965 --    15 C    1.262     9 C    1.243    10 C    1.230
    37   6 C    3.917 --    16 C    1.428    11 C    1.259    70 O    1.041
    38   6 C    3.948 --    10 C    1.464    17 C    1.283    64 H    0.966
    39   6 C    3.965 --    18 C    1.312    11 C    1.270    12 C    1.187
    40   6 C    3.973 --     8 C    1.593    12 C    1.255    57 H    0.962
    41   6 C    3.966 --    14 C    1.273    21 C    1.261    13 C    1.211
    42   6 C    3.979 --    14 C    1.256    15 C    1.248    22 C    1.241
    43   6 C    3.981 --    17 C    1.263    15 C    1.243    23 C    1.233
    44   6 C    3.972 --    18 C    1.509    16 C    1.366    58 H    0.971
    45   6 C    3.968 --    20 C    1.505    17 C    1.249    65 H    0.967
    46   6 C    3.975 --    21 C    1.257    19 C    1.247    26 C    1.245
    47   6 C    3.970 --    27 C    1.718    20 C    1.130    66 H    0.967
    48   6 C    3.963 --    22 C    1.298    21 C    1.231    28 C    1.210
    49   6 C    3.982 --    23 C    1.279    29 C    1.262    22 C    1.204
    50   6 C    3.975 --    25 C    1.329    23 C    1.238    20 C    1.175
    51   1 H    0.997 --     1 C    0.967
    52   1 H    0.997 --     8 C    0.968
    53   1 H    0.997 --    16 C    0.968
    54   1 H    0.998 --    18 C    0.963
    55   1 H    0.996 --    24 C    0.966
    56   1 H    0.996 --    27 C    0.959
    57   1 H    0.998 --    40 C    0.962
    58   1 H    0.998 --    44 C    0.971
    59   1 H    0.997 --     2 C    0.968
    60   1 H    0.996 --     3 C    0.958
    61   1 H    0.996 --     6 C    0.960
    62   1 H    0.998 --     7 C    0.963
    63   1 H    0.998 --    30 C    0.961
    64   1 H    0.997 --    38 C    0.966
    65   1 H    0.998 --    45 C    0.967
    66   1 H    0.998 --    47 C    0.967
    67   8 O    2.348 --     6 C    1.093    10 C    1.031
    68   8 O    2.363 --    27 C    1.097    25 C    1.038
    69   8 O    2.363 --     3 C    1.108     4 C    1.029
    70   8 O    2.339 --    31 C    1.060    37 C    1.041
 ---------------------------------------------------------------------------

Topologies differ in total number of bonds
Writing topology from bond orders to xtbtopo.mol

molecular dipole:
                 x           y           z       tot (Debye)
 q only:       -0.040       0.275       0.000
   full:       -0.050       0.386       0.000       0.989
molecular quadrupole (traceless):
                xx          xy          yy          xz          yz          zz
 q only:        3.578     -12.677      10.749      -0.001       0.000     -14.328
  q+dip:       16.257     -13.571      19.342      -0.001      -0.000     -35.599
   full:        6.474     -14.620      11.262      -0.001      -0.000     -17.736

           -------------------------------------------------
          |                Geometry Summary                 |
           -------------------------------------------------

      molecular mass/u    :      680.6614667
   center of mass at/Å    :        0.0001216       0.0035243       0.0000017
  moments of inertia/u·Å² :        0.7017599E+04   0.9272108E+04   0.1628971E+05
rotational constants/cm⁻¹ :        0.2402194E-02   0.1818101E-02   0.1034864E-02

 * 83 selected distances

     #   Z          #   Z                                           value/Å
     1   6 C        3   6 C                                       1.3412624
     2   6 C        7   6 C                                       1.3525063
     2   6 C       13   6 C                                       1.4253777
     4   6 C       13   6 C                                       1.3953034
     4   6 C       19   6 C                                       1.4096548
     5   6 C       19   6 C                                       1.4178125
     5   6 C       24   6 C                                       1.3860363
     6   6 C       30   6 C                                       1.3402364
    24   6 C       31   6 C                                       1.3946846
    26   6 C       31   6 C                                       1.3983033
    11   6 C       32   6 C                                       1.4158215
    26   6 C       32   6 C                                       1.4223356
    28   6 C       32   6 C                                       1.3916981
    12   6 C       33   6 C                                       1.4115299
    28   6 C       33   6 C                                       1.4233012
    29   6 C       33   6 C                                       1.4193805
     8   6 C       34   6 C                                       1.4164289
    25   6 C       34   6 C                                       1.4076460
    29   6 C       34   6 C                                       1.4183047
     7   6 C       35   6 C                                       1.4279308
     9   6 C       35   6 C                                       1.4008969
    14   6 C       35   6 C                                       1.4273455
     9   6 C       36   6 C                                       1.4194092
    10   6 C       36   6 C                                       1.4174836
    15   6 C       36   6 C                                       1.4102634
    11   6 C       37   6 C                                       1.4117759
    16   6 C       37   6 C                                       1.3785414
    10   6 C       38   6 C                                       1.3732112
    17   6 C       38   6 C                                       1.4075569
    11   6 C       39   6 C                                       1.4150872
    18   6 C       39   6 C                                       1.4068648
     8   6 C       40   6 C                                       1.3601546
    12   6 C       40   6 C                                       1.4176334
    13   6 C       41   6 C                                       1.4261471
    14   6 C       41   6 C                                       1.4135454
    21   6 C       41   6 C                                       1.4122681
    14   6 C       42   6 C                                       1.4165639
    15   6 C       42   6 C                                       1.4139511
    22   6 C       42   6 C                                       1.4159532
    15   6 C       43   6 C                                       1.4162033
    17   6 C       43   6 C                                       1.4132765
    23   6 C       43   6 C                                       1.4180145
    16   6 C       44   6 C                                       1.3943484
    18   6 C       44   6 C                                       1.3730599
    17   6 C       45   6 C                                       1.4158451
    20   6 C       45   6 C                                       1.3686314
    19   6 C       46   6 C                                       1.4097833
    21   6 C       46   6 C                                       1.4095878
    26   6 C       46   6 C                                       1.4109203
    27   6 C       47   6 C                                       1.3391228
    21   6 C       48   6 C                                       1.4166671
    22   6 C       48   6 C                                       1.3992281
    28   6 C       48   6 C                                       1.4212374
    22   6 C       49   6 C                                       1.4227703
    23   6 C       49   6 C                                       1.4063490
    29   6 C       49   6 C                                       1.4138330
    20   6 C       50   6 C                                       1.4318136 (max)
    23   6 C       50   6 C                                       1.4144140
    25   6 C       50   6 C                                       1.3962777
     1   6 C       51   1 H                                       1.0765965
     8   6 C       52   1 H                                       1.0792427
    16   6 C       53   1 H                                       1.0779647
    18   6 C       54   1 H                                       1.0776270
    24   6 C       55   1 H                                       1.0783759
    27   6 C       56   1 H                                       1.0803677
    40   6 C       57   1 H                                       1.0781681
    44   6 C       58   1 H                                       1.0799011
     2   6 C       59   1 H                                       1.0793412
     3   6 C       60   1 H                                       1.0805319
     6   6 C       61   1 H                                       1.0799981
     7   6 C       62   1 H                                       1.0786688
    30   6 C       63   1 H                                       1.0754118 (min)
    38   6 C       64   1 H                                       1.0788558
    45   6 C       65   1 H                                       1.0800855
    47   6 C       66   1 H                                       1.0770220
     6   6 C       67   8 O                                       1.3482089
    10   6 C       67   8 O                                       1.3701258
    25   6 C       68   8 O                                       1.3694267
    27   6 C       68   8 O                                       1.3476916
     3   6 C       69   8 O                                       1.3449153
     4   6 C       69   8 O                                       1.3733177
    31   6 C       70   8 O                                       1.3598891
    37   6 C       70   8 O                                       1.3686154

 * 3 distinct bonds (by element types)

   Z      Z             #   av. dist./Å        max./Å        min./Å
   1 H    6 C          16     1.0786349     1.0805319     1.0754118
   6 C    6 C          59     1.4042643     1.4318136     1.3391228
   6 C    8 O           8     1.3602738     1.3733177     1.3449153


optimized geometry written to: xtbopt.xyz


           -------------------------------------------------
          | TOTAL ENERGY             -131.801193711577 Eh   |
          | GRADIENT NORM               0.000255920137 Eh/α |
          | HOMO-LUMO GAP               1.024617442286 eV   |
           -------------------------------------------------

------------------------------------------------------------------------
 * finished run on 2025/12/08 at 00:34:35.669     
------------------------------------------------------------------------
 total:
 * wall-time:     0 d,  0 h,  0 min,  1.360 sec
 *  cpu-time:     0 d,  0 h,  0 min,  5.125 sec
 * ratio c/w:     3.768 speedup
 SCF:
 * wall-time:     0 d,  0 h,  0 min,  0.248 sec
 *  cpu-time:     0 d,  0 h,  0 min,  0.938 sec
 * ratio c/w:     3.780 speedup
 ANC optimizer:
 * wall-time:     0 d,  0 h,  0 min,  1.049 sec
 *  cpu-time:     0 d,  0 h,  0 min,  3.969 sec
 * ratio c/w:     3.783 speedup

normal termination of xtb
