      -----------------------------------------------------------      
     |                   =====================                   |     
     |                           x T B                           |     
     |                   =====================                   |     
     |                         S. Grimme                         |     
     |          Mulliken Center for Theoretical Chemistry        |     
     |                    University of Bonn                     |     
      -----------------------------------------------------------      

   * xtb version 6.7.1pre (5071a88) compiled by 'Marcel@Raven' on 2024-07-23

   xtb is free software: you can redistribute it and/or modify it under
   the terms of the GNU Lesser General Public License as published by
   the Free Software Foundation, either version 3 of the License, or
   (at your option) any later version.
   
   xtb is distributed in the hope that it will be useful,
   but WITHOUT ANY WARRANTY; without even the implied warranty of
   MERCHANTABILITY or FITNESS FOR A PARTICULAR PURPOSE.  See the
   GNU Lesser General Public License for more details.
   
   Cite this work as:
   * C. Bannwarth, E. Caldeweyher, S. Ehlert, A. Hansen, P. Pracht,
     J. Seibert, S. Spicher, S. Grimme, WIREs Comput. Mol. Sci., 2020, 11,
     e01493. DOI: 10.1002/wcms.1493
   
   for GFN2-xTB:
   * C. Bannwarth, S. Ehlert and S. Grimme., J. Chem. Theory Comput., 2019,
     15, 1652-1671. DOI: 10.1021/acs.jctc.8b01176
   for GFN1-xTB:
   * S. Grimme, C. Bannwarth, P. Shushkov, J. Chem. Theory Comput., 2017,
     13, 1989-2009. DOI: 10.1021/acs.jctc.7b00118
   for GFN0-xTB:
   * P. Pracht, E. Caldeweyher, S. Ehlert, S. Grimme, ChemRxiv, 2019, preprint.
     DOI: 10.26434/chemrxiv.8326202.v1
   for GFN-FF:
   * S. Spicher and S. Grimme, Angew. Chem. Int. Ed., 2020, 59, 15665-15673.
     DOI: 10.1002/anie.202004239
   
   for ALPB and GBSA implicit solvation:
   * S. Ehlert, M. Stahn, S. Spicher, S. Grimme, J. Chem. Theory Comput.,
     2021, 17, 4250-4261. DOI: 10.1021/acs.jctc.1c00471
   
   for ddCOSMO and CPCM-X implicit solvation:
   * M. Stahn, S. Ehlert, S. Grimme, J. Phys. Chem. A,
     2023, XX, XXXX-XXXX. DOI: 10.1021/acs.jpca.3c04382
   
   for DFT-D4:
   * E. Caldeweyher, C. Bannwarth and S. Grimme, J. Chem. Phys., 2017,
     147, 034112. DOI: 10.1063/1.4993215
   * E. Caldeweyher, S. Ehlert, A. Hansen, H. Neugebauer, S. Spicher,
     C. Bannwarth and S. Grimme, J. Chem. Phys., 2019, 150, 154122.
     DOI: 10.1063/1.5090222
   * E. Caldeweyher, J.-M. Mewes, S. Ehlert and S. Grimme, Phys. Chem. Chem. Phys.
     2020, 22, 8499-8512. DOI: 10.1039/D0CP00502A
   
   for sTDA-xTB:
   * S. Grimme and C. Bannwarth, J. Chem. Phys., 2016, 145, 054103.
     DOI: 10.1063/1.4959605
   
   in the mass-spec context:
   * V. Asgeirsson, C. Bauer and S. Grimme, Chem. Sci., 2017, 8, 4879.
     DOI: 10.1039/c7sc00601b
   * J. Koopman and S. Grimme, ACS Omega 2019, 4, 12, 15120-15133.
     DOI: 10.1021/acsomega.9b02011
   
   for metadynamics refer to:
   * S. Grimme, J. Chem. Theory Comput., 2019, 155, 2847-2862
     DOI: 10.1021/acs.jctc.9b00143
   
   for SPH calculations refer to:
   * S. Spicher and S. Grimme, J. Chem. Theory Comput., 2021, 17, 1701-1714
     DOI: 10.1021/acs.jctc.0c01306
   
   for ONIOM refer to:
   * C. Plett, A. Katbashev, S. Ehlert, S. Grimme, M. Bursch,
     Phys. Chem. Chem. Phys., 2023, 25, 17860-17868. DOI: 10.1039/D3CP02178E
   
   for DIPRO refer to:
   * J. Kohn, N. Gildemeister, S. Grimme, D. Fazzi, A. Hansen,
     J. Chem. Phys., 2023, just accepted.
   
   for PTB refer to:
   * S. Grimme, M. Mueller, A. Hansen, J. Chem. Phys., 2023, 158, 124111.
     DOI: 10.1063/5.0137838
   
   with help from (in alphabetical order)
   P. Atkinson, C. Bannwarth, F. Bohle, G. Brandenburg, E. Caldeweyher
   M. Checinski, S. Dohm, S. Ehlert, S. Ehrlich, I. Gerasimov, C. Hölzer
   A. Katbashev, J. Kohn, J. Koopman, C. Lavigne, S. Lehtola, F. März, M. Müller,
   F. Musil, H. Neugebauer, J. Pisarek, C. Plett, P. Pracht, F. Pultar,
   J. Seibert, P. Shushkov, S. Spicher, M. Stahn, M. Steiner, T. Strunk,
   J. Stückrath, T. Rose, and J. Unsleber
   
 * started run on 2025/12/08 at 00:34:18.459     
   ID    Z sym.   atoms
    1    6 C      1-54
    2    1 H      55-74

           -------------------------------------------------
          |                Calculation Setup                |
           -------------------------------------------------

          program call               : xtb "C:\Users\LENOVO GAMING\Documents\GitHub\molecular-conductivity-sim\dataset\1nm-0pure-0percent.xyz" --opt --parallel 4
          coordinate file            : C:\Users\LENOVO GAMING\Documents\GitHub\molecular-conductivity-sim\dataset\1nm-0pure-0percent.xyz
          omp threads                :                     4


           -------------------------------------------------
          |                 G F N 2 - x T B                 |
           -------------------------------------------------

        Reference                      10.1021/acs.jctc.8b01176
      * Hamiltonian:
        H0-scaling (s, p, d)           1.850000    2.230000    2.230000
        zeta-weighting                 0.500000
      * Dispersion:
        s8                             2.700000
        a1                             0.520000
        a2                             5.000000
        s9                             5.000000
      * Repulsion:
        kExp                           1.500000    1.000000
        rExp                           1.000000
      * Coulomb:
        alpha                          2.000000
        third order                    shell-resolved
        anisotropic                    true
        a3                             3.000000
        a5                             4.000000
        cn-shift                       1.200000
        cn-exp                         4.000000
        max-rad                        5.000000


          ...................................................
          :                      SETUP                      :
          :.................................................:
          :  # basis functions                 236          :
          :  # atomic orbitals                 236          :
          :  # shells                          128          :
          :  # electrons                       236          :
          :  max. iterations                   250          :
          :  Hamiltonian                  GFN2-xTB          :
          :  restarted?                      false          :
          :  GBSA solvation                  false          :
          :  PC potential                    false          :
          :  electronic temp.          300.0000000     K    :
          :  accuracy                    1.0000000          :
          :  -> integral cutoff          0.2500000E+02      :
          :  -> integral neglect         0.1000000E-07      :
          :  -> SCF convergence          0.1000000E-05 Eh   :
          :  -> wf. convergence          0.1000000E-03 e    :
          :  Broyden damping             0.4000000          :
          :  net charge                          0          :
          :  unpaired electrons                  0          :
          ...................................................

 iter      E             dE          RMSdq      gap      omega  full diag
   1   -128.3946487 -0.128395E+03  0.497E+00    0.16       0.0  T
   2   -128.4214377 -0.267890E-01  0.296E+00    0.16       1.0  T
   3   -128.3236657  0.977720E-01  0.955E-01    0.15       1.0  T
   4   -128.4294478 -0.105782E+00  0.247E-01    0.17       1.0  T
   5   -128.4321006 -0.265289E-02  0.170E-01    0.16       1.0  T
   6   -128.3682429  0.638577E-01  0.684E-01    0.22       1.0  T
   7   -128.4348680 -0.666250E-01  0.317E-02    0.16       1.0  T
   8   -128.4349010 -0.330315E-04  0.190E-02    0.16       1.0  T
   9   -128.4349036 -0.257934E-05  0.996E-03    0.16       1.2  T
  10   -128.4349168 -0.131926E-04  0.178E-03    0.16       6.5  T
  11   -128.4349172 -0.391526E-06  0.528E-04    0.16      22.0  T
  12   -128.4349172 -0.223925E-07  0.207E-04    0.16      56.1  T

   *** convergence criteria satisfied after 12 iterations ***

         #    Occupation            Energy/Eh            Energy/eV
      -------------------------------------------------------------
         1        2.0000           -0.6555124             -17.8374
       ...           ...                  ...                  ...
       112        2.0000           -0.3905218             -10.6266
       113        2.0000           -0.3904896             -10.6258
       114        2.0000           -0.3896944             -10.6041
       115        2.0000           -0.3860991             -10.5063
       116        2.0000           -0.3719292             -10.1207
       117        2.0000           -0.3567735              -9.7083
       118        1.9200           -0.3261429              -8.8748 (HOMO)
       119        0.0800           -0.3201051              -8.7105 (LUMO)
       120                         -0.2860670              -7.7843
       121                         -0.2680135              -7.2930
       122                         -0.2496215              -6.7925
       123                         -0.2447738              -6.6606
       ...                                ...                  ...
       236                          0.7310813              19.8937
      -------------------------------------------------------------
                  HL-Gap            0.0060378 Eh            0.1643 eV
             Fermi-level           -0.3231240 Eh           -8.7927 eV

 SCC (total)                   0 d,  0 h,  0 min,  0.264 sec
 SCC setup                      ...        0 min,  0.001 sec (  0.379%)
 Dispersion                     ...        0 min,  0.002 sec (  0.758%)
 classical contributions        ...        0 min,  0.001 sec (  0.379%)
 integral evaluation            ...        0 min,  0.017 sec (  6.439%)
 iterations                     ...        0 min,  0.183 sec ( 69.318%)
 molecular gradient             ...        0 min,  0.058 sec ( 21.970%)
 printout                       ...        0 min,  0.002 sec (  0.758%)

         :::::::::::::::::::::::::::::::::::::::::::::::::::::
         ::                     SUMMARY                     ::
         :::::::::::::::::::::::::::::::::::::::::::::::::::::
         :: total energy            -126.099742220570 Eh    ::
         :: gradient norm              0.034322534679 Eh/a0 ::
         :: HOMO-LUMO gap              0.164297446300 eV    ::
         ::.................................................::
         :: SCC energy              -128.437078040114 Eh    ::
         :: -> isotropic ES            0.001891886913 Eh    ::
         :: -> anisotropic ES          0.009541085469 Eh    ::
         :: -> anisotropic XC          0.059780197714 Eh    ::
         :: -> dispersion             -0.136459936344 Eh    ::
         :: repulsion energy           2.337335819544 Eh    ::
         :: add. restraining           0.000000000000 Eh    ::
         :: total charge              -0.000000000000 e     ::
         :::::::::::::::::::::::::::::::::::::::::::::::::::::

      ----------------------------------------------------------- 
     |                   =====================                   |
     |                        A N C O P T                        |
     |                   =====================                   |
     |               Approximate Normal Coordinate               |
     |                Rational Function Optimizer                |
      ----------------------------------------------------------- 
      ----------------------------------------------------------- 
     |                   =====================                   |
     |                        A N C O P T                        |
     |                   =====================                   |
     |               Approximate Normal Coordinate               |
     |                Rational Function Optimizer                |
      ----------------------------------------------------------- 

          ...................................................
          :                      SETUP                      :
          :.................................................:
          :   optimization level            normal          :
          :   max. optcycles                   222          :
          :   ANC micro-cycles                  20          :
          :   degrees of freedom               216          :
          :.................................................:
          :   RF solver                   davidson          :
          :   write xtbopt.log                true          :
          :   linear?                        false          :
          :   energy convergence         0.5000000E-05 Eh   :
          :   grad. convergence          0.1000000E-02 Eh/α :
          :   maxmium RF displ.          1.0000000          :
          :   Hlow (freq-cutoff)         0.1000000E-01      :
          :   Hmax (freq-cutoff)         5.0000000          :
          :   S6 in model hess.         20.0000000          :
          ...................................................

generating ANC from exact Hessian ...
Using Lindh-Hessian (1995)
 Shifting diagonal of input Hessian by   9.695505583563965E-003
 Lowest  eigenvalues of input Hessian
    0.000000    0.000000    0.000000    0.000000    0.000000    0.000000
    0.010000    0.010293    0.010735    0.011010    0.011345    0.012877
    0.013436    0.013986    0.014730    0.016222    0.016894    0.017203
 Highest eigenvalues
    2.017291    2.017815    2.036412    2.086431    2.088751    2.114313
 

........................................................................
.............................. CYCLE    1 ..............................
........................................................................

 iter      E             dE          RMSdq      gap      omega  full diag
   1   -128.4349172 -0.128435E+03  0.725E-05    0.16       0.0  T
   2   -128.4349170  0.146117E-06  0.101E-03    0.16      11.5  T
   3   -128.4349172 -0.146744E-06  0.246E-05    0.16     472.2  T
   4   -128.4349172 -0.481748E-10  0.954E-06    0.16    1218.3  T
     SCC iter.                  ...        0 min,  0.060 sec
     gradient                   ...        0 min,  0.050 sec
 * total energy  :  -126.0997422 Eh     change       -0.2026553E-08 Eh
   gradient norm :     0.0343225 Eh/α   predicted     0.0000000E+00 (-100.00%)
   displ. norm   :     0.3907685 α      lambda       -0.1029497E-01
   maximum displ.:     0.3186167 α      in ANC's #35, #29, #50, ...

........................................................................
.............................. CYCLE    2 ..............................
........................................................................

 iter      E             dE          RMSdq      gap      omega  full diag
   1   -128.5389239 -0.128539E+03  0.125E-01    0.16       0.0  T
   2   -128.5389284 -0.449958E-05  0.756E-02    0.16       1.0  T
   3   -128.5388814  0.469767E-04  0.237E-02    0.16       1.0  T
   4   -128.5383322  0.549250E-03  0.648E-02    0.16       1.0  T
   5   -128.5389239 -0.591721E-03  0.790E-03    0.16       1.5  T
   6   -128.5389320 -0.815685E-05  0.171E-03    0.16       6.8  T
   7   -128.5389322 -0.198020E-06  0.525E-04    0.16      22.1  T
   8   -128.5389322 -0.465158E-08  0.268E-04    0.16      43.4  T
     SCC iter.                  ...        0 min,  0.119 sec
     gradient                   ...        0 min,  0.053 sec
 * total energy  :  -126.1068715 Eh     change       -0.7129230E-02 Eh
   gradient norm :     0.0116344 Eh/α   predicted    -0.5933524E-02 ( -16.77%)
   displ. norm   :     0.2757431 α      lambda       -0.2612283E-02
   maximum displ.:     0.2221669 α      in ANC's #35, #29, #15, ...

........................................................................
.............................. CYCLE    3 ..............................
........................................................................

 iter      E             dE          RMSdq      gap      omega  full diag
   1   -128.5987861 -0.128599E+03  0.803E-02    0.16       0.0  T
   2   -128.5987876 -0.154092E-05  0.496E-02    0.16       1.0  T
   3   -128.5987417  0.459840E-04  0.213E-02    0.16       1.0  T
   4   -128.5987882 -0.465743E-04  0.511E-03    0.16       2.3  T
   5   -128.5987083  0.799660E-04  0.242E-02    0.16       1.0  T
   6   -128.5987916 -0.833026E-04  0.120E-03    0.16       9.7  T
   7   -128.5987917 -0.103516E-06  0.402E-04    0.16      28.9  T
   8   -128.5987917 -0.615415E-08  0.167E-04    0.16      69.6  T
     SCC iter.                  ...        0 min,  0.121 sec
     gradient                   ...        0 min,  0.052 sec
 * total energy  :  -126.1082800 Eh     change       -0.1408533E-02 Eh
   gradient norm :     0.0033783 Eh/α   predicted    -0.1405646E-02 (  -0.20%)
   displ. norm   :     0.0373989 α      lambda       -0.4511025E-04
   maximum displ.:     0.0233763 α      in ANC's #15, #29, #35, ...

........................................................................
.............................. CYCLE    4 ..............................
........................................................................

 iter      E             dE          RMSdq      gap      omega  full diag
   1   -128.6021589 -0.128602E+03  0.116E-02    0.16       0.0  T
   2   -128.6021590 -0.405801E-07  0.745E-03    0.16       1.6  T
   3   -128.6021565  0.249338E-05  0.443E-03    0.16       2.6  T
   4   -128.6021497  0.676331E-05  0.815E-03    0.16       1.4  T
   5   -128.6021590 -0.929179E-05  0.124E-03    0.16       9.4  T
   6   -128.6021592 -0.210104E-06  0.156E-04    0.16      74.7  T
   7   -128.6021592 -0.472539E-09  0.703E-05    0.16     165.3  T
     SCC iter.                  ...        0 min,  0.108 sec
     gradient                   ...        0 min,  0.049 sec
 * total energy  :  -126.1083067 Eh     change       -0.2674488E-04 Eh
   gradient norm :     0.0014296 Eh/α   predicted    -0.2275071E-04 ( -14.93%)
   displ. norm   :     0.0134831 α      lambda       -0.3153517E-05
   maximum displ.:     0.0090437 α      in ANC's #15, #29, #75, ...

........................................................................
.............................. CYCLE    5 ..............................
........................................................................

 iter      E             dE          RMSdq      gap      omega  full diag
   1   -128.6017211 -0.128602E+03  0.502E-03    0.16       0.0  T
   2   -128.6017212 -0.554101E-08  0.311E-03    0.16       3.7  T
   3   -128.6017208  0.391400E-06  0.182E-03    0.16       6.4  T
   4   -128.6017210 -0.261560E-06  0.109E-03    0.16      10.7  T
   5   -128.6017209  0.871736E-07  0.134E-03    0.16       8.7  T
   6   -128.6017212 -0.254806E-06  0.679E-05    0.16     171.3  T
   7   -128.6017212 -0.149925E-09  0.251E-05    0.16     463.5  T
     SCC iter.                  ...        0 min,  0.109 sec
     gradient                   ...        0 min,  0.051 sec
 * total energy  :  -126.1083090 Eh     change       -0.2309020E-05 Eh
   gradient norm :     0.0004365 Eh/α   predicted    -0.2015593E-05 ( -12.71%)
   displ. norm   :     0.0042550 α      lambda       -0.4055142E-06
   maximum displ.:     0.0029233 α      in ANC's #15, #29, #35, ...

   *** GEOMETRY OPTIMIZATION CONVERGED AFTER 5 ITERATIONS ***

------------------------------------------------------------------------
 total energy gain   :        -0.0085668 Eh       -5.3758 kcal/mol
 total RMSD          :         0.0809841 a0        0.0429 Å
 total power (kW/mol):        -4.4984362 (step)  -24.4215 (real)
------------------------------------------------------------------------

 ANCopt (total)                0 d,  0 h,  0 min,  0.921 sec
 optimizer setup                ...        0 min,  0.001 sec (  0.109%)
 model hessian                  ...        0 min,  0.047 sec (  5.103%)
 ANC generation                 ...        0 min,  0.007 sec (  0.760%)
 coordinate transformation      ...        0 min,  0.001 sec (  0.109%)
 single point calculation       ...        0 min,  0.856 sec ( 92.942%)
 optimization log               ...        0 min,  0.008 sec (  0.869%)
 hessian update                 ...        0 min,  0.000 sec (  0.000%)
 rational function              ...        0 min,  0.000 sec (  0.000%)

================
 final structure:
================
74
 xtb: 6.7.1pre (5071a88)
C           -3.68463090370109        1.42032402709222        0.00000000000021
C           -1.22563418570304        1.41530368575971        0.00000000000005
C            1.22563430278430        1.41530362844295       -0.00000000000000
C            3.68463102423390        1.42032388073914        0.00000000000007
C            4.86381259536018        3.61408196849177       -0.00000000000037
C           -4.86381239965286        3.61408215273771        0.00000000000031
C           -2.44935442707293        3.55130446452713        0.00000000000004
C            0.00000010317736        3.53553262819274       -0.00000000000003
C            2.44935461568269        3.55130436589612       -0.00000000000007
C            3.65626390898152        5.68363707658078        0.00000000000042
C           -3.65626363629691        5.68363722073490       -0.00000000000048
C           -1.21642863594450        5.65303378423857       -0.00000000000006
C            1.21642887017777        5.65303373261786        0.00000000000018
C           -4.84570031918796       -5.00500380312915        0.00000000000020
C           -2.43543558918927       -4.97776178181053       -0.00000000000047
C           -0.00000006878432       -4.96787709145064       -0.00000000000006
C            2.43543543182520       -4.97776188098049        0.00000000000051
C            4.84570016204569       -5.00500400844133       -0.00000000000035
C           -3.68790929479990       -2.86705841626330       -0.00000000000019
C           -1.22545321649903       -2.83703518864670       -0.00000000000015
C            1.22545317200786       -2.83703524053221        0.00000000000009
C            3.68790923610553       -2.86705858130258        0.00000000000018
C           -4.87021918034211       -0.68651705903016       -0.00000000000013
C           -2.45917714693124       -0.71124789185070       -0.00000000000004
C            0.00000001842284       -0.71351630057924        0.00000000000000
C            2.45917719268357       -0.71124798943979        0.00000000000011
C            4.87021921766016       -0.68651726344846       -0.00000000000004
C           -3.68790918376354        2.86705857228991        0.00000000000025
C           -1.22545311032518        2.83703523644468        0.00000000000003
C            1.22545327423400        2.83703518414482       -0.00000000000001
C            3.68790934440318        2.86705843591306       -0.00000000000008
C            4.84570037876322        5.00500381756684       -0.00000000000009
C           -4.84570012746709        5.00500400335514       -0.00000000000023
C           -2.43543539391654        4.97776188505527       -0.00000000000017
C            0.00000011171613        4.96787708975851        0.00000000000001
C            2.43543562858697        4.97776178044104        0.00000000000008
C           -3.65626386375178       -5.68363706952517       -0.00000000000040
C           -1.21642884852176       -5.65303373425342       -0.00000000000029
C            1.21642865826782       -5.65303377717129        0.00000000000029
C            3.65626367054018       -5.68363722439716        0.00000000000066
C           -4.86381253962488       -3.61408195567895        0.00000000000023
C           -2.44935456735819       -3.55130435983008       -0.00000000000031
C           -0.00000003341902       -3.53553263294049       -0.00000000000005
C            2.44935448537396       -3.55130447126947        0.00000000000024
C            4.86381244409775       -3.61408216713985       -0.00000000000031
C           -3.68463095523647       -1.42032387374028       -0.00000000000009
C           -1.22563423138626       -1.41530364097107       -0.00000000000004
C            1.22563425516649       -1.41530368608436        0.00000000000004
C            3.68463097948379       -1.42032403047951        0.00000000000013
C           -4.87021916136730        0.68651726350623        0.00000000000005
C           -2.45917712784214        0.71124799316694        0.00000000000008
C            0.00000003691669        0.71351629107009        0.00000000000000
C            2.45917721074619        0.71124788842626        0.00000000000007
C            4.87021923972625        0.68651707359482       -0.00000000000004
H            5.82434645595502        3.12575577812505       -0.00000000000030
H           -5.82434628594114        3.12575600980955        0.00000000000032
H            5.78133118724931       -5.54528116788104       -0.00000000000059
H            5.82298910479533       -1.18999542363909       -0.00000000000001
H            5.78133141912631        5.54528093178288        0.00000000000005
H           -5.78133115927345        5.54528114327707       -0.00000000000019
H            5.82434632677051       -3.12575601757696       -0.00000000000053
H            5.82298914829391        1.18999520546118       -0.00000000000008
H           -5.78133136514461       -5.54528091900824        0.00000000000045
H           -5.82298907081827       -1.18999523595923       -0.00000000000020
H           -5.82434640039441       -3.12575578002716        0.00000000000042
H           -5.82298902551206        1.18999547158372       -0.00000000000001
H            3.63238554730949        6.76343758588826        0.00000000000058
H           -3.63238523082330        6.76343772749843       -0.00000000000043
H           -1.21084700280140        6.73372518912976       -0.00000000000007
H            1.21084735061381        6.73372513721528        0.00000000000027
H           -3.63238552589936       -6.76343758300896       -0.00000000000025
H           -1.21084726273897       -6.73372513667601       -0.00000000000007
H            1.21084708824588       -6.73372518423236        0.00000000000023
H            3.63238527990155       -6.76343774216092        0.00000000000044
 
 Bond Distances (Angstroems)
 ---------------------------
C1-C28=1.4467        C1-C50=1.3943        C1-C51=1.4158        C2-C29=1.4217        C2-C51=1.4203        C2-C52=1.4123        
C3-C30=1.4217        C3-C52=1.4123        C3-C53=1.4203        C4-C31=1.4467        C4-C53=1.4158        C4-C54=1.3943        
C5-C31=1.3931        C5-C32=1.3910        C5-H55=1.0775        C6-C28=1.3931        C6-C33=1.3910        C6-H56=1.0775        
C7-C28=1.4150        C7-C29=1.4171        C7-C34=1.4265        C8-C29=1.4105        C8-C30=1.4105        C8-C35=1.4323        
C9-C30=1.4171        C9-C31=1.4150        C9-C36=1.4265        C10-C32=1.3694       C10-C36=1.4102       C10-H67=1.0801       
C11-C33=1.3694       C11-C34=1.4102       C11-H68=1.0801       C12-C34=1.3935       C12-C35=1.3961       C12-H69=1.0807       
C13-C35=1.3961       C13-C36=1.3935       C13-H70=1.0807       C14-C37=1.3694       C14-C41=1.3910       C14-H63=1.0804       
C15-C37=1.4102       C15-C38=1.3935       C15-C42=1.4265       C16-C38=1.3961       C16-C39=1.3961       C16-C43=1.4323       
C17-C39=1.3935       C17-C40=1.4102       C17-C44=1.4265       C18-C40=1.3694       C18-C45=1.3910       C18-H57=1.0804       
C19-C41=1.3931       C19-C42=1.4150       C19-C46=1.4467       C20-C42=1.4171       C20-C43=1.4105       C20-C47=1.4217       
C21-C43=1.4105       C21-C44=1.4171       C21-C48=1.4217       C22-C44=1.4150       C22-C45=1.3931       C22-C49=1.4467       
C23-C46=1.3943       C23-C50=1.3730       C23-H64=1.0776       C24-C46=1.4158       C24-C47=1.4203       C24-C51=1.4225       
C25-C47=1.4123       C25-C48=1.4123       C25-C52=1.4270       C26-C48=1.4203       C26-C49=1.4158       C26-C53=1.4225       
C27-C49=1.3943       C27-C54=1.3730       C27-H58=1.0776       C28-C1=1.4467        C28-C6=1.3931        C28-C7=1.4150        
C29-C2=1.4217        C29-C7=1.4171        C29-C8=1.4105        C30-C3=1.4217        C30-C8=1.4105        C30-C9=1.4171        
C31-C4=1.4467        C31-C5=1.3931        C31-C9=1.4150        C32-C5=1.3910        C32-C10=1.3694       C32-H59=1.0804       
C33-C6=1.3910        C33-C11=1.3694       C33-H60=1.0804       C34-C7=1.4265        C34-C11=1.4102       C34-C12=1.3935       
C35-C8=1.4323        C35-C12=1.3961       C35-C13=1.3961       C36-C9=1.4265        C36-C10=1.4102       C36-C13=1.3935       
C37-C14=1.3694       C37-C15=1.4102       C37-H71=1.0801       C38-C15=1.3935       C38-C16=1.3961       C38-H72=1.0807       
C39-C16=1.3961       C39-C17=1.3935       C39-H73=1.0807       C40-C17=1.4102       C40-C18=1.3694       C40-H74=1.0801       
C41-C14=1.3910       C41-C19=1.3931       C41-H65=1.0775       C42-C15=1.4265       C42-C19=1.4150       C42-C20=1.4171       
C43-C16=1.4323       C43-C20=1.4105       C43-C21=1.4105       C44-C17=1.4265       C44-C21=1.4171       C44-C22=1.4150       
C45-C18=1.3910       C45-C22=1.3931       C45-H61=1.0775       C46-C19=1.4467       C46-C23=1.3943       C46-C24=1.4158       
C47-C20=1.4217       C47-C24=1.4203       C47-C25=1.4123       C48-C21=1.4217       C48-C25=1.4123       C48-C26=1.4203       
C49-C22=1.4467       C49-C26=1.4158       C49-C27=1.3943       C50-C1=1.3943        C50-C23=1.3730       C50-H66=1.0776       
C51-C1=1.4158        C51-C2=1.4203        C51-C24=1.4225       C52-C2=1.4123        C52-C3=1.4123        C52-C25=1.4270       
C53-C3=1.4203        C53-C4=1.4158        C53-C26=1.4225       C54-C4=1.3943        C54-C27=1.3730       C54-H62=1.0776       
H55-C5=1.0775        H56-C6=1.0775        H57-C18=1.0804       H58-C27=1.0776       H59-C32=1.0804       H60-C33=1.0804       
H61-C45=1.0775       H62-C54=1.0776       H63-C14=1.0804       H64-C23=1.0776       H65-C41=1.0775       H66-C50=1.0776       
H67-C10=1.0801       H68-C11=1.0801       H69-C12=1.0807       H70-C13=1.0807       H71-C37=1.0801       H72-C38=1.0807       
H73-C39=1.0807       H74-C40=1.0801       
 C  H  Rav=1.0793 sigma=0.0014  Rmin=1.0775  Rmax=1.0807    20
 C  C  Rav=1.4087 sigma=0.0184  Rmin=1.3694  Rmax=1.4467    71
 
 selected bond angles (degree)
 --------------------
C50-C1-C28=121.63              C51-C1-C28=120.18              C51-C1-C50=118.19              C51-C2-C29=119.72              
C52-C2-C29=119.79              C52-C2-C51=120.49              C52-C3-C30=119.79              C53-C3-C30=119.72              
C53-C3-C52=120.49              C53-C4-C31=120.18              C54-C4-C31=121.63              C54-C4-C53=118.19              
C32-C5-C31=121.68              H55-C5-C31=120.62              H55-C5-C32=117.69              C33-C6-C28=121.68              
H56-C6-C28=120.62              H56-C6-C33=117.69              C29-C7-C28=120.81              C34-C7-C28=119.48              
C34-C7-C29=119.71              C30-C8-C29=120.63              C35-C8-C29=119.68              C35-C8-C30=119.68              
C31-C9-C30=120.81              C36-C9-C30=119.71              C36-C9-C31=119.48              C36-C10-C32=120.26             
H67-C10-C32=120.97             H67-C10-C36=118.77             
 
 selected dihedral angles (degree)
 ---------------------------------

           -------------------------------------------------
          |                Final Singlepoint                |
           -------------------------------------------------

          ...................................................
          :                      SETUP                      :
          :.................................................:
          :  # basis functions                 236          :
          :  # atomic orbitals                 236          :
          :  # shells                          128          :
          :  # electrons                       236          :
          :  max. iterations                   250          :
          :  Hamiltonian                  GFN2-xTB          :
          :  restarted?                      false          :
          :  GBSA solvation                  false          :
          :  PC potential                    false          :
          :  electronic temp.          300.0000000     K    :
          :  accuracy                    1.0000000          :
          :  -> integral cutoff          0.2500000E+02      :
          :  -> integral neglect         0.1000000E-07      :
          :  -> SCF convergence          0.1000000E-05 Eh   :
          :  -> wf. convergence          0.1000000E-03 e    :
          :  Broyden damping             0.4000000          :
          :  net charge                          0          :
          :  unpaired electrons                  0          :
          ...................................................

 iter      E             dE          RMSdq      gap      omega  full diag
   1   -128.6017212 -0.128602E+03  0.119E-05    0.16       0.0  T
   2   -128.6017212 -0.184741E-11  0.720E-06    0.16    1613.8  T
   3   -128.6017212 -0.767386E-12  0.523E-06    0.16    2224.3  T

   *** convergence criteria satisfied after 3 iterations ***

         #    Occupation            Energy/Eh            Energy/eV
      -------------------------------------------------------------
         1        2.0000           -0.6594017             -17.9432
       ...           ...                  ...                  ...
       112        2.0000           -0.3910104             -10.6399
       113        2.0000           -0.3895400             -10.5999
       114        2.0000           -0.3892964             -10.5933
       115        2.0000           -0.3870323             -10.5317
       116        2.0000           -0.3731659             -10.1544
       117        2.0000           -0.3569999              -9.7145
       118        1.9134           -0.3260462              -8.8722 (HOMO)
       119        0.0866           -0.3201638              -8.7121 (LUMO)
       120                         -0.2858202              -7.7776
       121                         -0.2666086              -7.2548
       122                         -0.2485273              -6.7628
       123                         -0.2430751              -6.6144
       ...                                ...                  ...
       236                          0.7675516              20.8861
      -------------------------------------------------------------
                  HL-Gap            0.0058824 Eh            0.1601 eV
             Fermi-level           -0.3231050 Eh           -8.7921 eV

 SCC (total)                   0 d,  0 h,  0 min,  0.105 sec
 SCC setup                      ...        0 min,  0.001 sec (  0.953%)
 Dispersion                     ...        0 min,  0.002 sec (  1.905%)
 classical contributions        ...        0 min,  0.000 sec (  0.000%)
 integral evaluation            ...        0 min,  0.012 sec ( 11.429%)
 iterations                     ...        0 min,  0.033 sec ( 31.429%)
 molecular gradient             ...        0 min,  0.055 sec ( 52.381%)
 printout                       ...        0 min,  0.002 sec (  1.905%)

         :::::::::::::::::::::::::::::::::::::::::::::::::::::
         ::                     SUMMARY                     ::
         :::::::::::::::::::::::::::::::::::::::::::::::::::::
         :: total energy            -126.108309039904 Eh    ::
         :: gradient norm              0.000436648752 Eh/a0 ::
         :: HOMO-LUMO gap              0.160068995954 eV    ::
         ::.................................................::
         :: SCC energy              -128.603897900221 Eh    ::
         :: -> isotropic ES            0.002259580602 Eh    ::
         :: -> anisotropic ES          0.009174096155 Eh    ::
         :: -> anisotropic XC          0.056062383294 Eh    ::
         :: -> dispersion             -0.138219897759 Eh    ::
         :: repulsion energy           2.495588860317 Eh    ::
         :: add. restraining           0.000000000000 Eh    ::
         :: total charge              -0.000000000000 e     ::
         :::::::::::::::::::::::::::::::::::::::::::::::::::::

           -------------------------------------------------
          |                Property Printout                |
           -------------------------------------------------

    * Orbital Energies and Occupations

         #    Occupation            Energy/Eh            Energy/eV
      -------------------------------------------------------------
         1        2.0000           -0.6594017             -17.9432
       ...           ...                  ...                  ...
       106        2.0000           -0.4057892             -11.0421
       107        2.0000           -0.4055205             -11.0348
       108        2.0000           -0.4033238             -10.9750
       109        2.0000           -0.3997034             -10.8765
       110        2.0000           -0.3992166             -10.8632
       111        2.0000           -0.3968953             -10.8001
       112        2.0000           -0.3910104             -10.6399
       113        2.0000           -0.3895400             -10.5999
       114        2.0000           -0.3892964             -10.5933
       115        2.0000           -0.3870323             -10.5317
       116        2.0000           -0.3731659             -10.1544
       117        2.0000           -0.3569999              -9.7145
       118        1.9134           -0.3260462              -8.8722 (HOMO)
       119        0.0866           -0.3201638              -8.7121 (LUMO)
       120                         -0.2858202              -7.7776
       121                         -0.2666086              -7.2548
       122                         -0.2485273              -6.7628
       123                         -0.2430751              -6.6144
       124                         -0.2361417              -6.4257
       125                         -0.2316601              -6.3038
       126                         -0.2296100              -6.2480
       127                         -0.2259986              -6.1497
       128                         -0.2229555              -6.0669
       129                         -0.2056548              -5.5962
       ...                                ...                  ...
       236                          0.7675516              20.8861
      -------------------------------------------------------------
                  HL-Gap            0.0058824 Eh            0.1601 eV
             Fermi-level           -0.3231050 Eh           -8.7921 eV

     #   Z          covCN         q      C6AA      α(0)
     1   6 C        2.979     0.004    27.932     8.669
     2   6 C        2.986    -0.001    28.042     8.686
     3   6 C        2.986    -0.001    28.042     8.686
     4   6 C        2.979     0.004    27.932     8.669
     5   6 C        2.922    -0.037    28.911     8.818
     6   6 C        2.922    -0.037    28.911     8.818
     7   6 C        2.994     0.002    27.983     8.677
     8   6 C        2.992    -0.001    28.034     8.685
     9   6 C        2.994     0.002    27.983     8.677
    10   6 C        2.922    -0.037    28.926     8.820
    11   6 C        2.922    -0.037    28.926     8.820
    12   6 C        2.926    -0.045    29.121     8.850
    13   6 C        2.926    -0.045    29.121     8.850
    14   6 C        2.912    -0.030    28.747     8.792
    15   6 C        2.980     0.012    27.733     8.638
    16   6 C        2.975     0.011    27.760     8.643
    17   6 C        2.980     0.012    27.733     8.638
    18   6 C        2.912    -0.030    28.747     8.792
    19   6 C        2.976     0.006    27.879     8.661
    20   6 C        2.985     0.001    28.006     8.681
    21   6 C        2.985     0.001    28.006     8.681
    22   6 C        2.976     0.006    27.879     8.661
    23   6 C        2.919    -0.037    28.923     8.819
    24   6 C        2.989     0.001    27.994     8.679
    25   6 C        2.986    -0.001    28.044     8.687
    26   6 C        2.989     0.001    27.994     8.679
    27   6 C        2.919    -0.037    28.923     8.819
    28   6 C        2.976     0.006    27.879     8.661
    29   6 C        2.985     0.001    28.006     8.681
    30   6 C        2.985     0.001    28.006     8.681
    31   6 C        2.976     0.006    27.879     8.661
    32   6 C        2.912    -0.030    28.747     8.792
    33   6 C        2.912    -0.030    28.747     8.792
    34   6 C        2.980     0.012    27.733     8.638
    35   6 C        2.975     0.011    27.760     8.643
    36   6 C        2.980     0.012    27.733     8.638
    37   6 C        2.922    -0.037    28.926     8.820
    38   6 C        2.926    -0.045    29.121     8.850
    39   6 C        2.926    -0.045    29.121     8.850
    40   6 C        2.922    -0.037    28.926     8.820
    41   6 C        2.922    -0.037    28.911     8.818
    42   6 C        2.994     0.002    27.983     8.677
    43   6 C        2.992    -0.001    28.034     8.685
    44   6 C        2.994     0.002    27.983     8.677
    45   6 C        2.922    -0.037    28.911     8.818
    46   6 C        2.979     0.004    27.932     8.669
    47   6 C        2.986    -0.001    28.042     8.686
    48   6 C        2.986    -0.001    28.042     8.686
    49   6 C        2.979     0.004    27.932     8.669
    50   6 C        2.919    -0.037    28.923     8.819
    51   6 C        2.989     0.001    27.994     8.679
    52   6 C        2.986    -0.001    28.044     8.687
    53   6 C        2.989     0.001    27.994     8.679
    54   6 C        2.919    -0.037    28.923     8.819
    55   1 H        0.926     0.032     2.554     2.499
    56   1 H        0.926     0.032     2.554     2.499
    57   1 H        0.926     0.029     2.597     2.520
    58   1 H        0.926     0.033     2.549     2.496
    59   1 H        0.926     0.029     2.597     2.520
    60   1 H        0.926     0.029     2.597     2.520
    61   1 H        0.926     0.032     2.554     2.499
    62   1 H        0.926     0.033     2.549     2.496
    63   1 H        0.926     0.029     2.597     2.520
    64   1 H        0.926     0.033     2.549     2.496
    65   1 H        0.926     0.032     2.554     2.499
    66   1 H        0.926     0.033     2.549     2.496
    67   1 H        0.926     0.031     2.575     2.509
    68   1 H        0.926     0.031     2.575     2.509
    69   1 H        0.926     0.031     2.567     2.505
    70   1 H        0.926     0.031     2.567     2.505
    71   1 H        0.926     0.031     2.575     2.509
    72   1 H        0.926     0.031     2.567     2.505
    73   1 H        0.926     0.031     2.567     2.505
    74   1 H        0.926     0.031     2.575     2.509

 Mol. C6AA /au·bohr⁶  :     101948.931800
 Mol. C8AA /au·bohr⁸  :    2743227.754839
 Mol. α(0) /au        :        521.311975


Wiberg/Mayer (AO) data.
largest (>0.10) Wiberg bond orders for each atom

 ---------------------------------------------------------------------------
     #   Z sym  total        # sym  WBO       # sym  WBO       # sym  WBO
 ---------------------------------------------------------------------------
     1   6 C    3.963 --    50 C    1.357    51 C    1.274    28 C    1.133
     2   6 C    3.947 --    52 C    1.274    51 C    1.235    29 C    1.225
     3   6 C    3.947 --    52 C    1.274    53 C    1.235    30 C    1.225
     4   6 C    3.963 --    54 C    1.357    53 C    1.274    31 C    1.133
     5   6 C    3.898 --    31 C    1.390    32 C    1.381    55 H    0.962
     6   6 C    3.898 --    28 C    1.390    33 C    1.381    56 H    0.962
     7   6 C    3.947 --    28 C    1.267    29 C    1.250    34 C    1.213
     8   6 C    3.965 --    30 C    1.280    29 C    1.280    35 C    1.176
     9   6 C    3.947 --    31 C    1.267    30 C    1.250    36 C    1.213
    10   6 C    3.901 --    32 C    1.509    36 C    1.268    67 H    0.969
    11   6 C    3.901 --    33 C    1.509    34 C    1.268    68 H    0.969
    12   6 C    3.797 --    34 C    1.342    35 C    1.326    69 H    0.966
    13   6 C    3.797 --    36 C    1.342    35 C    1.326    70 H    0.966
    14   6 C    3.983 --    37 C    1.509    41 C    1.381    63 H    0.970
    15   6 C    3.985 --    38 C    1.342    37 C    1.268    42 C    1.213
    16   6 C    3.989 --    39 C    1.326    38 C    1.326    43 C    1.176
    17   6 C    3.985 --    39 C    1.342    40 C    1.268    44 C    1.213
    18   6 C    3.983 --    40 C    1.509    45 C    1.381    57 H    0.970
    19   6 C    3.982 --    41 C    1.390    42 C    1.267    46 C    1.133
    20   6 C    3.980 --    43 C    1.280    42 C    1.250    47 C    1.225
    21   6 C    3.980 --    43 C    1.280    44 C    1.250    48 C    1.225
    22   6 C    3.982 --    45 C    1.390    44 C    1.267    49 C    1.133
    23   6 C    3.970 --    50 C    1.472    46 C    1.357    64 H    0.961
    24   6 C    3.978 --    46 C    1.274    51 C    1.245    47 C    1.235
    25   6 C    3.972 --    47 C    1.274    48 C    1.274    52 C    1.201
    26   6 C    3.978 --    49 C    1.274    53 C    1.245    48 C    1.235
    27   6 C    3.970 --    54 C    1.472    49 C    1.357    58 H    0.961
    28   6 C    3.982 --     6 C    1.390     7 C    1.267     1 C    1.133
    29   6 C    3.980 --     8 C    1.280     7 C    1.250     2 C    1.225
    30   6 C    3.980 --     8 C    1.280     9 C    1.250     3 C    1.225
    31   6 C    3.982 --     5 C    1.390     9 C    1.267     4 C    1.133
    32   6 C    3.983 --    10 C    1.509     5 C    1.381    59 H    0.970
    33   6 C    3.983 --    11 C    1.509     6 C    1.381    60 H    0.970
    34   6 C    3.985 --    12 C    1.342    11 C    1.268     7 C    1.213
    35   6 C    3.989 --    13 C    1.326    12 C    1.326     8 C    1.176
    36   6 C    3.985 --    13 C    1.342    10 C    1.268     9 C    1.213
    37   6 C    3.901 --    14 C    1.509    15 C    1.268    71 H    0.969
    38   6 C    3.797 --    15 C    1.342    16 C    1.326    72 H    0.966
    39   6 C    3.797 --    17 C    1.342    16 C    1.326    73 H    0.966
    40   6 C    3.901 --    18 C    1.509    17 C    1.268    74 H    0.969
    41   6 C    3.898 --    19 C    1.390    14 C    1.381    65 H    0.962
    42   6 C    3.947 --    19 C    1.267    20 C    1.250    15 C    1.213
    43   6 C    3.965 --    21 C    1.280    20 C    1.280    16 C    1.176
    44   6 C    3.947 --    22 C    1.267    21 C    1.250    17 C    1.213
    45   6 C    3.898 --    22 C    1.390    18 C    1.381    61 H    0.962
    46   6 C    3.963 --    23 C    1.357    24 C    1.274    19 C    1.133
    47   6 C    3.947 --    25 C    1.274    24 C    1.235    20 C    1.225
    48   6 C    3.947 --    25 C    1.274    26 C    1.235    21 C    1.225
    49   6 C    3.963 --    27 C    1.357    26 C    1.274    22 C    1.133
    50   6 C    3.970 --    23 C    1.472     1 C    1.357    66 H    0.961
    51   6 C    3.978 --     1 C    1.274    24 C    1.245     2 C    1.235
    52   6 C    3.972 --     2 C    1.274     3 C    1.274    25 C    1.201
    53   6 C    3.978 --     4 C    1.274    26 C    1.245     3 C    1.235
    54   6 C    3.970 --    27 C    1.472     4 C    1.357    62 H    0.961
    55   1 H    0.998 --     5 C    0.962
    56   1 H    0.998 --     6 C    0.962
    57   1 H    0.998 --    18 C    0.970
    58   1 H    0.998 --    27 C    0.961
    59   1 H    0.998 --    32 C    0.970
    60   1 H    0.998 --    33 C    0.970
    61   1 H    0.998 --    45 C    0.962
    62   1 H    0.998 --    54 C    0.961
    63   1 H    0.998 --    14 C    0.970
    64   1 H    0.998 --    23 C    0.961
    65   1 H    0.998 --    41 C    0.962
    66   1 H    0.998 --    50 C    0.961
    67   1 H    0.998 --    10 C    0.969
    68   1 H    0.998 --    11 C    0.969
    69   1 H    0.998 --    12 C    0.966
    70   1 H    0.998 --    13 C    0.966
    71   1 H    0.998 --    37 C    0.969
    72   1 H    0.998 --    38 C    0.966
    73   1 H    0.998 --    39 C    0.966
    74   1 H    0.998 --    40 C    0.969
 ---------------------------------------------------------------------------

Topologies differ in total number of bonds
Writing topology from bond orders to xtbtopo.mol

molecular dipole:
                 x           y           z       tot (Debye)
 q only:       -0.000       0.000       0.000
   full:        0.000       0.000      -0.000       0.000
molecular quadrupole (traceless):
                xx          xy          yy          xz          yz          zz
 q only:        6.880       0.000       4.335      -0.000       0.000     -11.216
  q+dip:       22.438       0.000      18.881      -0.000      -0.000     -41.318
   full:       11.044       0.000       8.702      -0.000      -0.000     -19.746

           -------------------------------------------------
          |                Geometry Summary                 |
           -------------------------------------------------

      molecular mass/u    :      668.7385536
   center of mass at/Å    :        0.0000000       0.0000000      -0.0000000
  moments of inertia/u·Å² :        0.6898552E+04   0.9177944E+04   0.1607650E+05
rotational constants/cm⁻¹ :        0.2443648E-02   0.1836755E-02   0.1048589E-02

 * 87 selected distances

     #   Z          #   Z                                           value/Å
     6   6 C       28   6 C                                       1.3931235
     7   6 C       28   6 C                                       1.4149949
     2   6 C       29   6 C                                       1.4217317
     7   6 C       29   6 C                                       1.4170799
     8   6 C       29   6 C                                       1.4105441
     3   6 C       30   6 C                                       1.4217317
     8   6 C       30   6 C                                       1.4105441
     9   6 C       30   6 C                                       1.4170799
     5   6 C       31   6 C                                       1.3931235
     9   6 C       31   6 C                                       1.4149949
     5   6 C       32   6 C                                       1.3910399
    10   6 C       32   6 C                                       1.3694169
     6   6 C       33   6 C                                       1.3910399
    11   6 C       33   6 C                                       1.3694169
     7   6 C       34   6 C                                       1.4265255
    11   6 C       34   6 C                                       1.4102064
    12   6 C       34   6 C                                       1.3935458
     8   6 C       35   6 C                                       1.4323446 (max)
    12   6 C       35   6 C                                       1.3961157
    13   6 C       35   6 C                                       1.3961157
     9   6 C       36   6 C                                       1.4265255
    10   6 C       36   6 C                                       1.4102064
    13   6 C       36   6 C                                       1.3935459
    14   6 C       37   6 C                                       1.3694169
    15   6 C       37   6 C                                       1.4102064
    15   6 C       38   6 C                                       1.3935458
    16   6 C       38   6 C                                       1.3961157
    16   6 C       39   6 C                                       1.3961156
    17   6 C       39   6 C                                       1.3935458
    17   6 C       40   6 C                                       1.4102064
    18   6 C       40   6 C                                       1.3694169
    14   6 C       41   6 C                                       1.3910399
    19   6 C       41   6 C                                       1.3931235
    15   6 C       42   6 C                                       1.4265255
    19   6 C       42   6 C                                       1.4149949
    20   6 C       42   6 C                                       1.4170799
    16   6 C       43   6 C                                       1.4323446
    20   6 C       43   6 C                                       1.4105441
    21   6 C       43   6 C                                       1.4105441
    17   6 C       44   6 C                                       1.4265254
    21   6 C       44   6 C                                       1.4170799
    22   6 C       44   6 C                                       1.4149949
    18   6 C       45   6 C                                       1.3910399
    22   6 C       45   6 C                                       1.3931235
    23   6 C       46   6 C                                       1.3943071
    24   6 C       46   6 C                                       1.4158129
    20   6 C       47   6 C                                       1.4217317
    24   6 C       47   6 C                                       1.4203250
    25   6 C       47   6 C                                       1.4123332
    21   6 C       48   6 C                                       1.4217317
    25   6 C       48   6 C                                       1.4123332
    26   6 C       48   6 C                                       1.4203250
    26   6 C       49   6 C                                       1.4158129
    27   6 C       49   6 C                                       1.3943071
     1   6 C       50   6 C                                       1.3943071
    23   6 C       50   6 C                                       1.3730344
     1   6 C       51   6 C                                       1.4158129
     2   6 C       51   6 C                                       1.4203250
    24   6 C       51   6 C                                       1.4224960
     2   6 C       52   6 C                                       1.4123332
     3   6 C       52   6 C                                       1.4123332
    25   6 C       52   6 C                                       1.4270327
     3   6 C       53   6 C                                       1.4203250
     4   6 C       53   6 C                                       1.4158129
    26   6 C       53   6 C                                       1.4224960
     4   6 C       54   6 C                                       1.3943071
    27   6 C       54   6 C                                       1.3730345
     5   6 C       55   1 H                                       1.0775379
     6   6 C       56   1 H                                       1.0775379
    18   6 C       57   1 H                                       1.0804189
    27   6 C       58   1 H                                       1.0776182
    32   6 C       59   1 H                                       1.0804189
    33   6 C       60   1 H                                       1.0804189
    45   6 C       61   1 H                                       1.0775379
    54   6 C       62   1 H                                       1.0776182
    14   6 C       63   1 H                                       1.0804189
    23   6 C       64   1 H                                       1.0776182
    41   6 C       65   1 H                                       1.0775379 (min)
    50   6 C       66   1 H                                       1.0776182
    10   6 C       67   1 H                                       1.0800646
    11   6 C       68   1 H                                       1.0800646
    12   6 C       69   1 H                                       1.0807059
    13   6 C       70   1 H                                       1.0807059
    37   6 C       71   1 H                                       1.0800646
    38   6 C       72   1 H                                       1.0807059
    39   6 C       73   1 H                                       1.0807059
    40   6 C       74   1 H                                       1.0800646

 * 2 distinct bonds (by element types)

   Z      Z             #   av. dist./Å        max./Å        min./Å
   1 H    6 C          20     1.0792691     1.0807059     1.0775379
   6 C    6 C          67     1.4064357     1.4323446     1.3694169


optimized geometry written to: xtbopt.xyz


           -------------------------------------------------
          | TOTAL ENERGY             -126.108309039904 Eh   |
          | GRADIENT NORM               0.000436648752 Eh/α |
          | HOMO-LUMO GAP               0.160068995954 eV   |
           -------------------------------------------------

------------------------------------------------------------------------
 * finished run on 2025/12/08 at 00:34:19.818     
------------------------------------------------------------------------
 total:
 * wall-time:     0 d,  0 h,  0 min,  1.357 sec
 *  cpu-time:     0 d,  0 h,  0 min,  5.344 sec
 * ratio c/w:     3.938 speedup
 SCF:
 * wall-time:     0 d,  0 h,  0 min,  0.265 sec
 *  cpu-time:     0 d,  0 h,  0 min,  1.047 sec
 * ratio c/w:     3.950 speedup
 ANC optimizer:
 * wall-time:     0 d,  0 h,  0 min,  1.031 sec
 *  cpu-time:     0 d,  0 h,  0 min,  4.094 sec
 * ratio c/w:     3.971 speedup

normal termination of xtb
