      -----------------------------------------------------------      
     |                   =====================                   |     
     |                           x T B                           |     
     |                   =====================                   |     
     |                         S. Grimme                         |     
     |          Mulliken Center for Theoretical Chemistry        |     
     |                    University of Bonn                     |     
      -----------------------------------------------------------      

   * xtb version 6.7.1pre (5071a88) compiled by 'Marcel@Raven' on 2024-07-23

   xtb is free software: you can redistribute it and/or modify it under
   the terms of the GNU Lesser General Public License as published by
   the Free Software Foundation, either version 3 of the License, or
   (at your option) any later version.
   
   xtb is distributed in the hope that it will be useful,
   but WITHOUT ANY WARRANTY; without even the implied warranty of
   MERCHANTABILITY or FITNESS FOR A PARTICULAR PURPOSE.  See the
   GNU Lesser General Public License for more details.
   
   Cite this work as:
   * C. Bannwarth, E. Caldeweyher, S. Ehlert, A. Hansen, P. Pracht,
     J. Seibert, S. Spicher, S. Grimme, WIREs Comput. Mol. Sci., 2020, 11,
     e01493. DOI: 10.1002/wcms.1493
   
   for GFN2-xTB:
   * C. Bannwarth, S. Ehlert and S. Grimme., J. Chem. Theory Comput., 2019,
     15, 1652-1671. DOI: 10.1021/acs.jctc.8b01176
   for GFN1-xTB:
   * S. Grimme, C. Bannwarth, P. Shushkov, J. Chem. Theory Comput., 2017,
     13, 1989-2009. DOI: 10.1021/acs.jctc.7b00118
   for GFN0-xTB:
   * P. Pracht, E. Caldeweyher, S. Ehlert, S. Grimme, ChemRxiv, 2019, preprint.
     DOI: 10.26434/chemrxiv.8326202.v1
   for GFN-FF:
   * S. Spicher and S. Grimme, Angew. Chem. Int. Ed., 2020, 59, 15665-15673.
     DOI: 10.1002/anie.202004239
   
   for ALPB and GBSA implicit solvation:
   * S. Ehlert, M. Stahn, S. Spicher, S. Grimme, J. Chem. Theory Comput.,
     2021, 17, 4250-4261. DOI: 10.1021/acs.jctc.1c00471
   
   for ddCOSMO and CPCM-X implicit solvation:
   * M. Stahn, S. Ehlert, S. Grimme, J. Phys. Chem. A,
     2023, XX, XXXX-XXXX. DOI: 10.1021/acs.jpca.3c04382
   
   for DFT-D4:
   * E. Caldeweyher, C. Bannwarth and S. Grimme, J. Chem. Phys., 2017,
     147, 034112. DOI: 10.1063/1.4993215
   * E. Caldeweyher, S. Ehlert, A. Hansen, H. Neugebauer, S. Spicher,
     C. Bannwarth and S. Grimme, J. Chem. Phys., 2019, 150, 154122.
     DOI: 10.1063/1.5090222
   * E. Caldeweyher, J.-M. Mewes, S. Ehlert and S. Grimme, Phys. Chem. Chem. Phys.
     2020, 22, 8499-8512. DOI: 10.1039/D0CP00502A
   
   for sTDA-xTB:
   * S. Grimme and C. Bannwarth, J. Chem. Phys., 2016, 145, 054103.
     DOI: 10.1063/1.4959605
   
   in the mass-spec context:
   * V. Asgeirsson, C. Bauer and S. Grimme, Chem. Sci., 2017, 8, 4879.
     DOI: 10.1039/c7sc00601b
   * J. Koopman and S. Grimme, ACS Omega 2019, 4, 12, 15120-15133.
     DOI: 10.1021/acsomega.9b02011
   
   for metadynamics refer to:
   * S. Grimme, J. Chem. Theory Comput., 2019, 155, 2847-2862
     DOI: 10.1021/acs.jctc.9b00143
   
   for SPH calculations refer to:
   * S. Spicher and S. Grimme, J. Chem. Theory Comput., 2021, 17, 1701-1714
     DOI: 10.1021/acs.jctc.0c01306
   
   for ONIOM refer to:
   * C. Plett, A. Katbashev, S. Ehlert, S. Grimme, M. Bursch,
     Phys. Chem. Chem. Phys., 2023, 25, 17860-17868. DOI: 10.1039/D3CP02178E
   
   for DIPRO refer to:
   * J. Kohn, N. Gildemeister, S. Grimme, D. Fazzi, A. Hansen,
     J. Chem. Phys., 2023, just accepted.
   
   for PTB refer to:
   * S. Grimme, M. Mueller, A. Hansen, J. Chem. Phys., 2023, 158, 124111.
     DOI: 10.1063/5.0137838
   
   with help from (in alphabetical order)
   P. Atkinson, C. Bannwarth, F. Bohle, G. Brandenburg, E. Caldeweyher
   M. Checinski, S. Dohm, S. Ehlert, S. Ehrlich, I. Gerasimov, C. Hölzer
   A. Katbashev, J. Kohn, J. Koopman, C. Lavigne, S. Lehtola, F. März, M. Müller,
   F. Musil, H. Neugebauer, J. Pisarek, C. Plett, P. Pracht, F. Pultar,
   J. Seibert, P. Shushkov, S. Spicher, M. Stahn, M. Steiner, T. Strunk,
   J. Stückrath, T. Rose, and J. Unsleber
   
 * started run on 2025/12/08 at 00:34:25.034     
   ID    Z sym.   atoms
    1    6 C      1-52
    2    1 H      53-72
    3   15 P      73, 74

           -------------------------------------------------
          |                Calculation Setup                |
           -------------------------------------------------

          program call               : xtb "C:\Users\LENOVO GAMING\Documents\GitHub\molecular-conductivity-sim\dataset\1nm-2Pdoped-3percent.xyz" --opt --parallel 4
          coordinate file            : C:\Users\LENOVO GAMING\Documents\GitHub\molecular-conductivity-sim\dataset\1nm-2Pdoped-3percent.xyz
          omp threads                :                     4


           -------------------------------------------------
          |                 G F N 2 - x T B                 |
           -------------------------------------------------

        Reference                      10.1021/acs.jctc.8b01176
      * Hamiltonian:
        H0-scaling (s, p, d)           1.850000    2.230000    2.230000
        zeta-weighting                 0.500000
      * Dispersion:
        s8                             2.700000
        a1                             0.520000
        a2                             5.000000
        s9                             5.000000
      * Repulsion:
        kExp                           1.500000    1.000000
        rExp                           1.000000
      * Coulomb:
        alpha                          2.000000
        third order                    shell-resolved
        anisotropic                    true
        a3                             3.000000
        a5                             4.000000
        cn-shift                       1.200000
        cn-exp                         4.000000
        max-rad                        5.000000


          ...................................................
          :                      SETUP                      :
          :.................................................:
          :  # basis functions                 248          :
          :  # atomic orbitals                 246          :
          :  # shells                          130          :
          :  # electrons                       238          :
          :  max. iterations                   250          :
          :  Hamiltonian                  GFN2-xTB          :
          :  restarted?                      false          :
          :  GBSA solvation                  false          :
          :  PC potential                    false          :
          :  electronic temp.          300.0000000     K    :
          :  accuracy                    1.0000000          :
          :  -> integral cutoff          0.2500000E+02      :
          :  -> integral neglect         0.1000000E-07      :
          :  -> SCF convergence          0.1000000E-05 Eh   :
          :  -> wf. convergence          0.1000000E-03 e    :
          :  Broyden damping             0.4000000          :
          :  net charge                          0          :
          :  unpaired electrons                  0          :
          ...................................................

 iter      E             dE          RMSdq      gap      omega  full diag
   1   -129.0424343 -0.129042E+03  0.508E+00    1.17       0.0  T
   2   -129.0768611 -0.344269E-01  0.301E+00    1.16       1.0  T
   3   -128.9858550  0.910061E-01  0.986E-01    1.09       1.0  T
   4   -129.0771747 -0.913197E-01  0.355E-01    1.15       1.0  T
   5   -129.0885116 -0.113369E-01  0.133E-01    1.14       1.0  T
   6   -129.0894717 -0.960035E-03  0.605E-02    1.14       1.0  T
   7   -129.0895261 -0.544430E-04  0.422E-02    1.14       1.0  T
   8   -129.0896224 -0.963028E-04  0.136E-02    1.14       1.0  T
   9   -129.0896318 -0.940055E-05  0.537E-03    1.14       2.2  T
  10   -129.0896329 -0.103965E-05  0.242E-03    1.14       4.8  T
  11   -129.0896332 -0.351939E-06  0.616E-04    1.14      18.9  T
  12   -129.0896332 -0.198378E-07  0.307E-04    1.14      37.9  T

   *** convergence criteria satisfied after 12 iterations ***

         #    Occupation            Energy/Eh            Energy/eV
      -------------------------------------------------------------
         1        2.0000           -0.6685365             -18.1918
       ...           ...                  ...                  ...
       113        2.0000           -0.3915824             -10.6555
       114        2.0000           -0.3903336             -10.6215
       115        2.0000           -0.3878049             -10.5527
       116        2.0000           -0.3791493             -10.3172
       117        2.0000           -0.3677620             -10.0073
       118        2.0000           -0.3615542              -9.8384
       119        2.0000           -0.3452109              -9.3937 (HOMO)
       120                         -0.3032339              -8.2514 (LUMO)
       121                         -0.2778360              -7.5603
       122                         -0.2766689              -7.5285
       123                         -0.2611443              -7.1061
       124                         -0.2461899              -6.6992
       ...                                ...                  ...
       246                          0.8639065              23.5081
      -------------------------------------------------------------
                  HL-Gap            0.0419770 Eh            1.1423 eV
             Fermi-level           -0.3242224 Eh           -8.8225 eV

 SCC (total)                   0 d,  0 h,  0 min,  0.266 sec
 SCC setup                      ...        0 min,  0.001 sec (  0.376%)
 Dispersion                     ...        0 min,  0.002 sec (  0.752%)
 classical contributions        ...        0 min,  0.000 sec (  0.000%)
 integral evaluation            ...        0 min,  0.018 sec (  6.767%)
 iterations                     ...        0 min,  0.188 sec ( 70.677%)
 molecular gradient             ...        0 min,  0.055 sec ( 20.677%)
 printout                       ...        0 min,  0.002 sec (  0.752%)

         :::::::::::::::::::::::::::::::::::::::::::::::::::::
         ::                     SUMMARY                     ::
         :::::::::::::::::::::::::::::::::::::::::::::::::::::
         :: total energy            -126.828807133149 Eh    ::
         :: gradient norm              0.037217595085 Eh/a0 ::
         :: HOMO-LUMO gap              1.142253206170 eV    ::
         ::.................................................::
         :: SCC energy              -129.091636283902 Eh    ::
         :: -> isotropic ES            0.002656337341 Eh    ::
         :: -> anisotropic ES          0.008081067386 Eh    ::
         :: -> anisotropic XC          0.058156439011 Eh    ::
         :: -> dispersion             -0.141228749228 Eh    ::
         :: repulsion energy           2.262829150753 Eh    ::
         :: add. restraining           0.000000000000 Eh    ::
         :: total charge               0.000000000000 e     ::
         :::::::::::::::::::::::::::::::::::::::::::::::::::::

      ----------------------------------------------------------- 
     |                   =====================                   |
     |                        A N C O P T                        |
     |                   =====================                   |
     |               Approximate Normal Coordinate               |
     |                Rational Function Optimizer                |
      ----------------------------------------------------------- 
      ----------------------------------------------------------- 
     |                   =====================                   |
     |                        A N C O P T                        |
     |                   =====================                   |
     |               Approximate Normal Coordinate               |
     |                Rational Function Optimizer                |
      ----------------------------------------------------------- 

          ...................................................
          :                      SETUP                      :
          :.................................................:
          :   optimization level            normal          :
          :   max. optcycles                   222          :
          :   ANC micro-cycles                  20          :
          :   degrees of freedom               216          :
          :.................................................:
          :   RF solver                   davidson          :
          :   write xtbopt.log                true          :
          :   linear?                        false          :
          :   energy convergence         0.5000000E-05 Eh   :
          :   grad. convergence          0.1000000E-02 Eh/α :
          :   maxmium RF displ.          1.0000000          :
          :   Hlow (freq-cutoff)         0.1000000E-01      :
          :   Hmax (freq-cutoff)         5.0000000          :
          :   S6 in model hess.         20.0000000          :
          ...................................................

generating ANC from exact Hessian ...
Using Lindh-Hessian (1995)
 Shifting diagonal of input Hessian by   9.731922439166915E-003
 Lowest  eigenvalues of input Hessian
    0.000000    0.000000    0.000000    0.000000    0.000000    0.000000
    0.010000    0.010311    0.010642    0.010851    0.011076    0.011979
    0.012748    0.013496    0.013672    0.015420    0.015656    0.016178
 Highest eigenvalues
    1.997124    2.006851    2.044966    2.056018    2.079788    2.102413
 

........................................................................
.............................. CYCLE    1 ..............................
........................................................................

 iter      E             dE          RMSdq      gap      omega  full diag
   1   -129.0896332 -0.129090E+03  0.127E-04    1.14       0.0  T
   2   -129.0896332 -0.118234E-09  0.938E-05    1.14     123.9  T
   3   -129.0896332 -0.507811E-09  0.528E-05    1.14     220.2  T
     SCC iter.                  ...        0 min,  0.050 sec
     gradient                   ...        0 min,  0.059 sec
 * total energy  :  -126.8288071 Eh     change       -0.2393250E-08 Eh
   gradient norm :     0.0372172 Eh/α   predicted     0.0000000E+00 (-100.00%)
   displ. norm   :     0.4464636 α      lambda       -0.1234081E-01
   maximum displ.:     0.2418339 α      in ANC's #37, #36, #31, ...

........................................................................
.............................. CYCLE    2 ..............................
........................................................................

 iter      E             dE          RMSdq      gap      omega  full diag
   1   -129.1869996 -0.129187E+03  0.204E-01    1.15       0.0  T
   2   -129.1870211 -0.214062E-04  0.117E-01    1.15       1.0  T
   3   -129.1869475  0.735147E-04  0.320E-02    1.15       1.0  T
   4   -129.1870117 -0.641976E-04  0.163E-02    1.15       1.0  T
   5   -129.1870245 -0.127507E-04  0.795E-03    1.15       1.5  T
   6   -129.1870295 -0.502633E-05  0.172E-03    1.15       6.8  T
   7   -129.1870296 -0.122528E-06  0.887E-04    1.15      13.1  T
   8   -129.1870296 -0.117846E-07  0.415E-04    1.15      28.0  T
     SCC iter.                  ...        0 min,  0.132 sec
     gradient                   ...        0 min,  0.051 sec
 * total energy  :  -126.8372630 Eh     change       -0.8455888E-02 Eh
   gradient norm :     0.0170277 Eh/α   predicted    -0.7400392E-02 ( -12.48%)
   displ. norm   :     0.3447038 α      lambda       -0.3987027E-02
   maximum displ.:     0.1809791 α      in ANC's #37, #38, #22, ...

........................................................................
.............................. CYCLE    3 ..............................
........................................................................

 iter      E             dE          RMSdq      gap      omega  full diag
   1   -129.2558054 -0.129256E+03  0.116E-01    1.14       0.0  T
   2   -129.2558082 -0.280221E-05  0.701E-02    1.14       1.0  T
   3   -129.2555873  0.220841E-03  0.552E-02    1.14       1.0  T
   4   -129.2558251 -0.237760E-03  0.108E-02    1.14       1.1  T
   5   -129.2558284 -0.329162E-05  0.765E-03    1.14       1.5  T
   6   -129.2558329 -0.455595E-05  0.144E-03    1.14       8.1  T
   7   -129.2558330 -0.955819E-07  0.716E-04    1.14      16.2  T
   8   -129.2558330 -0.916725E-08  0.294E-04    1.14      39.5  T
     SCC iter.                  ...        0 min,  0.127 sec
     gradient                   ...        0 min,  0.052 sec
 * total energy  :  -126.8393852 Eh     change       -0.2122165E-02 Eh
   gradient norm :     0.0066146 Eh/α   predicted    -0.2230384E-02 (   5.10%)
   displ. norm   :     0.1226894 α      lambda       -0.3376325E-03
   maximum displ.:     0.0587326 α      in ANC's #6, #3, #13, ...

........................................................................
.............................. CYCLE    4 ..............................
........................................................................

 iter      E             dE          RMSdq      gap      omega  full diag
   1   -129.2593577 -0.129259E+03  0.535E-02    1.14       0.0  T
   2   -129.2593595 -0.178991E-05  0.305E-02    1.14       1.0  T
   3   -129.2593476  0.119364E-04  0.118E-02    1.14       1.0  T
   4   -129.2593590 -0.114505E-04  0.511E-03    1.14       2.3  T
   5   -129.2593602 -0.115957E-05  0.246E-03    1.14       4.7  T
   6   -129.2593607 -0.515414E-06  0.478E-04    1.14      24.3  T
   7   -129.2593607 -0.907036E-08  0.240E-04    1.14      48.5  T
     SCC iter.                  ...        0 min,  0.114 sec
     gradient                   ...        0 min,  0.051 sec
 * total energy  :  -126.8395866 Eh     change       -0.2014448E-03 Eh
   gradient norm :     0.0028057 Eh/α   predicted    -0.1715071E-03 ( -14.86%)
   displ. norm   :     0.1178373 α      lambda       -0.1282517E-03
   maximum displ.:     0.0818354 α      in ANC's #6, #3, #13, ...

........................................................................
.............................. CYCLE    5 ..............................
........................................................................

 iter      E             dE          RMSdq      gap      omega  full diag
   1   -129.2581132 -0.129258E+03  0.372E-02    1.13       0.0  T
   2   -129.2581133 -0.150341E-06  0.220E-02    1.13       1.0  T
   3   -129.2581048  0.853243E-05  0.102E-02    1.13       1.1  T
   4   -129.2581136 -0.878545E-05  0.183E-03    1.13       6.3  T
   5   -129.2581137 -0.177946E-06  0.938E-04    1.13      12.4  T
   6   -129.2581138 -0.693260E-07  0.244E-04    1.13      47.7  T
     SCC iter.                  ...        0 min,  0.095 sec
     gradient                   ...        0 min,  0.052 sec
 * total energy  :  -126.8396846 Eh     change       -0.9798189E-04 Eh
   gradient norm :     0.0020286 Eh/α   predicted    -0.6501649E-04 ( -33.64%)
   displ. norm   :     0.1572136 α      lambda       -0.1196854E-03
   maximum displ.:     0.1085403 α      in ANC's #6, #3, #13, ...

........................................................................
.............................. CYCLE    6 ..............................
........................................................................

 iter      E             dE          RMSdq      gap      omega  full diag
   1   -129.2557249 -0.129256E+03  0.471E-02    1.13       0.0  T
   2   -129.2557254 -0.503358E-06  0.277E-02    1.13       1.0  T
   3   -129.2557185  0.689144E-05  0.926E-03    1.13       1.3  T
   4   -129.2557251 -0.661068E-05  0.311E-03    1.13       3.7  T
   5   -129.2557257 -0.638861E-06  0.110E-03    1.13      10.5  T
   6   -129.2557258 -0.994394E-07  0.255E-04    1.13      45.5  T
   7   -129.2557258 -0.618058E-09  0.146E-04    1.13      79.7  T
     SCC iter.                  ...        0 min,  0.109 sec
     gradient                   ...        0 min,  0.054 sec
 * total energy  :  -126.8397752 Eh     change       -0.9062730E-04 Eh
   gradient norm :     0.0025827 Eh/α   predicted    -0.6132432E-04 ( -32.33%)
   displ. norm   :     0.1564128 α      lambda       -0.8745921E-04
   maximum displ.:     0.1060430 α      in ANC's #6, #3, #14, ...

........................................................................
.............................. CYCLE    7 ..............................
........................................................................

 iter      E             dE          RMSdq      gap      omega  full diag
   1   -129.2546751 -0.129255E+03  0.450E-02    1.13       0.0  T
   2   -129.2546756 -0.424991E-06  0.264E-02    1.13       1.0  T
   3   -129.2546717  0.388471E-05  0.710E-03    1.13       1.6  T
   4   -129.2546752 -0.357587E-05  0.279E-03    1.13       4.2  T
   5   -129.2546758 -0.519798E-06  0.100E-03    1.13      11.6  T
   6   -129.2546758 -0.801856E-07  0.267E-04    1.13      43.5  T
     SCC iter.                  ...        0 min,  0.097 sec
     gradient                   ...        0 min,  0.047 sec
 * total energy  :  -126.8398447 Eh     change       -0.6946442E-04 Eh
   gradient norm :     0.0026523 Eh/α   predicted    -0.4480109E-04 ( -35.50%)
   displ. norm   :     0.1742134 α      lambda       -0.8030597E-04
   maximum displ.:     0.1141862 α      in ANC's #6, #3, #14, ...

........................................................................
.............................. CYCLE    8 ..............................
........................................................................

 iter      E             dE          RMSdq      gap      omega  full diag
   1   -129.2552371 -0.129255E+03  0.485E-02    1.14       0.0  T
   2   -129.2552376 -0.517554E-06  0.285E-02    1.14       1.0  T
   3   -129.2552332  0.440516E-05  0.754E-03    1.14       1.5  T
   4   -129.2552372 -0.400314E-05  0.308E-03    1.14       3.8  T
   5   -129.2552378 -0.642084E-06  0.110E-03    1.14      10.5  T
   6   -129.2552379 -0.936239E-07  0.308E-04    1.14      37.7  T
   7   -129.2552379 -0.545242E-09  0.175E-04    1.14      66.5  T
     SCC iter.                  ...        0 min,  0.110 sec
     gradient                   ...        0 min,  0.056 sec
 * total energy  :  -126.8399042 Eh     change       -0.5951000E-04 Eh
   gradient norm :     0.0023295 Eh/α   predicted    -0.4137224E-04 ( -30.48%)
   displ. norm   :     0.1462062 α      lambda       -0.4734924E-04
   maximum displ.:     0.0927767 α      in ANC's #6, #3, #14, ...

........................................................................
.............................. CYCLE    9 ..............................
........................................................................

 iter      E             dE          RMSdq      gap      omega  full diag
   1   -129.2563938 -0.129256E+03  0.400E-02    1.14       0.0  T
   2   -129.2563940 -0.243544E-06  0.235E-02    1.14       1.0  T
   3   -129.2563885  0.553389E-05  0.850E-03    1.14       1.4  T
   4   -129.2563940 -0.556662E-05  0.210E-03    1.14       5.5  T
   5   -129.2563943 -0.244710E-06  0.105E-03    1.14      11.1  T
   6   -129.2563944 -0.836959E-07  0.289E-04    1.14      40.3  T
   7   -129.2563944 -0.114284E-08  0.165E-04    1.14      70.3  T
     SCC iter.                  ...        0 min,  0.105 sec
     gradient                   ...        0 min,  0.062 sec
 * total energy  :  -126.8399362 Eh     change       -0.3195167E-04 Eh
   gradient norm :     0.0017301 Eh/α   predicted    -0.2418243E-04 ( -24.32%)
   displ. norm   :     0.1153586 α      lambda       -0.1870748E-04
   maximum displ.:     0.0716467 α      in ANC's #3, #6, #1, ...

........................................................................
.............................. CYCLE   10 ..............................
........................................................................

 iter      E             dE          RMSdq      gap      omega  full diag
   1   -129.2578504 -0.129258E+03  0.300E-02    1.14       0.0  T
   2   -129.2578504 -0.908534E-08  0.178E-02    1.14       1.0  T
   3   -129.2578424  0.799486E-05  0.102E-02    1.14       1.1  T
   4   -129.2578507 -0.831141E-05  0.175E-03    1.14       6.6  T
   5   -129.2578509 -0.172291E-06  0.928E-04    1.14      12.5  T
   6   -129.2578510 -0.637162E-07  0.258E-04    1.14      45.1  T
     SCC iter.                  ...        0 min,  0.094 sec
     gradient                   ...        0 min,  0.058 sec
 * total energy  :  -126.8399522 Eh     change       -0.1599044E-04 Eh
   gradient norm :     0.0009741 Eh/α   predicted    -0.9411059E-05 ( -41.15%)
   displ. norm   :     0.0387877 α      lambda       -0.7197662E-05
   maximum displ.:     0.0183200 α      in ANC's #3, #13, #4, ...

........................................................................
.............................. CYCLE   11 ..............................
........................................................................

 iter      E             dE          RMSdq      gap      omega  full diag
   1   -129.2577224 -0.129258E+03  0.109E-02    1.14       0.0  T
   2   -129.2577224 -0.122918E-07  0.652E-03    1.14       1.8  T
   3   -129.2577212  0.115676E-05  0.397E-03    1.14       2.9  T
   4   -129.2577225 -0.121131E-05  0.702E-04    1.14      16.6  T
   5   -129.2577225 -0.314235E-07  0.333E-04    1.14      34.9  T
   6   -129.2577225 -0.752738E-08  0.105E-04    1.14     110.9  T
     SCC iter.                  ...        0 min,  0.096 sec
     gradient                   ...        0 min,  0.047 sec
 * total energy  :  -126.8399604 Eh     change       -0.8212864E-05 Eh
   gradient norm :     0.0006726 Eh/α   predicted    -0.3601730E-05 ( -56.15%)
   displ. norm   :     0.0693844 α      lambda       -0.8571345E-05
   maximum displ.:     0.0336069 α      in ANC's #3, #4, #13, ...

........................................................................
.............................. CYCLE   12 ..............................
........................................................................

 iter      E             dE          RMSdq      gap      omega  full diag
   1   -129.2572758 -0.129257E+03  0.173E-02    1.14       0.0  T
   2   -129.2572759 -0.961406E-07  0.101E-02    1.14       1.1  T
   3   -129.2572749  0.989686E-06  0.356E-03    1.14       3.3  T
   4   -129.2572760 -0.105738E-05  0.790E-04    1.14      14.7  T
   5   -129.2572760 -0.305043E-07  0.374E-04    1.14      31.1  T
   6   -129.2572760 -0.990963E-08  0.130E-04    1.14      89.7  T
     SCC iter.                  ...        0 min,  0.094 sec
     gradient                   ...        0 min,  0.056 sec
 * total energy  :  -126.8399687 Eh     change       -0.8321043E-05 Eh
   gradient norm :     0.0008041 Eh/α   predicted    -0.4296094E-05 ( -48.37%)
   displ. norm   :     0.0533731 α      lambda       -0.4371295E-05
   maximum displ.:     0.0309722 α      in ANC's #3, #4, #10, ...

........................................................................
.............................. CYCLE   13 ..............................
........................................................................

 iter      E             dE          RMSdq      gap      omega  full diag
   1   -129.2570751 -0.129257E+03  0.127E-02    1.14       0.0  T
   2   -129.2570752 -0.284336E-07  0.746E-03    1.14       1.6  T
   3   -129.2570747  0.471415E-06  0.239E-03    1.14       4.9  T
   4   -129.2570752 -0.461262E-06  0.746E-04    1.14      15.6  T
   5   -129.2570752 -0.348453E-07  0.310E-04    1.14      37.5  T
     SCC iter.                  ...        0 min,  0.081 sec
     gradient                   ...        0 min,  0.057 sec
 * total energy  :  -126.8399731 Eh     change       -0.4451936E-05 Eh
   gradient norm :     0.0007553 Eh/α   predicted    -0.2188959E-05 ( -50.83%)
   displ. norm   :     0.0498955 α      lambda       -0.3561315E-05
   maximum displ.:     0.0293654 α      in ANC's #3, #4, #2, ...

   *** GEOMETRY OPTIMIZATION CONVERGED AFTER 13 ITERATIONS ***

------------------------------------------------------------------------
 total energy gain   :        -0.0111660 Eh       -7.0068 kcal/mol
 total RMSD          :         0.1579669 a0        0.0836 Å
 total power (kW/mol):        -2.2551045 (step)  -12.6473 (real)
------------------------------------------------------------------------

 ANCopt (total)                0 d,  0 h,  0 min,  2.318 sec
 optimizer setup                ...        0 min,  0.000 sec (  0.000%)
 model hessian                  ...        0 min,  0.043 sec (  1.855%)
 ANC generation                 ...        0 min,  0.009 sec (  0.388%)
 coordinate transformation      ...        0 min,  0.001 sec (  0.043%)
 single point calculation       ...        0 min,  2.244 sec ( 96.808%)
 optimization log               ...        0 min,  0.013 sec (  0.561%)
 hessian update                 ...        0 min,  0.002 sec (  0.086%)
 rational function              ...        0 min,  0.005 sec (  0.216%)

================
 final structure:
================
74
 xtb: 6.7.1pre (5071a88)
C           -2.60268664015291       -5.38218499475782        0.33693859214385
C           -4.85725990640294       -4.62341024683455        0.08306590663923
C            0.26791288637238       -4.84028957914163        0.12372844254301
C           -3.96205660150206       -5.64369841037377        0.30877758296553
C           -2.10071257313663       -4.09291150765519        0.15636122289878
C           -4.39784153858839       -3.31251471570445       -0.07503283323854
C            5.74173788322244       -3.98363658836930        0.40341893435811
C            1.60610391796506       -4.57628925290399        0.13546700967977
C           -0.27391145657650        4.97156521031646        0.26443748983109
C            3.48879443253768       -2.97830648415247        0.18117434134526
C            5.33038422946327       -1.35798632657368       -0.18047483995372
C           -3.98277605119356        1.83812634183320       -0.02981165440514
C           -2.10237398277418        3.39522107965279        0.29652864110142
C           -0.68793885355353       -3.81106225081929        0.13090386432191
C            1.15135117953344       -2.19901700359186        0.07769200563732
C            2.99569956567013       -0.59597296310512       -0.04519096455486
C           -6.25669325333260        2.70847096947931        0.11089930422079
C            4.84055524643679        1.02288436028788       -0.18966093422061
C           -4.43434716643104        4.11271621863377        0.70953273357959
C           -3.01351623323536       -3.02286726004404       -0.00741409336197
C            4.38492062261370        3.40658521871732       -0.15336616727615
C           -1.17514705551889       -1.40109214550012       -0.00122509026827
C            0.67322948395134        0.20902126804888        0.01065173245486
C            2.52238742296419        1.80868478549516       -0.05666550384100
C           -5.28729236573956       -2.25106089387222       -0.34785585685262
C            2.08199060745257        4.23049991251065        0.01785172460174
C           -3.48751514001880       -0.61105473099459       -0.24515017557596
C            3.95231415941443        5.77396771756967       -0.10471240813393
C           -1.66644693444005        0.99671186751561       -0.00467385779125
C            0.20243477053263        2.61521182787811        0.07611168886612
C            4.41171515008959       -4.03062547758849        0.54562041131703
C           -4.85880076158852       -0.96205046549779       -0.44831963931760
C            2.58902292892961        5.52723932404602       -0.00903444158358
C           -3.04821781223082        0.73708825297640       -0.14138675280892
C           -1.18893431860597        2.33903280845469        0.11986891439589
C            0.66691390702271        3.94786248761913        0.12129506731572
C            2.09211694784853       -3.25587466744776        0.15270276481056
C            3.93534480468244       -1.67124820727000       -0.02945282405587
C           -5.37491883197005        1.69073735009763       -0.20276116003457
C            5.74687572318897       -0.06799470884000       -0.26224325383937
C           -3.51615300169934        3.11897202602515        0.34273649550399
C           -1.61275470258295        4.70335529572660        0.36520977755471
C           -0.24063392793940       -2.47819484281144        0.07316555800241
C            1.60583545067434       -0.86031708371941        0.01964478959202
C            3.44371344269174        0.74086356350053       -0.10287937785215
C           -5.78987210899897        3.90626049809745        0.62782761324765
C            5.28182504341179        2.32788766226675       -0.22171544715549
C           -2.56352081328392       -1.67472171851710       -0.08601876662663
C            4.84441455162204        4.73342080668547       -0.17223385761010
C           -0.72695854701554       -0.06851131921082       -0.00386584754533
C            1.13096543127604        1.53746828349876       -0.00094054361180
C            2.98987458681318        3.14724982732226       -0.06520152977753
H           -5.91832988663114       -4.81843653007221        0.03087369656296
H            0.04203189336571        6.00094424845724        0.30336624331598
H           -7.31624616678847        2.55274909639146       -0.04215849364606
H           -4.07927127132954        5.06144939450582        1.07748929194362
H           -6.33543174639665       -2.47922371813096       -0.49485325208808
H            4.30533940729950        6.79485816836086       -0.12420470743088
H            1.92720930399004        6.37641246189396        0.03816658522029
H           -2.29182439846600        5.53416932271176        0.46416281047109
H           -6.48159950524847        4.67883327009210        0.92908817157059
H           -1.93122532627182       -6.20651920808467        0.51391049811493
H           -0.05001941699683       -5.86945881232884        0.08674179310155
H           -4.31427843580934       -6.65454939896841        0.45369146608421
H            6.36358990672196       -4.80414769767973        0.73642987747520
H            2.29655366693229       -5.40368254103797        0.09242527484833
H            3.98277926714097       -4.88619474943162        1.04983705172199
H            6.79955978826763        0.15172698466112       -0.38742812056586
H            6.34060528179412        2.53201537084992       -0.29608392700831
H            5.90638875369680        4.91815075088557       -0.24177794419341
H            7.45520929945371       -2.30666276484571        0.52563978507568
H           -7.06516261273412       -0.03490557432862       -0.12976032577662
P            6.56094671754237       -2.66350925434403       -0.49417186013207
P           -6.05307831740158        0.25129006148430       -1.05585270230017
 
 Bond Distances (Angstroems)
 ---------------------------
C1-C4=1.3846         C1-C5=1.3953         C1-H62=1.0778        C2-C4=1.3760         C2-C6=1.3980         C2-H53=1.0801        
C3-C8=1.3640         C3-C14=1.4046        C3-H63=1.0778        C4-C1=1.3846         C4-C2=1.3760         C4-H64=1.0802        
C5-C1=1.3953         C5-C14=1.4408        C5-C20=1.4160        C6-C2=1.3980         C6-C20=1.4159        C6-C25=1.4115        
C7-C31=1.3384        C7-H65=1.0821        C7-P73=1.7943        C8-C3=1.3640         C8-C37=1.4071        C8-H66=1.0785        
C9-C36=1.3977        C9-C42=1.3692        C9-H54=1.0775        C10-C31=1.4464       C10-C37=1.4243       C10-C38=1.3972       
C11-C38=1.4377       C11-C40=1.3580       C11-P73=1.8213       C12-C34=1.4485       C12-C39=1.4106       C12-C41=1.4132       
C13-C35=1.4075       C13-C41=1.4413       C13-C42=1.3984       C14-C3=1.4046        C14-C5=1.4408        C14-C43=1.4071       
C15-C37=1.4169       C15-C43=1.4197       C15-C44=1.4149       C16-C38=1.4281       C16-C44=1.4163       C16-C45=1.4111       
C17-C39=1.3826       C17-C46=1.3856       C17-H55=1.0818       C18-C40=1.4201       C18-C45=1.4277       C18-C47=1.3780       
C19-C41=1.4018       C19-C46=1.3736       C19-H56=1.0778       C20-C5=1.4160        C20-C6=1.4159        C20-C48=1.4234       
C21-C47=1.4045       C21-C49=1.4043       C21-C52=1.4217       C22-C43=1.4279       C22-C48=1.4176       C22-C50=1.4059       
C23-C44=1.4189       C23-C50=1.4275       C23-C51=1.4051       C24-C45=1.4111       C24-C51=1.4187       C24-C52=1.4179       
C25-C6=1.4115        C25-C32=1.3621       C25-H57=1.0827       C26-C33=1.3926       C26-C36=1.4467       C26-C52=1.4158       
C27-C32=1.4300       C27-C34=1.4217       C27-C48=1.4179       C28-C33=1.3887       C28-C49=1.3723       C28-H58=1.0804       
C29-C34=1.4126       C29-C35=1.4302       C29-C50=1.4203       C30-C35=1.4192       C30-C36=1.4120       C30-C51=1.4247       
C31-C7=1.3384        C31-C10=1.4464       C31-H67=1.0818       C32-C25=1.3621       C32-C27=1.4300       C32-P74=1.8076       
C33-C26=1.3926       C33-C28=1.3887       C33-H59=1.0776       C34-C12=1.4485       C34-C27=1.4217       C34-C29=1.4126       
C35-C13=1.4075       C35-C29=1.4302       C35-C30=1.4192       C36-C9=1.3977        C36-C26=1.4467       C36-C30=1.4120       
C37-C8=1.4071        C37-C10=1.4243       C37-C15=1.4169       C38-C10=1.3972       C38-C11=1.4377       C38-C16=1.4281       
C39-C12=1.4106       C39-C17=1.3826       C39-P74=1.8055       C40-C11=1.3580       C40-C18=1.4201       C40-H68=1.0826       
C41-C12=1.4132       C41-C13=1.4413       C41-C19=1.4018       C42-C9=1.3692        C42-C13=1.3984       C42-H60=1.0776       
C43-C14=1.4071       C43-C15=1.4197       C43-C22=1.4279       C44-C15=1.4149       C44-C16=1.4163       C44-C23=1.4189       
C45-C16=1.4111       C45-C18=1.4277       C45-C24=1.4111       C46-C17=1.3856       C46-C19=1.3736       C46-H61=1.0799       
C47-C18=1.3780       C47-C21=1.4045       C47-H69=1.0808       C48-C20=1.4234       C48-C22=1.4176       C48-C27=1.4179       
C49-C21=1.4043       C49-C28=1.3723       C49-H70=1.0802       C50-C22=1.4059       C50-C23=1.4275       C50-C29=1.4203       
C51-C23=1.4051       C51-C24=1.4187       C51-C30=1.4247       C52-C21=1.4217       C52-C24=1.4179       C52-C26=1.4158       
H53-C2=1.0801        H54-C9=1.0775        H55-C17=1.0818       H56-C19=1.0778       H57-C25=1.0827       H58-C28=1.0804       
H59-C33=1.0776       H60-C42=1.0776       H61-C46=1.0799       H62-C1=1.0778        H63-C3=1.0778        H64-C4=1.0802        
H65-C7=1.0821        H66-C8=1.0785        H67-C31=1.0818       H68-C40=1.0826       H69-C47=1.0808       H70-C49=1.0802       
H71-P73=1.4025       H72-P74=1.4014       P73-C7=1.7943        P73-C11=1.8213       P73-H71=1.4025       P74-C32=1.8076       
P74-C39=1.8055       P74-H72=1.4014       
 C  H  Rav=1.0798 sigma=0.0018  Rmin=1.0775  Rmax=1.0827    18
 C  C  Rav=1.4083 sigma=0.0223  Rmin=1.3384  Rmax=1.4485    67
 P  H  Rav=1.4020 sigma=0.0006  Rmin=1.4014  Rmax=1.4025     2
 P  C  Rav=1.8072 sigma=0.0096  Rmin=1.7943  Rmax=1.8213     4
 
 selected bond angles (degree)
 --------------------
C5-C1-C4=121.68                H62-C1-C4=118.07               H62-C1-C5=120.25               C6-C2-C4=120.00                
H53-C2-C4=120.87               H53-C2-C6=119.12               C14-C3-C8=121.72               H63-C3-C8=118.33               
H63-C3-C14=119.94              C2-C4-C1=120.13                H64-C4-C1=119.61               H64-C4-C2=120.25               
C14-C5-C1=122.40               C20-C5-C1=118.77               C20-C5-C14=118.83              C20-C6-C2=120.51               
C25-C6-C2=121.33               C25-C6-C20=118.13              H65-C7-C31=120.78              P73-C7-C31=122.19              
P73-C7-H65=116.71              C37-C8-C3=121.37               H66-C8-C3=118.64               H66-C8-C37=119.95              
C42-C9-C36=121.49              H54-C9-C36=120.40              H54-C9-C42=118.11              C37-C10-C31=119.27             
C38-C10-C31=120.98             C38-C10-C37=119.52             
 
 selected dihedral angles (degree)
 ---------------------------------
C2-C4-C1-C5=  0.77            C2-C4-C1-H62=180.15           H64-C4-C1-C5=180.07           H64-C4-C1-H62=359.46          
C1-C4-C2-C6=357.92            C1-C4-C2-H53=178.26           H64-C4-C2-C6=178.62           H64-C4-C2-H53=358.96          
C14-C5-C1-C4=182.47           C14-C5-C1-H62=  3.10          C20-C5-C1-C4=  2.49           C20-C5-C1-H62=183.12          
C20-C6-C2-C4=  0.12           C20-C6-C2-H53=179.78          C25-C6-C2-C4=178.06           C25-C6-C2-H53=357.72          
C37-C8-C3-C14=359.87          C37-C8-C3-H63=178.55          H66-C8-C3-C14=182.23          H66-C8-C3-H63=  0.91          
           -------------------------------------------------
          |                Final Singlepoint                |
           -------------------------------------------------

          ...................................................
          :                      SETUP                      :
          :.................................................:
          :  # basis functions                 248          :
          :  # atomic orbitals                 246          :
          :  # shells                          130          :
          :  # electrons                       238          :
          :  max. iterations                   250          :
          :  Hamiltonian                  GFN2-xTB          :
          :  restarted?                      false          :
          :  GBSA solvation                  false          :
          :  PC potential                    false          :
          :  electronic temp.          300.0000000     K    :
          :  accuracy                    1.0000000          :
          :  -> integral cutoff          0.2500000E+02      :
          :  -> integral neglect         0.1000000E-07      :
          :  -> SCF convergence          0.1000000E-05 Eh   :
          :  -> wf. convergence          0.1000000E-03 e    :
          :  Broyden damping             0.4000000          :
          :  net charge                          0          :
          :  unpaired electrons                  0          :
          ...................................................

 iter      E             dE          RMSdq      gap      omega  full diag
   1   -129.2570752 -0.129257E+03  0.896E-05    1.14       0.0  T
   2   -129.2570752  0.632383E-10  0.698E-05    1.14     166.6  T
   3   -129.2570752 -0.305533E-09  0.376E-05    1.14     309.3  T

   *** convergence criteria satisfied after 3 iterations ***

         #    Occupation            Energy/Eh            Energy/eV
      -------------------------------------------------------------
         1        2.0000           -0.6717271             -18.2786
       ...           ...                  ...                  ...
       113        2.0000           -0.3931375             -10.6978
       114        2.0000           -0.3900449             -10.6137
       115        2.0000           -0.3883122             -10.5665
       116        2.0000           -0.3807745             -10.3614
       117        2.0000           -0.3689015             -10.0383
       118        2.0000           -0.3627541              -9.8710
       119        2.0000           -0.3451691              -9.3925 (HOMO)
       120                         -0.3033657              -8.2550 (LUMO)
       121                         -0.2774855              -7.5508
       122                         -0.2758589              -7.5065
       123                         -0.2599290              -7.0730
       124                         -0.2442278              -6.6458
       ...                                ...                  ...
       246                          0.8971507              24.4127
      -------------------------------------------------------------
                  HL-Gap            0.0418034 Eh            1.1375 eV
             Fermi-level           -0.3242674 Eh           -8.8238 eV

 SCC (total)                   0 d,  0 h,  0 min,  0.123 sec
 SCC setup                      ...        0 min,  0.000 sec (  0.000%)
 Dispersion                     ...        0 min,  0.001 sec (  0.813%)
 classical contributions        ...        0 min,  0.001 sec (  0.813%)
 integral evaluation            ...        0 min,  0.017 sec ( 13.821%)
 iterations                     ...        0 min,  0.047 sec ( 38.211%)
 molecular gradient             ...        0 min,  0.056 sec ( 45.528%)
 printout                       ...        0 min,  0.001 sec (  0.813%)

         :::::::::::::::::::::::::::::::::::::::::::::::::::::
         ::                     SUMMARY                     ::
         :::::::::::::::::::::::::::::::::::::::::::::::::::::
         :: total energy            -126.839973151566 Eh    ::
         :: gradient norm              0.000753727614 Eh/a0 ::
         :: HOMO-LUMO gap              1.137528971391 eV    ::
         ::.................................................::
         :: SCC energy              -129.259014438607 Eh    ::
         :: -> isotropic ES            0.002988288417 Eh    ::
         :: -> anisotropic ES          0.007434508641 Eh    ::
         :: -> anisotropic XC          0.054614268348 Eh    ::
         :: -> dispersion             -0.143225670725 Eh    ::
         :: repulsion energy           2.419041287041 Eh    ::
         :: add. restraining           0.000000000000 Eh    ::
         :: total charge              -0.000000000000 e     ::
         :::::::::::::::::::::::::::::::::::::::::::::::::::::

           -------------------------------------------------
          |                Property Printout                |
           -------------------------------------------------

    * Orbital Energies and Occupations

         #    Occupation            Energy/Eh            Energy/eV
      -------------------------------------------------------------
         1        2.0000           -0.6717271             -18.2786
       ...           ...                  ...                  ...
       107        2.0000           -0.4065513             -11.0628
       108        2.0000           -0.4055756             -11.0363
       109        2.0000           -0.4051890             -11.0258
       110        2.0000           -0.3993698             -10.8674
       111        2.0000           -0.3990130             -10.8577
       112        2.0000           -0.3963316             -10.7847
       113        2.0000           -0.3931375             -10.6978
       114        2.0000           -0.3900449             -10.6137
       115        2.0000           -0.3883122             -10.5665
       116        2.0000           -0.3807745             -10.3614
       117        2.0000           -0.3689015             -10.0383
       118        2.0000           -0.3627541              -9.8710
       119        2.0000           -0.3451691              -9.3925 (HOMO)
       120                         -0.3033657              -8.2550 (LUMO)
       121                         -0.2774855              -7.5508
       122                         -0.2758589              -7.5065
       123                         -0.2599290              -7.0730
       124                         -0.2442278              -6.6458
       125                         -0.2409171              -6.5557
       126                         -0.2383467              -6.4857
       127                         -0.2358990              -6.4191
       128                         -0.2322821              -6.3207
       129                         -0.2290192              -6.2319
       130                         -0.2184401              -5.9441
       ...                                ...                  ...
       246                          0.8971507              24.4127
      -------------------------------------------------------------
                  HL-Gap            0.0418034 Eh            1.1375 eV
             Fermi-level           -0.3242674 Eh           -8.8238 eV

     #   Z          covCN         q      C6AA      α(0)
     1   6 C        2.922    -0.037    28.921     8.819
     2   6 C        2.922    -0.037    28.914     8.818
     3   6 C        2.918    -0.037    28.910     8.817
     4   6 C        2.914    -0.030    28.741     8.791
     5   6 C        2.979     0.006    27.873     8.660
     6   6 C        2.986     0.012    27.750     8.641
     7   6 C        2.839    -0.039    28.972     8.821
     8   6 C        2.918    -0.038    28.934     8.821
     9   6 C        2.920    -0.037    28.915     8.818
    10   6 C        2.973     0.004    27.926     8.668
    11   6 C        2.910    -0.001    28.054     8.685
    12   6 C        3.045     0.005    27.877     8.660
    13   6 C        2.983     0.004    27.918     8.667
    14   6 C        2.980     0.005    27.915     8.667
    15   6 C        2.991     0.001    27.999     8.680
    16   6 C        2.988    -0.000    28.029     8.685
    17   6 C        3.040    -0.035    28.821     8.805
    18   6 C        2.978     0.010    27.779     8.645
    19   6 C        2.925    -0.037    28.930     8.821
    20   6 C        2.995     0.001    27.988     8.678
    21   6 C        2.982     0.012    27.738     8.639
    22   6 C        2.986    -0.000    28.030     8.685
    23   6 C        2.986    -0.001    28.036     8.685
    24   6 C        2.987     0.000    28.009     8.681
    25   6 C        3.052    -0.042    29.000     8.832
    26   6 C        2.976     0.006    27.876     8.661
    27   6 C        3.033     0.003    27.923     8.667
    28   6 C        2.913    -0.030    28.747     8.792
    29   6 C        2.984    -0.001    28.042     8.686
    30   6 C        2.990     0.001    27.985     8.678
    31   6 C        2.999    -0.031    28.758     8.797
    32   6 C        2.914     0.003    27.950     8.669
    33   6 C        2.922    -0.037    28.912     8.818
    34   6 C        2.973     0.002    27.988     8.678
    35   6 C        2.989     0.001    27.989     8.678
    36   6 C        2.980     0.005    27.916     8.667
    37   6 C        2.984     0.004    27.935     8.670
    38   6 C        3.028     0.006    27.869     8.659
    39   6 C        2.922     0.005    27.908     8.663
    40   6 C        3.035    -0.044    29.047     8.840
    41   6 C        2.985     0.006    27.878     8.661
    42   6 C        2.920    -0.037    28.931     8.820
    43   6 C        2.989     0.002    27.982     8.677
    44   6 C        2.988    -0.001    28.047     8.687
    45   6 C        2.993     0.001    28.004     8.681
    46   6 C        2.915    -0.030    28.759     8.794
    47   6 C        2.925    -0.045    29.115     8.849
    48   6 C        2.987     0.000    28.015     8.682
    49   6 C        2.922    -0.037    28.917     8.818
    50   6 C        2.986    -0.000    28.026     8.684
    51   6 C        2.987     0.000    28.013     8.682
    52   6 C        2.995     0.001    27.987     8.678
    53   1 H        0.926     0.032     2.559     2.501
    54   1 H        0.926     0.034     2.530     2.487
    55   1 H        0.925     0.035     2.514     2.480
    56   1 H        0.926     0.036     2.502     2.474
    57   1 H        0.925     0.035     2.517     2.481
    58   1 H        0.926     0.030     2.587     2.515
    59   1 H        0.926     0.033     2.549     2.497
    60   1 H        0.926     0.034     2.525     2.485
    61   1 H        0.926     0.033     2.549     2.497
    62   1 H        0.926     0.033     2.538     2.491
    63   1 H        0.926     0.034     2.533     2.489
    64   1 H        0.926     0.031     2.579     2.511
    65   1 H        0.926     0.041     2.429     2.437
    66   1 H        0.926     0.034     2.528     2.486
    67   1 H        0.925     0.037     2.483     2.464
    68   1 H        0.925     0.034     2.527     2.486
    69   1 H        0.926     0.032     2.555     2.500
    70   1 H        0.926     0.032     2.565     2.504
    71   1 H        0.976     0.048     2.339     2.390
    72   1 H        0.977     0.047     2.346     2.393
    73  15 P        3.102    -0.065   163.138    22.944
    74  15 P        3.215    -0.085   164.052    23.008

 Mol. C6AA /au·bohr⁶  :     111270.088444
 Mol. C8AA /au·bohr⁸  :    3190497.453259
 Mol. α(0) /au        :        549.047896


Wiberg/Mayer (AO) data.
largest (>0.10) Wiberg bond orders for each atom

 ---------------------------------------------------------------------------
     #   Z sym  total        # sym  WBO       # sym  WBO       # sym  WBO
 ---------------------------------------------------------------------------
     1   6 C    3.943 --     4 C    1.420     5 C    1.377    62 H    0.962
     2   6 C    3.944 --     4 C    1.464     6 C    1.328    53 H    0.969
     3   6 C    3.969 --     8 C    1.539    14 C    1.301    63 H    0.961
     4   6 C    3.981 --     2 C    1.464     1 C    1.420    64 H    0.970
     5   6 C    3.981 --     1 C    1.377    20 C    1.263    14 C    1.145
     6   6 C    3.985 --     2 C    1.328    20 C    1.252    25 C    1.229
     7   6 C    3.942 --    31 C    1.761    73 P    1.085    65 H    0.953
     8   6 C    3.946 --     3 C    1.539    37 C    1.287    66 H    0.962
     9   6 C    3.973 --    42 C    1.498    36 C    1.337    54 H    0.961
    10   6 C    3.919 --    38 C    1.361    37 C    1.222    31 C    1.133
    11   6 C    3.964 --    40 C    1.596    38 C    1.165    73 P    1.030
    12   6 C    3.981 --    39 C    1.295    41 C    1.294    34 C    1.154
    13   6 C    3.971 --    42 C    1.331    35 C    1.297    41 C    1.138
    14   6 C    3.945 --    43 C    1.308     3 C    1.301     5 C    1.145
    15   6 C    3.975 --    37 C    1.256    44 C    1.248    43 C    1.246
    16   6 C    3.972 --    45 C    1.276    44 C    1.255    38 C    1.214
    17   6 C    3.979 --    39 C    1.439    46 C    1.390    55 H    0.962
    18   6 C    3.988 --    47 C    1.434    40 C    1.197    45 C    1.188
    19   6 C    3.984 --    46 C    1.483    41 C    1.342    56 H    0.961
    20   6 C    3.984 --     5 C    1.263     6 C    1.252    48 C    1.233
    21   6 C    3.985 --    49 C    1.299    47 C    1.284    52 C    1.235
    22   6 C    3.969 --    50 C    1.299    48 C    1.243    43 C    1.200
    23   6 C    3.970 --    51 C    1.301    44 C    1.241    50 C    1.203
    24   6 C    3.978 --    45 C    1.275    52 C    1.245    51 C    1.233
    25   6 C    3.967 --    32 C    1.558     6 C    1.229    57 H    0.958
    26   6 C    3.983 --    33 C    1.393    52 C    1.262    36 C    1.133
    27   6 C    3.961 --    48 C    1.272    34 C    1.263    32 C    1.193
    28   6 C    3.982 --    49 C    1.491    33 C    1.396    58 H    0.970
    29   6 C    3.974 --    34 C    1.306    50 C    1.243    35 C    1.198
    30   6 C    3.983 --    36 C    1.293    35 C    1.258    51 C    1.205
    31   6 C    3.989 --     7 C    1.761    10 C    1.133    67 H    0.954
    32   6 C    3.979 --    25 C    1.558    27 C    1.193    74 P    1.037
    33   6 C    3.927 --    28 C    1.396    26 C    1.393    59 H    0.962
    34   6 C    3.954 --    29 C    1.306    27 C    1.263    12 C    1.154
    35   6 C    3.981 --    13 C    1.297    30 C    1.258    29 C    1.198
    36   6 C    3.960 --     9 C    1.337    30 C    1.293    26 C    1.133
    37   6 C    3.972 --     8 C    1.287    15 C    1.256    10 C    1.222
    38   6 C    3.978 --    10 C    1.361    16 C    1.214    11 C    1.165
    39   6 C    3.972 --    17 C    1.439    12 C    1.295    74 P    1.039
    40   6 C    3.976 --    11 C    1.596    18 C    1.197    68 H    0.959
    41   6 C    3.977 --    19 C    1.342    12 C    1.294    13 C    1.138
    42   6 C    3.962 --     9 C    1.498    13 C    1.331    60 H    0.961
    43   6 C    3.984 --    14 C    1.308    15 C    1.246    22 C    1.200
    44   6 C    3.974 --    16 C    1.255    15 C    1.248    23 C    1.241
    45   6 C    3.967 --    16 C    1.276    24 C    1.275    18 C    1.188
    46   6 C    3.976 --    19 C    1.483    17 C    1.390    61 H    0.969
    47   6 C    3.904 --    18 C    1.434    21 C    1.284    69 H    0.966
    48   6 C    3.976 --    27 C    1.272    22 C    1.243    20 C    1.233
    49   6 C    3.925 --    28 C    1.491    21 C    1.299    70 H    0.969
    50   6 C    3.971 --    22 C    1.299    29 C    1.243    23 C    1.203
    51   6 C    3.956 --    23 C    1.301    24 C    1.233    30 C    1.205
    52   6 C    3.972 --    26 C    1.262    24 C    1.245    21 C    1.235
    53   1 H    0.998 --     2 C    0.969
    54   1 H    0.998 --     9 C    0.961
    55   1 H    0.998 --    17 C    0.962
    56   1 H    0.998 --    19 C    0.961
    57   1 H    0.997 --    25 C    0.958
    58   1 H    0.998 --    28 C    0.970
    59   1 H    0.998 --    33 C    0.962
    60   1 H    0.998 --    42 C    0.961
    61   1 H    0.998 --    46 C    0.969
    62   1 H    0.998 --     1 C    0.962
    63   1 H    0.998 --     3 C    0.961
    64   1 H    0.998 --     4 C    0.970
    65   1 H    0.997 --     7 C    0.953
    66   1 H    0.998 --     8 C    0.962
    67   1 H    0.998 --    31 C    0.954
    68   1 H    0.997 --    40 C    0.959
    69   1 H    0.998 --    47 C    0.966
    70   1 H    0.998 --    49 C    0.969
    71   1 H    0.990 --    73 P    0.930
    72   1 H    0.994 --    74 P    0.942
    73  15 P    3.305 --     7 C    1.085    11 C    1.030    71 H    0.930
    74  15 P    3.307 --    39 C    1.039    32 C    1.037    72 H    0.942
 ---------------------------------------------------------------------------

Topologies differ in total number of bonds
Writing topology from bond orders to xtbtopo.mol

molecular dipole:
                 x           y           z       tot (Debye)
 q only:        0.061       0.027       0.373
   full:        0.009       0.047       0.840       2.139
molecular quadrupole (traceless):
                xx          xy          yy          xz          yz          zz
 q only:        1.979      -0.149       9.924      -0.310      -1.130     -11.903
  q+dip:        9.873       2.101      26.897      -0.418      -2.927     -36.770
   full:        0.809       1.770      17.775      -0.065      -2.979     -18.584

           -------------------------------------------------
          |                Geometry Summary                 |
           -------------------------------------------------

      molecular mass/u    :      706.6646058
   center of mass at/Å    :        0.0008211      -0.0056267      -0.0171344
  moments of inertia/u·Å² :        0.7248154E+04   0.1068483E+05   0.1776885E+05
rotational constants/cm⁻¹ :        0.2325783E-02   0.1577716E-02   0.9487183E-03

 * 84 selected distances

     #   Z          #   Z                                           value/Å
     1   6 C        4   6 C                                       1.3845827
     2   6 C        4   6 C                                       1.3759807
     1   6 C        5   6 C                                       1.3952823
     2   6 C        6   6 C                                       1.3980372
     3   6 C        8   6 C                                       1.3640343
     3   6 C       14   6 C                                       1.4046399
     5   6 C       20   6 C                                       1.4159901
     6   6 C       20   6 C                                       1.4159184
     6   6 C       25   6 C                                       1.4114672
     7   6 C       31   6 C                                       1.3384282
    25   6 C       32   6 C                                       1.3620742
    27   6 C       32   6 C                                       1.4300002
    26   6 C       33   6 C                                       1.3926012
    28   6 C       33   6 C                                       1.3887377
    27   6 C       34   6 C                                       1.4217028
    29   6 C       34   6 C                                       1.4125813
    13   6 C       35   6 C                                       1.4075208
    29   6 C       35   6 C                                       1.4301591
    30   6 C       35   6 C                                       1.4191892
     9   6 C       36   6 C                                       1.3977159
    30   6 C       36   6 C                                       1.4119988
     8   6 C       37   6 C                                       1.4071250
    10   6 C       37   6 C                                       1.4242763
    15   6 C       37   6 C                                       1.4169034
    10   6 C       38   6 C                                       1.3972018
    16   6 C       38   6 C                                       1.4280750
    12   6 C       39   6 C                                       1.4105662
    17   6 C       39   6 C                                       1.3826392
    11   6 C       40   6 C                                       1.3580243
    18   6 C       40   6 C                                       1.4201065
    12   6 C       41   6 C                                       1.4131862
    19   6 C       41   6 C                                       1.4018373
     9   6 C       42   6 C                                       1.3691578
    13   6 C       42   6 C                                       1.3984490
    14   6 C       43   6 C                                       1.4071074
    15   6 C       43   6 C                                       1.4197125
    22   6 C       43   6 C                                       1.4279353
    15   6 C       44   6 C                                       1.4149358
    16   6 C       44   6 C                                       1.4162641
    23   6 C       44   6 C                                       1.4189150
    16   6 C       45   6 C                                       1.4110906
    18   6 C       45   6 C                                       1.4276674
    24   6 C       45   6 C                                       1.4111059
    17   6 C       46   6 C                                       1.3855818
    19   6 C       46   6 C                                       1.3735894
    18   6 C       47   6 C                                       1.3779624
    21   6 C       47   6 C                                       1.4045277
    20   6 C       48   6 C                                       1.4234365
    22   6 C       48   6 C                                       1.4176195
    27   6 C       48   6 C                                       1.4179126
    21   6 C       49   6 C                                       1.4042734
    28   6 C       49   6 C                                       1.3722757
    22   6 C       50   6 C                                       1.4059345
    23   6 C       50   6 C                                       1.4275020
    29   6 C       50   6 C                                       1.4203309
    23   6 C       51   6 C                                       1.4051436
    24   6 C       51   6 C                                       1.4187033
    30   6 C       51   6 C                                       1.4246536
    21   6 C       52   6 C                                       1.4216827
    24   6 C       52   6 C                                       1.4178765
    26   6 C       52   6 C                                       1.4158327
     2   6 C       53   1 H                                       1.0801060
     9   6 C       54   1 H                                       1.0774772 (min)
    17   6 C       55   1 H                                       1.0818173
    19   6 C       56   1 H                                       1.0777596
    25   6 C       57   1 H                                       1.0827109
    28   6 C       58   1 H                                       1.0803816
    33   6 C       59   1 H                                       1.0776458
    42   6 C       60   1 H                                       1.0775804
    46   6 C       61   1 H                                       1.0798674
     1   6 C       62   1 H                                       1.0778249
     3   6 C       63   1 H                                       1.0777933
     4   6 C       64   1 H                                       1.0802223
     7   6 C       65   1 H                                       1.0820513
     8   6 C       66   1 H                                       1.0784959
    31   6 C       67   1 H                                       1.0817668
    40   6 C       68   1 H                                       1.0826324
    47   6 C       69   1 H                                       1.0808398
    49   6 C       70   1 H                                       1.0801625
     7   6 C       73  15 P                                       1.7942991
    71   1 H       73  15 P                                       1.4025196
    32   6 C       74  15 P                                       1.8076480 (max)
    39   6 C       74  15 P                                       1.8054569
    72   1 H       74  15 P                                       1.4013815

 * 4 distinct bonds (by element types)

   Z      Z             #   av. dist./Å        max./Å        min./Å
   1 H    6 C          18     1.0798408     1.0827109     1.0774772
   6 C    6 C          61     1.4048486     1.4301591     1.3384282
   1 H   15 P           2     1.4019505     1.4025196     1.4013815
   6 C   15 P           3     1.8024680     1.8076480     1.7942991


optimized geometry written to: xtbopt.xyz


           -------------------------------------------------
          | TOTAL ENERGY             -126.839973151566 Eh   |
          | GRADIENT NORM               0.000753727614 Eh/α |
          | HOMO-LUMO GAP               1.137528971391 eV   |
           -------------------------------------------------

------------------------------------------------------------------------
 * finished run on 2025/12/08 at 00:34:27.815     
------------------------------------------------------------------------
 total:
 * wall-time:     0 d,  0 h,  0 min,  2.778 sec
 *  cpu-time:     0 d,  0 h,  0 min, 10.641 sec
 * ratio c/w:     3.830 speedup
 SCF:
 * wall-time:     0 d,  0 h,  0 min,  0.266 sec
 *  cpu-time:     0 d,  0 h,  0 min,  1.062 sec
 * ratio c/w:     3.994 speedup
 ANC optimizer:
 * wall-time:     0 d,  0 h,  0 min,  2.448 sec
 *  cpu-time:     0 d,  0 h,  0 min,  9.328 sec
 * ratio c/w:     3.811 speedup

normal termination of xtb
