      -----------------------------------------------------------      
     |                   =====================                   |     
     |                           x T B                           |     
     |                   =====================                   |     
     |                         S. Grimme                         |     
     |          Mulliken Center for Theoretical Chemistry        |     
     |                    University of Bonn                     |     
      -----------------------------------------------------------      

   * xtb version 6.7.1pre (5071a88) compiled by 'Marcel@Raven' on 2024-07-23

   xtb is free software: you can redistribute it and/or modify it under
   the terms of the GNU Lesser General Public License as published by
   the Free Software Foundation, either version 3 of the License, or
   (at your option) any later version.
   
   xtb is distributed in the hope that it will be useful,
   but WITHOUT ANY WARRANTY; without even the implied warranty of
   MERCHANTABILITY or FITNESS FOR A PARTICULAR PURPOSE.  See the
   GNU Lesser General Public License for more details.
   
   Cite this work as:
   * C. Bannwarth, E. Caldeweyher, S. Ehlert, A. Hansen, P. Pracht,
     J. Seibert, S. Spicher, S. Grimme, WIREs Comput. Mol. Sci., 2020, 11,
     e01493. DOI: 10.1002/wcms.1493
   
   for GFN2-xTB:
   * C. Bannwarth, S. Ehlert and S. Grimme., J. Chem. Theory Comput., 2019,
     15, 1652-1671. DOI: 10.1021/acs.jctc.8b01176
   for GFN1-xTB:
   * S. Grimme, C. Bannwarth, P. Shushkov, J. Chem. Theory Comput., 2017,
     13, 1989-2009. DOI: 10.1021/acs.jctc.7b00118
   for GFN0-xTB:
   * P. Pracht, E. Caldeweyher, S. Ehlert, S. Grimme, ChemRxiv, 2019, preprint.
     DOI: 10.26434/chemrxiv.8326202.v1
   for GFN-FF:
   * S. Spicher and S. Grimme, Angew. Chem. Int. Ed., 2020, 59, 15665-15673.
     DOI: 10.1002/anie.202004239
   
   for ALPB and GBSA implicit solvation:
   * S. Ehlert, M. Stahn, S. Spicher, S. Grimme, J. Chem. Theory Comput.,
     2021, 17, 4250-4261. DOI: 10.1021/acs.jctc.1c00471
   
   for ddCOSMO and CPCM-X implicit solvation:
   * M. Stahn, S. Ehlert, S. Grimme, J. Phys. Chem. A,
     2023, XX, XXXX-XXXX. DOI: 10.1021/acs.jpca.3c04382
   
   for DFT-D4:
   * E. Caldeweyher, C. Bannwarth and S. Grimme, J. Chem. Phys., 2017,
     147, 034112. DOI: 10.1063/1.4993215
   * E. Caldeweyher, S. Ehlert, A. Hansen, H. Neugebauer, S. Spicher,
     C. Bannwarth and S. Grimme, J. Chem. Phys., 2019, 150, 154122.
     DOI: 10.1063/1.5090222
   * E. Caldeweyher, J.-M. Mewes, S. Ehlert and S. Grimme, Phys. Chem. Chem. Phys.
     2020, 22, 8499-8512. DOI: 10.1039/D0CP00502A
   
   for sTDA-xTB:
   * S. Grimme and C. Bannwarth, J. Chem. Phys., 2016, 145, 054103.
     DOI: 10.1063/1.4959605
   
   in the mass-spec context:
   * V. Asgeirsson, C. Bauer and S. Grimme, Chem. Sci., 2017, 8, 4879.
     DOI: 10.1039/c7sc00601b
   * J. Koopman and S. Grimme, ACS Omega 2019, 4, 12, 15120-15133.
     DOI: 10.1021/acsomega.9b02011
   
   for metadynamics refer to:
   * S. Grimme, J. Chem. Theory Comput., 2019, 155, 2847-2862
     DOI: 10.1021/acs.jctc.9b00143
   
   for SPH calculations refer to:
   * S. Spicher and S. Grimme, J. Chem. Theory Comput., 2021, 17, 1701-1714
     DOI: 10.1021/acs.jctc.0c01306
   
   for ONIOM refer to:
   * C. Plett, A. Katbashev, S. Ehlert, S. Grimme, M. Bursch,
     Phys. Chem. Chem. Phys., 2023, 25, 17860-17868. DOI: 10.1039/D3CP02178E
   
   for DIPRO refer to:
   * J. Kohn, N. Gildemeister, S. Grimme, D. Fazzi, A. Hansen,
     J. Chem. Phys., 2023, just accepted.
   
   for PTB refer to:
   * S. Grimme, M. Mueller, A. Hansen, J. Chem. Phys., 2023, 158, 124111.
     DOI: 10.1063/5.0137838
   
   with help from (in alphabetical order)
   P. Atkinson, C. Bannwarth, F. Bohle, G. Brandenburg, E. Caldeweyher
   M. Checinski, S. Dohm, S. Ehlert, S. Ehrlich, I. Gerasimov, C. Hölzer
   A. Katbashev, J. Kohn, J. Koopman, C. Lavigne, S. Lehtola, F. März, M. Müller,
   F. Musil, H. Neugebauer, J. Pisarek, C. Plett, P. Pracht, F. Pultar,
   J. Seibert, P. Shushkov, S. Spicher, M. Stahn, M. Steiner, T. Strunk,
   J. Stückrath, T. Rose, and J. Unsleber
   
 * started run on 2025/12/08 at 00:34:20.033     
   ID    Z sym.   atoms
    1    6 C      1-52
    2    1 H      53-72
    3    5 B      73, 74

           -------------------------------------------------
          |                Calculation Setup                |
           -------------------------------------------------

          program call               : xtb "C:\Users\LENOVO GAMING\Documents\GitHub\molecular-conductivity-sim\dataset\1nm-2Bdoped-3percent.xyz" --opt --parallel 4
          coordinate file            : C:\Users\LENOVO GAMING\Documents\GitHub\molecular-conductivity-sim\dataset\1nm-2Bdoped-3percent.xyz
          omp threads                :                     4


           -------------------------------------------------
          |                 G F N 2 - x T B                 |
           -------------------------------------------------

        Reference                      10.1021/acs.jctc.8b01176
      * Hamiltonian:
        H0-scaling (s, p, d)           1.850000    2.230000    2.230000
        zeta-weighting                 0.500000
      * Dispersion:
        s8                             2.700000
        a1                             0.520000
        a2                             5.000000
        s9                             5.000000
      * Repulsion:
        kExp                           1.500000    1.000000
        rExp                           1.000000
      * Coulomb:
        alpha                          2.000000
        third order                    shell-resolved
        anisotropic                    true
        a3                             3.000000
        a5                             4.000000
        cn-shift                       1.200000
        cn-exp                         4.000000
        max-rad                        5.000000


          ...................................................
          :                      SETUP                      :
          :.................................................:
          :  # basis functions                 236          :
          :  # atomic orbitals                 236          :
          :  # shells                          128          :
          :  # electrons                       234          :
          :  max. iterations                   250          :
          :  Hamiltonian                  GFN2-xTB          :
          :  restarted?                      false          :
          :  GBSA solvation                  false          :
          :  PC potential                    false          :
          :  electronic temp.          300.0000000     K    :
          :  accuracy                    1.0000000          :
          :  -> integral cutoff          0.2500000E+02      :
          :  -> integral neglect         0.1000000E-07      :
          :  -> SCF convergence          0.1000000E-05 Eh   :
          :  -> wf. convergence          0.1000000E-03 e    :
          :  Broyden damping             0.4000000          :
          :  net charge                          0          :
          :  unpaired electrons                  0          :
          ...................................................

 iter      E             dE          RMSdq      gap      omega  full diag
   1   -126.3041538 -0.126304E+03  0.618E+00    1.13       0.0  T
   2   -126.4619130 -0.157759E+00  0.392E+00    0.83       1.0  T
   3   -126.2793966  0.182516E+00  0.181E+00    1.17       1.0  T
   4   -126.5221477 -0.242751E+00  0.699E-01    1.05       1.0  T
   5   -126.5412576 -0.191099E-01  0.379E-01    1.07       1.0  T
   6   -126.5416035 -0.345907E-03  0.171E-01    1.06       1.0  T
   7   -126.5423448 -0.741213E-03  0.109E-01    1.05       1.0  T
   8   -126.5431833 -0.838576E-03  0.400E-02    1.06       1.0  T
   9   -126.5432623 -0.789785E-04  0.203E-02    1.05       1.0  T
  10   -126.5432681 -0.579434E-05  0.487E-03    1.05       2.4  T
  11   -126.5432693 -0.119890E-05  0.355E-03    1.05       3.3  T
  12   -126.5432695 -0.168580E-06  0.120E-03    1.05       9.7  T
  13   -126.5432695 -0.346405E-07  0.308E-04    1.05      37.7  T
  14   -126.5432695 -0.410162E-08  0.158E-04    1.05      73.6  T

   *** convergence criteria satisfied after 14 iterations ***

         #    Occupation            Energy/Eh            Energy/eV
      -------------------------------------------------------------
         1        2.0000           -0.6583755             -17.9153
       ...           ...                  ...                  ...
       111        2.0000           -0.3882617             -10.5651
       112        2.0000           -0.3846656             -10.4673
       113        2.0000           -0.3831377             -10.4257
       114        2.0000           -0.3777087             -10.2780
       115        2.0000           -0.3744917             -10.1904
       116        2.0000           -0.3701137             -10.0713
       117        2.0000           -0.3499562              -9.5228 (HOMO)
       118                         -0.3112150              -8.4686 (LUMO)
       119                         -0.2966004              -8.0709
       120                         -0.2812442              -7.6530
       121                         -0.2648070              -7.2058
       122                         -0.2501648              -6.8073
       ...                                ...                  ...
       236                          0.7317885              19.9130
      -------------------------------------------------------------
                  HL-Gap            0.0387411 Eh            1.0542 eV
             Fermi-level           -0.3305856 Eh           -8.9957 eV

 SCC (total)                   0 d,  0 h,  0 min,  0.289 sec
 SCC setup                      ...        0 min,  0.001 sec (  0.346%)
 Dispersion                     ...        0 min,  0.003 sec (  1.038%)
 classical contributions        ...        0 min,  0.000 sec (  0.000%)
 integral evaluation            ...        0 min,  0.014 sec (  4.844%)
 iterations                     ...        0 min,  0.215 sec ( 74.394%)
 molecular gradient             ...        0 min,  0.054 sec ( 18.685%)
 printout                       ...        0 min,  0.002 sec (  0.692%)

         :::::::::::::::::::::::::::::::::::::::::::::::::::::
         ::                     SUMMARY                     ::
         :::::::::::::::::::::::::::::::::::::::::::::::::::::
         :: total energy            -124.268758376153 Eh    ::
         :: gradient norm              0.048066707540 Eh/a0 ::
         :: HOMO-LUMO gap              1.054199524407 eV    ::
         ::.................................................::
         :: SCC energy              -126.545390962423 Eh    ::
         :: -> isotropic ES            0.040568370570 Eh    ::
         :: -> anisotropic ES          0.013730101331 Eh    ::
         :: -> anisotropic XC          0.056897590179 Eh    ::
         :: -> dispersion             -0.135228062762 Eh    ::
         :: repulsion energy           2.276632586270 Eh    ::
         :: add. restraining           0.000000000000 Eh    ::
         :: total charge              -0.000000000000 e     ::
         :::::::::::::::::::::::::::::::::::::::::::::::::::::

      ----------------------------------------------------------- 
     |                   =====================                   |
     |                        A N C O P T                        |
     |                   =====================                   |
     |               Approximate Normal Coordinate               |
     |                Rational Function Optimizer                |
      ----------------------------------------------------------- 
      ----------------------------------------------------------- 
     |                   =====================                   |
     |                        A N C O P T                        |
     |                   =====================                   |
     |               Approximate Normal Coordinate               |
     |                Rational Function Optimizer                |
      ----------------------------------------------------------- 

          ...................................................
          :                      SETUP                      :
          :.................................................:
          :   optimization level            normal          :
          :   max. optcycles                   222          :
          :   ANC micro-cycles                  20          :
          :   degrees of freedom               216          :
          :.................................................:
          :   RF solver                   davidson          :
          :   write xtbopt.log                true          :
          :   linear?                        false          :
          :   energy convergence         0.5000000E-05 Eh   :
          :   grad. convergence          0.1000000E-02 Eh/α :
          :   maxmium RF displ.          1.0000000          :
          :   Hlow (freq-cutoff)         0.1000000E-01      :
          :   Hmax (freq-cutoff)         5.0000000          :
          :   S6 in model hess.         20.0000000          :
          ...................................................

generating ANC from exact Hessian ...
Using Lindh-Hessian (1995)
 Shifting diagonal of input Hessian by   9.704015587012234E-003
 Lowest  eigenvalues of input Hessian
    0.000000    0.000000    0.000000    0.000000    0.000000    0.000000
    0.010000    0.010273    0.010638    0.010963    0.011185    0.012718
    0.012911    0.013459    0.014099    0.015768    0.015891    0.016395
 Highest eigenvalues
    1.999542    2.004154    2.043407    2.057154    2.082574    2.103781
 

........................................................................
.............................. CYCLE    1 ..............................
........................................................................

 iter      E             dE          RMSdq      gap      omega  full diag
   1   -126.5432695 -0.126543E+03  0.739E-05    1.05       0.0  T
   2   -126.5432695 -0.292886E-10  0.503E-05    1.05     231.2  T
   3   -126.5432695 -0.148731E-09  0.338E-05    1.05     343.5  T
     SCC iter.                  ...        0 min,  0.047 sec
     gradient                   ...        0 min,  0.052 sec
 * total energy  :  -124.2687584 Eh     change       -0.1203631E-08 Eh
   gradient norm :     0.0480659 Eh/α   predicted     0.0000000E+00 (-100.00%)
   displ. norm   :     0.3714187 α      lambda       -0.1022212E-01
   maximum displ.:     0.1707298 α      in ANC's #34, #38, #36, ...

........................................................................
.............................. CYCLE    2 ..............................
........................................................................

 iter      E             dE          RMSdq      gap      omega  full diag
   1   -126.6408327 -0.126641E+03  0.125E-01    1.06       0.0  T
   2   -126.6408336 -0.934383E-06  0.754E-02    1.06       1.0  T
   3   -126.6406683  0.165350E-03  0.433E-02    1.06       1.0  T
   4   -126.6408367 -0.168410E-03  0.889E-03    1.06       1.3  T
   5   -126.6408432 -0.649951E-05  0.230E-03    1.06       5.1  T
   6   -126.6408433 -0.890421E-07  0.153E-03    1.06       7.6  T
   7   -126.6408434 -0.109753E-06  0.399E-04    1.06      29.1  T
   8   -126.6408434 -0.590526E-08  0.221E-04    1.06      52.7  T
     SCC iter.                  ...        0 min,  0.120 sec
     gradient                   ...        0 min,  0.044 sec
 * total energy  :  -124.2758405 Eh     change       -0.7082078E-02 Eh
   gradient norm :     0.0169010 Eh/α   predicted    -0.5816364E-02 ( -17.87%)
   displ. norm   :     0.2674886 α      lambda       -0.2597278E-02
   maximum displ.:     0.1270270 α      in ANC's #34, #16, #38, ...

........................................................................
.............................. CYCLE    3 ..............................
........................................................................

 iter      E             dE          RMSdq      gap      omega  full diag
   1   -126.6970521 -0.126697E+03  0.793E-02    1.06       0.0  T
   2   -126.6970518  0.307691E-06  0.490E-02    1.06       1.0  T
   3   -126.6969521  0.997205E-04  0.328E-02    1.06       1.0  T
   4   -126.6970547 -0.102616E-03  0.663E-03    1.06       1.8  T
   5   -126.6970588 -0.402816E-05  0.144E-03    1.06       8.1  T
   6   -126.6970588 -0.544384E-07  0.928E-04    1.06      12.5  T
   7   -126.6970588 -0.294133E-07  0.286E-04    1.06      40.7  T
     SCC iter.                  ...        0 min,  0.105 sec
     gradient                   ...        0 min,  0.049 sec
 * total energy  :  -124.2772244 Eh     change       -0.1383898E-02 Eh
   gradient norm :     0.0034648 Eh/α   predicted    -0.1391591E-02 (   0.56%)
   displ. norm   :     0.0363552 α      lambda       -0.4158527E-04
   maximum displ.:     0.0270473 α      in ANC's #16, #31, #38, ...

........................................................................
.............................. CYCLE    4 ..............................
........................................................................

 iter      E             dE          RMSdq      gap      omega  full diag
   1   -126.6999613 -0.126700E+03  0.110E-02    1.06       0.0  T
   2   -126.6999613 -0.333364E-07  0.708E-03    1.06       1.6  T
   3   -126.6999589  0.244611E-05  0.485E-03    1.06       2.4  T
   4   -126.6999614 -0.255234E-05  0.103E-03    1.06      11.3  T
   5   -126.6999616 -0.105779E-06  0.298E-04    1.06      39.0  T
   6   -126.6999616 -0.516333E-08  0.129E-04    1.06      90.0  T
     SCC iter.                  ...        0 min,  0.092 sec
     gradient                   ...        0 min,  0.047 sec
 * total energy  :  -124.2772495 Eh     change       -0.2519077E-04 Eh
   gradient norm :     0.0013857 Eh/α   predicted    -0.2084120E-04 ( -17.27%)
   displ. norm   :     0.0160290 α      lambda       -0.4351152E-05
   maximum displ.:     0.0133281 α      in ANC's #16, #31, #28, ...

........................................................................
.............................. CYCLE    5 ..............................
........................................................................

 iter      E             dE          RMSdq      gap      omega  full diag
   1   -126.6999130 -0.126700E+03  0.642E-03    1.06       0.0  T
   2   -126.6999130 -0.102401E-07  0.391E-03    1.06       3.0  T
   3   -126.6999125  0.540321E-06  0.234E-03    1.06       5.0  T
   4   -126.6999131 -0.557960E-06  0.469E-04    1.06      24.8  T
   5   -126.6999131 -0.201444E-07  0.171E-04    1.06      68.0  T
     SCC iter.                  ...        0 min,  0.075 sec
     gradient                   ...        0 min,  0.047 sec
 * total energy  :  -124.2772518 Eh     change       -0.2248623E-05 Eh
   gradient norm :     0.0004993 Eh/α   predicted    -0.2183644E-05 (  -2.89%)
   displ. norm   :     0.0046465 α      lambda       -0.5003494E-06
   maximum displ.:     0.0034151 α      in ANC's #16, #31, #28, ...

   *** GEOMETRY OPTIMIZATION CONVERGED AFTER 5 ITERATIONS ***

------------------------------------------------------------------------
 total energy gain   :        -0.0084934 Eh       -5.3297 kcal/mol
 total RMSD          :         0.0777520 a0        0.0411 Å
 total power (kW/mol):        -4.4598923 (step)  -26.8668 (real)
------------------------------------------------------------------------

 ANCopt (total)                0 d,  0 h,  0 min,  0.830 sec
 optimizer setup                ...        0 min,  0.001 sec (  0.120%)
 model hessian                  ...        0 min,  0.039 sec (  4.699%)
 ANC generation                 ...        0 min,  0.010 sec (  1.205%)
 coordinate transformation      ...        0 min,  0.001 sec (  0.120%)
 single point calculation       ...        0 min,  0.768 sec ( 92.530%)
 optimization log               ...        0 min,  0.008 sec (  0.964%)
 hessian update                 ...        0 min,  0.000 sec (  0.000%)
 rational function              ...        0 min,  0.002 sec (  0.241%)

================
 final structure:
================
74
 xtb: 6.7.1pre (5071a88)
C           -3.58073100091352        4.88978827139340        0.00218661375551
C           -5.65368066907902        3.70093304651727        0.00200652364294
C           -0.66340295838471        4.87962642100713       -0.00053262988710
C           -4.96576682823080        4.89132320127795        0.00266502316852
C           -2.84418628231793        3.70434807322101        0.00106922402926
C           -4.95473413449616        2.48843714852623        0.00111672826336
C            4.95469994196053        5.01999731460700       -0.00150173439614
C            0.69946400749272        4.87864369490339       -0.00107587858030
C            0.69142127776907       -4.87001484889748        0.00240797810201
C            2.87247883706498        3.68298260916617       -0.00098607183180
C            4.99689413477068        2.44464993164693       -0.00094425578449
C           -3.57635732327171       -2.48927576062028       -0.00086565325959
C           -1.41633010698753       -3.68893867127468        0.00038633176284
C           -1.40368153209134        3.68889779275322        0.00024894791355
C            0.71565595428609        2.46276588022304       -0.00035380658163
C            2.82856401103967        1.23362594458713       -0.00040819629764
C           -5.64429425648005       -3.76892212229466       -0.00260285143522
C            4.94933095898194       -0.00209618011197       -0.00024300128324
C           -3.56372869989442       -4.91703734432511       -0.00229336284896
C           -3.53803960060459        2.47148534602370        0.00077774714916
C            4.96456054267347       -2.42760232433312        0.00049381785239
C           -1.42129165146165        1.22744404868371        0.00011722266429
C            0.69893147677653       -0.00070097992478       -0.00001481231144
C            2.82186919636801       -1.21866948551224        0.00028877218681
C           -5.63989057582064        1.25721870156845        0.00048322730690
C            2.85959552046376       -3.67896678172116        0.00113106934424
C           -3.55914273968667        0.01045355038730       -0.00008231070504
C            4.99823376412513       -4.83329815686103        0.00108904293609
C           -1.44987051399563       -1.22691732616843       -0.00009365287279
C            0.69722057722166       -2.45770132521341        0.00060332364814
C            3.60449501573433        4.92240043768950       -0.00130237900370
C           -4.99445831055966        0.04841378754708       -0.00016250526589
C            3.60957289851767       -4.85283690241679        0.00124884880274
C           -2.86585242031073       -1.22982944414932       -0.00029281785594
C           -0.72377319380685       -2.45981012794575        0.00024382516762
C            1.41394650777810       -3.67506321837114        0.00132958505932
C            1.44117440417130        3.68413044801280       -0.00078734664565
C            3.55516059531963        2.46099798196964       -0.00078179417505
C           -4.99542262911114       -2.53838940995667       -0.00156317460666
C            5.63726300308510        1.23819313096686       -0.00068364400530
C           -2.85787518485279       -3.70499785177496       -0.00086904463114
C           -0.67583892744052       -4.87551822368286        0.00194963455214
C           -0.70634331884393        2.46560877715278        0.00003620486311
C            1.41190600320479        1.22877680897118       -0.00026217047378
C            3.52164138589015        0.00505755370816       -0.00012487458571
C           -4.93787427454288       -4.95784250846374       -0.00316611203419
C            5.63822902243472       -1.19690304999131        0.00004968078281
C           -2.84012058858044        1.23042754533481        0.00023782768593
C            5.67447613619475       -3.63958058771006        0.00076452249041
C           -0.73025436164208        0.00043765035202       -0.00001096331291
C            1.40192507573280       -1.21889297701438        0.00025800378544
C            3.54230930478542       -2.44002243005385        0.00064341367208
H           -6.73366303741560        3.68341274833421        0.00224112166952
H            1.20205806866825       -5.81856668759753        0.00364904741237
H           -6.72433583815725       -3.78422971452775       -0.00310029106834
H           -3.03423747825160       -5.85527554569884       -0.00290959836531
H           -6.72080138011520        1.27729135627959        0.00050799236705
H            5.54128645840705       -5.76708340808793        0.00121418452390
H            3.12396053201043       -5.81472729854614        0.00140654264346
H           -1.17034528186159       -5.83198029972643        0.00296932041907
H           -5.45323985650910       -5.90737634150886       -0.00425579844033
H           -3.07962938642937        5.84372846595354        0.00278728577088
H           -1.16764871992504        5.83170216031384       -0.00083805218882
H           -5.49849442632550        5.83098504603903        0.00352159526401
H            5.37238513209094        6.02035175369910       -0.00172292033716
H            1.19633209750134        5.83389440211331       -0.00174104134607
H            3.02791194232669        5.83602884193097       -0.00134685436008
H            6.71843116699235        1.20974093516668       -0.00079817254549
H            6.71929160842302       -1.19043982127824       -0.00006516001068
H            6.75419748588981       -3.61330957016787        0.00066838072580
H            6.97831591399972        3.76037242345546       -0.00154705493717
H           -6.98200533447118       -1.24138850036442       -0.00130352582760
B            5.80666985561541        3.76198933271929       -0.00135060834693
B           -5.81105999289916       -1.24644333790968       -0.00104448893838
 
 Bond Distances (Angstroems)
 ---------------------------
C1-C4=1.3850         C1-C5=1.3956         C1-H62=1.0775        C2-C4=1.3749         C2-C6=1.3995         C2-H53=1.0801        
C3-C8=1.3629         C3-C14=1.4021        C3-H63=1.0774        C4-C1=1.3850         C4-C2=1.3749         C4-H64=1.0802        
C5-C1=1.3956         C5-C14=1.4406        C5-C20=1.4147        C6-C2=1.3995         C6-C20=1.4168        C6-C25=1.4090        
C7-C31=1.3537        C7-H65=1.0841        C7-B73=1.5194        C8-C3=1.3629         C8-C37=1.4061        C8-H66=1.0767        
C9-C36=1.3964        C9-C42=1.3673        C9-H54=1.0773        C10-C31=1.4394       C10-C37=1.4313       C10-C38=1.3998       
C11-C38=1.4418       C11-C40=1.3659       C11-B73=1.5463       C12-C34=1.4460       C12-C39=1.4199       C12-C41=1.4122       
C13-C35=1.4108       C13-C41=1.4416       C13-C42=1.3987       C14-C3=1.4021        C14-C5=1.4406        C14-C43=1.4081       
C15-C37=1.4206       C15-C43=1.4220       C15-C44=1.4169       C16-C38=1.4263       C16-C44=1.4167       C16-C45=1.4106       
C17-C39=1.3911       C17-C46=1.3830       C17-H55=1.0802       C18-C40=1.4183       C18-C45=1.4277       C18-C47=1.3792       
C19-C41=1.4026       C19-C46=1.3748       C19-H56=1.0773       C20-C5=1.4147        C20-C6=1.4168        C20-C48=1.4238       
C21-C47=1.4030       C21-C49=1.4046       C21-C52=1.4223       C22-C43=1.4298       C22-C48=1.4188       C22-C50=1.4082       
C23-C44=1.4212       C23-C50=1.4292       C23-C51=1.4065       C24-C45=1.4097       C24-C51=1.4199       C24-C52=1.4180       
C25-C6=1.4090        C25-C32=1.3703       C25-H57=1.0811       C26-C33=1.3930       C26-C36=1.4457       C26-C52=1.4146       
C27-C32=1.4358       C27-C34=1.4209       C27-C48=1.4161       C28-C33=1.3888       C28-C49=1.3720       C28-H58=1.0802       
C29-C34=1.4160       C29-C35=1.4308       C29-C50=1.4228       C30-C35=1.4210       C30-C36=1.4127       C30-C51=1.4252       
C31-C7=1.3537        C31-C10=1.4394       C31-H67=1.0804       C32-C25=1.3703       C32-C27=1.4358       C32-B74=1.5308       
C33-C26=1.3930       C33-C28=1.3888       C33-H59=1.0775       C34-C12=1.4460       C34-C27=1.4209       C34-C29=1.4160       
C35-C13=1.4108       C35-C29=1.4308       C35-C30=1.4210       C36-C9=1.3964        C36-C26=1.4457       C36-C30=1.4127       
C37-C8=1.4061        C37-C10=1.4313       C37-C15=1.4206       C38-C10=1.3998       C38-C11=1.4418       C38-C16=1.4263       
C39-C12=1.4199       C39-C17=1.3911       C39-B74=1.5279       C40-C11=1.3659       C40-C18=1.4183       C40-H68=1.0815       
C41-C12=1.4122       C41-C13=1.4416       C41-C19=1.4026       C42-C9=1.3673        C42-C13=1.3987       C42-H60=1.0767       
C43-C14=1.4081       C43-C15=1.4220       C43-C22=1.4298       C44-C15=1.4169       C44-C16=1.4167       C44-C23=1.4212       
C45-C16=1.4106       C45-C18=1.4277       C45-C24=1.4097       C46-C17=1.3830       C46-C19=1.3748       C46-H61=1.0804       
C47-C18=1.3792       C47-C21=1.4030       C47-H69=1.0811       C48-C20=1.4238       C48-C22=1.4188       C48-C27=1.4161       
C49-C21=1.4046       C49-C28=1.3720       C49-H70=1.0800       C50-C22=1.4082       C50-C23=1.4292       C50-C29=1.4228       
C51-C23=1.4065       C51-C24=1.4199       C51-C30=1.4252       C52-C21=1.4223       C52-C24=1.4180       C52-C26=1.4146       
H53-C2=1.0801        H54-C9=1.0773        H55-C17=1.0802       H56-C19=1.0773       H57-C25=1.0811       H58-C28=1.0802       
H59-C33=1.0775       H60-C42=1.0767       H61-C46=1.0804       H62-C1=1.0775        H63-C3=1.0774        H64-C4=1.0802        
H65-C7=1.0841        H66-C8=1.0767        H67-C31=1.0804       H68-C40=1.0815       H69-C47=1.0811       H70-C49=1.0800       
H71-B73=1.1716       H72-B74=1.1710       B73-C7=1.5194        B73-C11=1.5463       B73-H71=1.1716       B74-C32=1.5308       
B74-C39=1.5279       B74-H72=1.1710       
 B  H  Rav=1.1713 sigma=0.0003  Rmin=1.1710  Rmax=1.1716     2
 C  H  Rav=1.0794 sigma=0.0020  Rmin=1.0767  Rmax=1.0841    18
 C  B  Rav=1.5311 sigma=0.0097  Rmin=1.5194  Rmax=1.5463     4
 C  C  Rav=1.4094 sigma=0.0213  Rmin=1.3537  Rmax=1.4460    67
 
 selected bond angles (degree)
 --------------------
C5-C1-C4=121.92                H62-C1-C4=117.65               H62-C1-C5=120.43               C6-C2-C4=120.02                
H53-C2-C4=120.95               H53-C2-C6=119.03               C14-C3-C8=121.83               H63-C3-C8=117.95               
H63-C3-C14=120.22              C2-C4-C1=119.96                H64-C4-C1=119.61               H64-C4-C2=120.43               
C14-C5-C1=122.47               C20-C5-C1=118.78               C20-C5-C14=118.76              C20-C6-C2=120.65               
C25-C6-C2=120.94               C25-C6-C20=118.41              H65-C7-C31=116.80              B73-C7-C31=119.97              
B73-C7-H65=123.23              C37-C8-C3=121.88               H66-C8-C3=117.44               H66-C8-C37=120.68              
C42-C9-C36=121.39              H54-C9-C36=120.55              H54-C9-C42=118.06              C37-C10-C31=120.52             
C38-C10-C31=120.24             C38-C10-C37=119.24             
 
 selected dihedral angles (degree)
 ---------------------------------
C2-C4-C1-C5=  0.00            C2-C4-C1-H62=180.00           H64-C4-C1-C5=180.00           H64-C4-C1-H62=  0.00          
C1-C4-C2-C6=  0.00            C1-C4-C2-H53=180.01           H64-C4-C2-C6=180.01           H64-C4-C2-H53=  0.00          
C14-C5-C1-C4=179.99           C14-C5-C1-H62=  0.00          C20-C5-C1-C4=  0.00           C20-C5-C1-H62=179.98          
C20-C6-C2-C4=  0.00           C20-C6-C2-H53=180.00          C25-C6-C2-C4=180.00           C25-C6-C2-H53=  0.00          
C37-C8-C3-C14=  0.00          C37-C8-C3-H63=180.00          H66-C8-C3-C14=180.00          H66-C8-C3-H63=  0.00          
           -------------------------------------------------
          |                Final Singlepoint                |
           -------------------------------------------------

          ...................................................
          :                      SETUP                      :
          :.................................................:
          :  # basis functions                 236          :
          :  # atomic orbitals                 236          :
          :  # shells                          128          :
          :  # electrons                       234          :
          :  max. iterations                   250          :
          :  Hamiltonian                  GFN2-xTB          :
          :  restarted?                      false          :
          :  GBSA solvation                  false          :
          :  PC potential                    false          :
          :  electronic temp.          300.0000000     K    :
          :  accuracy                    1.0000000          :
          :  -> integral cutoff          0.2500000E+02      :
          :  -> integral neglect         0.1000000E-07      :
          :  -> SCF convergence          0.1000000E-05 Eh   :
          :  -> wf. convergence          0.1000000E-03 e    :
          :  Broyden damping             0.4000000          :
          :  net charge                          0          :
          :  unpaired electrons                  0          :
          ...................................................

 iter      E             dE          RMSdq      gap      omega  full diag
   1   -126.6999131 -0.126700E+03  0.734E-05    1.06       0.0  T
   2   -126.6999131 -0.184599E-10  0.569E-05    1.06     204.2  T
   3   -126.6999131 -0.142606E-09  0.314E-05    1.06     370.0  T

   *** convergence criteria satisfied after 3 iterations ***

         #    Occupation            Energy/Eh            Energy/eV
      -------------------------------------------------------------
         1        2.0000           -0.6615777             -18.0024
       ...           ...                  ...                  ...
       111        2.0000           -0.3876187             -10.5476
       112        2.0000           -0.3852385             -10.4829
       113        2.0000           -0.3813578             -10.3773
       114        2.0000           -0.3758038             -10.2261
       115        2.0000           -0.3748808             -10.2010
       116        2.0000           -0.3706261             -10.0852
       117        2.0000           -0.3496464              -9.5144 (HOMO)
       118                         -0.3107743              -8.4566 (LUMO)
       119                         -0.2957632              -8.0481
       120                         -0.2802316              -7.6255
       121                         -0.2632316              -7.1629
       122                         -0.2483613              -6.7583
       ...                                ...                  ...
       236                          0.7645068              20.8033
      -------------------------------------------------------------
                  HL-Gap            0.0388720 Eh            1.0578 eV
             Fermi-level           -0.3302103 Eh           -8.9855 eV

 SCC (total)                   0 d,  0 h,  0 min,  0.111 sec
 SCC setup                      ...        0 min,  0.001 sec (  0.901%)
 Dispersion                     ...        0 min,  0.001 sec (  0.901%)
 classical contributions        ...        0 min,  0.000 sec (  0.000%)
 integral evaluation            ...        0 min,  0.013 sec ( 11.712%)
 iterations                     ...        0 min,  0.043 sec ( 38.739%)
 molecular gradient             ...        0 min,  0.051 sec ( 45.946%)
 printout                       ...        0 min,  0.002 sec (  1.802%)

         :::::::::::::::::::::::::::::::::::::::::::::::::::::
         ::                     SUMMARY                     ::
         :::::::::::::::::::::::::::::::::::::::::::::::::::::
         :: total energy            -124.277251794192 Eh    ::
         :: gradient norm              0.000497746118 Eh/a0 ::
         :: HOMO-LUMO gap              1.057762020216 eV    ::
         ::.................................................::
         :: SCC energy              -126.702049628850 Eh    ::
         :: -> isotropic ES            0.040887002619 Eh    ::
         :: -> anisotropic ES          0.013424372831 Eh    ::
         :: -> anisotropic XC          0.053224780488 Eh    ::
         :: -> dispersion             -0.136830026804 Eh    ::
         :: repulsion energy           2.424797834658 Eh    ::
         :: add. restraining           0.000000000000 Eh    ::
         :: total charge              -0.000000000000 e     ::
         :::::::::::::::::::::::::::::::::::::::::::::::::::::

           -------------------------------------------------
          |                Property Printout                |
           -------------------------------------------------

    * Orbital Energies and Occupations

         #    Occupation            Energy/Eh            Energy/eV
      -------------------------------------------------------------
         1        2.0000           -0.6615777             -18.0024
       ...           ...                  ...                  ...
       105        2.0000           -0.4026904             -10.9578
       106        2.0000           -0.4014644             -10.9244
       107        2.0000           -0.3990540             -10.8588
       108        2.0000           -0.3973253             -10.8118
       109        2.0000           -0.3955835             -10.7644
       110        2.0000           -0.3942991             -10.7294
       111        2.0000           -0.3876187             -10.5476
       112        2.0000           -0.3852385             -10.4829
       113        2.0000           -0.3813578             -10.3773
       114        2.0000           -0.3758038             -10.2261
       115        2.0000           -0.3748808             -10.2010
       116        2.0000           -0.3706261             -10.0852
       117        2.0000           -0.3496464              -9.5144 (HOMO)
       118                         -0.3107743              -8.4566 (LUMO)
       119                         -0.2957632              -8.0481
       120                         -0.2802316              -7.6255
       121                         -0.2632316              -7.1629
       122                         -0.2483613              -6.7583
       123                         -0.2403800              -6.5411
       124                         -0.2342283              -6.3737
       125                         -0.2294872              -6.2447
       126                         -0.2259031              -6.1471
       127                         -0.2232712              -6.0755
       128                         -0.2225909              -6.0570
       ...                                ...                  ...
       236                          0.7645068              20.8033
      -------------------------------------------------------------
                  HL-Gap            0.0388720 Eh            1.0578 eV
             Fermi-level           -0.3302103 Eh           -8.9855 eV

     #   Z          covCN         q      C6AA      α(0)
     1   6 C        2.923    -0.033    28.826     8.805
     2   6 C        2.923    -0.034    28.840     8.807
     3   6 C        2.918    -0.037    28.932     8.820
     4   6 C        2.913    -0.030    28.761     8.794
     5   6 C        2.978     0.006    27.884     8.662
     6   6 C        2.983     0.010    27.785     8.647
     7   6 C        2.817    -0.113    30.851     9.101
     8   6 C        2.919    -0.037    28.932     8.821
     9   6 C        2.920    -0.037    28.926     8.820
    10   6 C        2.972    -0.002    28.066     8.690
    11   6 C        2.884    -0.067    29.663     8.929
    12   6 C        2.980     0.007    27.865     8.659
    13   6 C        2.981     0.005    27.907     8.665
    14   6 C        2.981     0.003    27.950     8.672
    15   6 C        2.989    -0.000    28.030     8.685
    16   6 C        2.985     0.000    28.013     8.682
    17   6 C        2.923    -0.025    28.633     8.775
    18   6 C        2.976     0.010    27.787     8.647
    19   6 C        2.926    -0.030    28.744     8.792
    20   6 C        2.995     0.005    27.904     8.665
    21   6 C        2.983     0.012    27.749     8.641
    22   6 C        2.984     0.000    28.021     8.683
    23   6 C        2.984    -0.001    28.037     8.686
    24   6 C        2.986    -0.000    28.027     8.684
    25   6 C        2.924    -0.026    28.646     8.777
    26   6 C        2.977     0.007    27.859     8.658
    27   6 C        2.980     0.002    27.981     8.677
    28   6 C        2.913    -0.030    28.744     8.791
    29   6 C        2.981     0.002    27.983     8.677
    30   6 C        2.988     0.001    27.991     8.679
    31   6 C        2.904    -0.023    28.578     8.766
    32   6 C        2.886    -0.071    29.778     8.946
    33   6 C        2.922    -0.034    28.848     8.808
    34   6 C        2.974    -0.004    28.127     8.699
    35   6 C        2.987     0.001    28.009     8.681
    36   6 C        2.981     0.002    27.964     8.674
    37   6 C        2.980     0.007    27.863     8.659
    38   6 C        2.984     0.002    27.974     8.676
    39   6 C        2.892    -0.072    29.787     8.948
    40   6 C        2.922    -0.021    28.525     8.758
    41   6 C        2.979     0.004    27.918     8.667
    42   6 C        2.920    -0.039    28.959     8.825
    43   6 C        2.987     0.001    27.998     8.680
    44   6 C        2.986    -0.000    28.026     8.684
    45   6 C        2.994    -0.001    28.032     8.685
    46   6 C        2.910    -0.033    28.813     8.802
    47   6 C        2.926    -0.036    28.901     8.816
    48   6 C        2.983    -0.000    28.027     8.684
    49   6 C        2.922    -0.035    28.876     8.812
    50   6 C        2.983    -0.002    28.069     8.691
    51   6 C        2.986    -0.001    28.039     8.686
    52   6 C        2.995     0.004    27.929     8.669
    53   1 H        0.926     0.034     2.532     2.488
    54   1 H        0.926     0.032     2.551     2.498
    55   1 H        0.926     0.033     2.549     2.497
    56   1 H        0.926     0.033     2.548     2.496
    57   1 H        0.926     0.036     2.504     2.474
    58   1 H        0.926     0.032     2.563     2.503
    59   1 H        0.926     0.035     2.516     2.480
    60   1 H        0.926     0.033     2.538     2.491
    61   1 H        0.926     0.027     2.625     2.534
    62   1 H        0.926     0.035     2.511     2.478
    63   1 H        0.926     0.032     2.555     2.499
    64   1 H        0.926     0.031     2.569     2.506
    65   1 H        0.925     0.016     2.801     2.617
    66   1 H        0.926     0.035     2.513     2.479
    67   1 H        0.926     0.027     2.636     2.539
    68   1 H        0.925     0.037     2.486     2.466
    69   1 H        0.926     0.036     2.498     2.472
    70   1 H        0.926     0.033     2.539     2.492
    71   1 H        0.938    -0.108     5.850     3.781
    72   1 H        0.939    -0.105     5.743     3.747
    73   5 B        2.757     0.207    18.230     7.144
    74   5 B        2.759     0.213    18.139     7.126

 Mol. C6AA /au·bohr⁶  :     101843.234159
 Mol. C8AA /au·bohr⁸  :    2756895.633245
 Mol. α(0) /au        :        521.214267


Wiberg/Mayer (AO) data.
largest (>0.10) Wiberg bond orders for each atom

 ---------------------------------------------------------------------------
     #   Z sym  total        # sym  WBO       # sym  WBO       # sym  WBO
 ---------------------------------------------------------------------------
     1   6 C    3.939 --     4 C    1.417     5 C    1.377    62 H    0.961
     2   6 C    3.945 --     4 C    1.469     6 C    1.322    53 H    0.968
     3   6 C    3.969 --     8 C    1.535    14 C    1.305    63 H    0.960
     4   6 C    3.982 --     2 C    1.469     1 C    1.417    64 H    0.970
     5   6 C    3.981 --     1 C    1.377    20 C    1.265    14 C    1.144
     6   6 C    3.986 --     2 C    1.322    20 C    1.248    25 C    1.245
     7   6 C    3.924 --    31 C    1.702    73 B    1.121    65 H    0.973
     8   6 C    3.950 --     3 C    1.535    37 C    1.295    66 H    0.957
     9   6 C    3.973 --    42 C    1.499    36 C    1.336    54 H    0.960
    10   6 C    3.930 --    38 C    1.356    37 C    1.208    31 C    1.172
    11   6 C    3.933 --    40 C    1.569    38 C    1.168    73 B    1.038
    12   6 C    3.979 --    41 C    1.300    39 C    1.284    34 C    1.169
    13   6 C    3.970 --    42 C    1.331    35 C    1.292    41 C    1.142
    14   6 C    3.949 --    43 C    1.307     3 C    1.305     5 C    1.144
    15   6 C    3.977 --    37 C    1.258    44 C    1.247    43 C    1.246
    16   6 C    3.972 --    45 C    1.274    44 C    1.255    38 C    1.222
    17   6 C    3.971 --    39 C    1.413    46 C    1.406    55 H    0.970
    18   6 C    3.988 --    47 C    1.426    40 C    1.210    45 C    1.186
    19   6 C    3.975 --    46 C    1.474    41 C    1.340    56 H    0.959
    20   6 C    3.982 --     5 C    1.265     6 C    1.248    48 C    1.231
    21   6 C    3.986 --    49 C    1.296    47 C    1.290    52 C    1.232
    22   6 C    3.969 --    50 C    1.297    48 C    1.243    43 C    1.201
    23   6 C    3.971 --    51 C    1.301    44 C    1.241    50 C    1.203
    24   6 C    3.979 --    45 C    1.278    52 C    1.245    51 C    1.231
    25   6 C    3.959 --    32 C    1.528     6 C    1.245    57 H    0.966
    26   6 C    3.983 --    33 C    1.392    52 C    1.263    36 C    1.133
    27   6 C    3.960 --    48 C    1.279    34 C    1.269    32 C    1.192
    28   6 C    3.982 --    49 C    1.492    33 C    1.395    58 H    0.970
    29   6 C    3.974 --    34 C    1.296    50 C    1.246    35 C    1.205
    30   6 C    3.982 --    36 C    1.293    35 C    1.256    51 C    1.206
    31   6 C    3.976 --     7 C    1.702    10 C    1.172    67 H    0.956
    32   6 C    3.954 --    25 C    1.528    27 C    1.192    74 B    1.062
    33   6 C    3.924 --    28 C    1.395    26 C    1.392    59 H    0.961
    34   6 C    3.957 --    29 C    1.296    27 C    1.269    12 C    1.169
    35   6 C    3.981 --    13 C    1.292    30 C    1.256    29 C    1.205
    36   6 C    3.959 --     9 C    1.336    30 C    1.293    26 C    1.133
    37   6 C    3.972 --     8 C    1.295    15 C    1.258    10 C    1.208
    38   6 C    3.977 --    10 C    1.356    16 C    1.222    11 C    1.168
    39   6 C    3.952 --    17 C    1.413    12 C    1.284    74 B    1.075
    40   6 C    3.970 --    11 C    1.569    18 C    1.210    68 H    0.965
    41   6 C    3.977 --    19 C    1.340    12 C    1.300    13 C    1.142
    42   6 C    3.963 --     9 C    1.499    13 C    1.331    60 H    0.958
    43   6 C    3.984 --    14 C    1.307    15 C    1.246    22 C    1.201
    44   6 C    3.978 --    16 C    1.255    15 C    1.247    23 C    1.241
    45   6 C    3.967 --    24 C    1.278    16 C    1.274    18 C    1.186
    46   6 C    3.978 --    19 C    1.474    17 C    1.406    61 H    0.970
    47   6 C    3.912 --    18 C    1.426    21 C    1.290    69 H    0.965
    48   6 C    3.976 --    27 C    1.279    22 C    1.243    20 C    1.231
    49   6 C    3.924 --    28 C    1.492    21 C    1.296    70 H    0.969
    50   6 C    3.971 --    22 C    1.297    29 C    1.246    23 C    1.203
    51   6 C    3.956 --    23 C    1.301    24 C    1.231    30 C    1.206
    52   6 C    3.972 --    26 C    1.263    24 C    1.245    21 C    1.232
    53   1 H    0.998 --     2 C    0.968
    54   1 H    0.998 --     9 C    0.960
    55   1 H    0.998 --    17 C    0.970
    56   1 H    0.998 --    19 C    0.959
    57   1 H    0.997 --    25 C    0.966
    58   1 H    0.998 --    28 C    0.970
    59   1 H    0.998 --    33 C    0.961
    60   1 H    0.998 --    42 C    0.958
    61   1 H    0.998 --    46 C    0.970
    62   1 H    0.998 --     1 C    0.961
    63   1 H    0.998 --     3 C    0.960
    64   1 H    0.998 --     4 C    0.970
    65   1 H    0.998 --     7 C    0.973
    66   1 H    0.997 --     8 C    0.957
    67   1 H    0.999 --    31 C    0.956
    68   1 H    0.997 --    40 C    0.965
    69   1 H    0.997 --    47 C    0.965
    70   1 H    0.998 --    49 C    0.969
    71   1 H    0.988 --    73 B    0.970
    72   1 H    0.988 --    74 B    0.970
    73   5 B    3.366 --     7 C    1.121    11 C    1.038    71 H    0.970
    74   5 B    3.356 --    39 C    1.075    32 C    1.062    72 H    0.970
 ---------------------------------------------------------------------------

Topologies differ in total number of bonds
Writing topology from bond orders to xtbtopo.mol

molecular dipole:
                 x           y           z       tot (Debye)
 q only:       -0.218      -0.431       0.000
   full:       -0.242      -0.531       0.000       1.484
molecular quadrupole (traceless):
                xx          xy          yy          xz          yz          zz
 q only:        0.403     -13.048       6.663       0.001       0.002      -7.066
  q+dip:        6.869     -19.496      26.961       0.002       0.004     -33.831
   full:       -5.186     -19.085      15.200       0.002       0.004     -10.013

           -------------------------------------------------
          |                Geometry Summary                 |
           -------------------------------------------------

      molecular mass/u    :      666.3391379
   center of mass at/Å    :       -0.0000003       0.0024686      -0.0000069
  moments of inertia/u·Å² :        0.6982858E+04   0.9092108E+04   0.1607496E+05
rotational constants/cm⁻¹ :        0.2414145E-02   0.1854095E-02   0.1048689E-02

 * 84 selected distances

     #   Z          #   Z                                           value/Å
     1   6 C        4   6 C                                       1.3850369
     2   6 C        4   6 C                                       1.3748654
     1   6 C        5   6 C                                       1.3956247
     2   6 C        6   6 C                                       1.3995262
     3   6 C        8   6 C                                       1.3628676
     3   6 C       14   6 C                                       1.4020870
     5   6 C       20   6 C                                       1.4147026
     6   6 C       20   6 C                                       1.4167961
     6   6 C       25   6 C                                       1.4090206
     7   6 C       31   6 C                                       1.3537278
    25   6 C       32   6 C                                       1.3703258
    26   6 C       33   6 C                                       1.3929959
    28   6 C       33   6 C                                       1.3887985
    27   6 C       34   6 C                                       1.4208989
    29   6 C       34   6 C                                       1.4159850
    13   6 C       35   6 C                                       1.4108127
    29   6 C       35   6 C                                       1.4308188
    30   6 C       35   6 C                                       1.4209955
     9   6 C       36   6 C                                       1.3964074
    30   6 C       36   6 C                                       1.4126808
     8   6 C       37   6 C                                       1.4060571
    10   6 C       37   6 C                                       1.4313050
    15   6 C       37   6 C                                       1.4206016
    10   6 C       38   6 C                                       1.3997504
    16   6 C       38   6 C                                       1.4263188
    12   6 C       39   6 C                                       1.4199153
    17   6 C       39   6 C                                       1.3911314
    11   6 C       40   6 C                                       1.3658736
    18   6 C       40   6 C                                       1.4182978
    12   6 C       41   6 C                                       1.4121605
    19   6 C       41   6 C                                       1.4025945
     9   6 C       42   6 C                                       1.3672715
    13   6 C       42   6 C                                       1.3986783
    14   6 C       43   6 C                                       1.4080898
    15   6 C       43   6 C                                       1.4220023
    22   6 C       43   6 C                                       1.4297564
    15   6 C       44   6 C                                       1.4168605
    16   6 C       44   6 C                                       1.4166664
    23   6 C       44   6 C                                       1.4212490
    16   6 C       45   6 C                                       1.4105804
    18   6 C       45   6 C                                       1.4277076
    24   6 C       45   6 C                                       1.4096771
    17   6 C       46   6 C                                       1.3829539
    19   6 C       46   6 C                                       1.3747517
    18   6 C       47   6 C                                       1.3791825
    21   6 C       47   6 C                                       1.4030148
    20   6 C       48   6 C                                       1.4238385
    22   6 C       48   6 C                                       1.4188322
    27   6 C       48   6 C                                       1.4160967
    21   6 C       49   6 C                                       1.4045896
    28   6 C       49   6 C                                       1.3719569
    22   6 C       50   6 C                                       1.4082179
    23   6 C       50   6 C                                       1.4291864
    29   6 C       50   6 C                                       1.4227607
    23   6 C       51   6 C                                       1.4064822
    24   6 C       51   6 C                                       1.4199443
    30   6 C       51   6 C                                       1.4252211
    21   6 C       52   6 C                                       1.4223056
    24   6 C       52   6 C                                       1.4180047
    26   6 C       52   6 C                                       1.4145960
     2   6 C       53   1 H                                       1.0801246
     9   6 C       54   1 H                                       1.0772661
    17   6 C       55   1 H                                       1.0801503
    19   6 C       56   1 H                                       1.0773358
    25   6 C       57   1 H                                       1.0810973
    28   6 C       58   1 H                                       1.0802136
    33   6 C       59   1 H                                       1.0775216
    42   6 C       60   1 H                                       1.0767346 (min)
    46   6 C       61   1 H                                       1.0803784
     1   6 C       62   1 H                                       1.0775460
     3   6 C       63   1 H                                       1.0773636
     4   6 C       64   1 H                                       1.0801685
     7   6 C       65   1 H                                       1.0840527
     8   6 C       66   1 H                                       1.0767462
    31   6 C       67   1 H                                       1.0803542
    40   6 C       68   1 H                                       1.0815426
    47   6 C       69   1 H                                       1.0810820
    49   6 C       70   1 H                                       1.0800410
     7   6 C       73   5 B                                       1.5193542
    11   6 C       73   5 B                                       1.5463248 (max)
    71   1 H       73   5 B                                       1.1716473
    32   6 C       74   5 B                                       1.5308476
    39   6 C       74   5 B                                       1.5278710
    72   1 H       74   5 B                                       1.1709564

 * 4 distinct bonds (by element types)

   Z      Z             #   av. dist./Å        max./Å        min./Å
   1 H    5 B           2     1.1713018     1.1716473     1.1709564
   1 H    6 C          18     1.0794288     1.0840527     1.0767346
   5 B    6 C           4     1.5310994     1.5463248     1.5193542
   6 C    6 C          60     1.4056576     1.4313050     1.3537278


optimized geometry written to: xtbopt.xyz


           -------------------------------------------------
          | TOTAL ENERGY             -124.277251794192 Eh   |
          | GRADIENT NORM               0.000497746118 Eh/α |
          | HOMO-LUMO GAP               1.057762020216 eV   |
           -------------------------------------------------

------------------------------------------------------------------------
 * finished run on 2025/12/08 at 00:34:21.332     
------------------------------------------------------------------------
 total:
 * wall-time:     0 d,  0 h,  0 min,  1.296 sec
 *  cpu-time:     0 d,  0 h,  0 min,  4.953 sec
 * ratio c/w:     3.822 speedup
 SCF:
 * wall-time:     0 d,  0 h,  0 min,  0.290 sec
 *  cpu-time:     0 d,  0 h,  0 min,  1.188 sec
 * ratio c/w:     4.095 speedup
 ANC optimizer:
 * wall-time:     0 d,  0 h,  0 min,  0.947 sec
 *  cpu-time:     0 d,  0 h,  0 min,  3.594 sec
 * ratio c/w:     3.795 speedup

normal termination of xtb
