      -----------------------------------------------------------      
     |                   =====================                   |     
     |                           x T B                           |     
     |                   =====================                   |     
     |                         S. Grimme                         |     
     |          Mulliken Center for Theoretical Chemistry        |     
     |                    University of Bonn                     |     
      -----------------------------------------------------------      

   * xtb version 6.7.1pre (5071a88) compiled by 'Marcel@Raven' on 2024-07-23

   xtb is free software: you can redistribute it and/or modify it under
   the terms of the GNU Lesser General Public License as published by
   the Free Software Foundation, either version 3 of the License, or
   (at your option) any later version.
   
   xtb is distributed in the hope that it will be useful,
   but WITHOUT ANY WARRANTY; without even the implied warranty of
   MERCHANTABILITY or FITNESS FOR A PARTICULAR PURPOSE.  See the
   GNU Lesser General Public License for more details.
   
   Cite this work as:
   * C. Bannwarth, E. Caldeweyher, S. Ehlert, A. Hansen, P. Pracht,
     J. Seibert, S. Spicher, S. Grimme, WIREs Comput. Mol. Sci., 2020, 11,
     e01493. DOI: 10.1002/wcms.1493
   
   for GFN2-xTB:
   * C. Bannwarth, S. Ehlert and S. Grimme., J. Chem. Theory Comput., 2019,
     15, 1652-1671. DOI: 10.1021/acs.jctc.8b01176
   for GFN1-xTB:
   * S. Grimme, C. Bannwarth, P. Shushkov, J. Chem. Theory Comput., 2017,
     13, 1989-2009. DOI: 10.1021/acs.jctc.7b00118
   for GFN0-xTB:
   * P. Pracht, E. Caldeweyher, S. Ehlert, S. Grimme, ChemRxiv, 2019, preprint.
     DOI: 10.26434/chemrxiv.8326202.v1
   for GFN-FF:
   * S. Spicher and S. Grimme, Angew. Chem. Int. Ed., 2020, 59, 15665-15673.
     DOI: 10.1002/anie.202004239
   
   for ALPB and GBSA implicit solvation:
   * S. Ehlert, M. Stahn, S. Spicher, S. Grimme, J. Chem. Theory Comput.,
     2021, 17, 4250-4261. DOI: 10.1021/acs.jctc.1c00471
   
   for ddCOSMO and CPCM-X implicit solvation:
   * M. Stahn, S. Ehlert, S. Grimme, J. Phys. Chem. A,
     2023, XX, XXXX-XXXX. DOI: 10.1021/acs.jpca.3c04382
   
   for DFT-D4:
   * E. Caldeweyher, C. Bannwarth and S. Grimme, J. Chem. Phys., 2017,
     147, 034112. DOI: 10.1063/1.4993215
   * E. Caldeweyher, S. Ehlert, A. Hansen, H. Neugebauer, S. Spicher,
     C. Bannwarth and S. Grimme, J. Chem. Phys., 2019, 150, 154122.
     DOI: 10.1063/1.5090222
   * E. Caldeweyher, J.-M. Mewes, S. Ehlert and S. Grimme, Phys. Chem. Chem. Phys.
     2020, 22, 8499-8512. DOI: 10.1039/D0CP00502A
   
   for sTDA-xTB:
   * S. Grimme and C. Bannwarth, J. Chem. Phys., 2016, 145, 054103.
     DOI: 10.1063/1.4959605
   
   in the mass-spec context:
   * V. Asgeirsson, C. Bauer and S. Grimme, Chem. Sci., 2017, 8, 4879.
     DOI: 10.1039/c7sc00601b
   * J. Koopman and S. Grimme, ACS Omega 2019, 4, 12, 15120-15133.
     DOI: 10.1021/acsomega.9b02011
   
   for metadynamics refer to:
   * S. Grimme, J. Chem. Theory Comput., 2019, 155, 2847-2862
     DOI: 10.1021/acs.jctc.9b00143
   
   for SPH calculations refer to:
   * S. Spicher and S. Grimme, J. Chem. Theory Comput., 2021, 17, 1701-1714
     DOI: 10.1021/acs.jctc.0c01306
   
   for ONIOM refer to:
   * C. Plett, A. Katbashev, S. Ehlert, S. Grimme, M. Bursch,
     Phys. Chem. Chem. Phys., 2023, 25, 17860-17868. DOI: 10.1039/D3CP02178E
   
   for DIPRO refer to:
   * J. Kohn, N. Gildemeister, S. Grimme, D. Fazzi, A. Hansen,
     J. Chem. Phys., 2023, just accepted.
   
   for PTB refer to:
   * S. Grimme, M. Mueller, A. Hansen, J. Chem. Phys., 2023, 158, 124111.
     DOI: 10.1063/5.0137838
   
   with help from (in alphabetical order)
   P. Atkinson, C. Bannwarth, F. Bohle, G. Brandenburg, E. Caldeweyher
   M. Checinski, S. Dohm, S. Ehlert, S. Ehrlich, I. Gerasimov, C. Hölzer
   A. Katbashev, J. Kohn, J. Koopman, C. Lavigne, S. Lehtola, F. März, M. Müller,
   F. Musil, H. Neugebauer, J. Pisarek, C. Plett, P. Pracht, F. Pultar,
   J. Seibert, P. Shushkov, S. Spicher, M. Stahn, M. Steiner, T. Strunk,
   J. Stückrath, T. Rose, and J. Unsleber
   
 * started run on 2025/12/08 at 00:35:00.237     
   ID    Z sym.   atoms
    1    6 C      1-53
    2    1 H      54-72
    3    5 B      73

           -------------------------------------------------
          |                Calculation Setup                |
           -------------------------------------------------

          program call               : xtb "C:\Users\LENOVO GAMING\Documents\GitHub\molecular-conductivity-sim\dataset\1nm-Bdoped-1.5percent.xyz" --opt --parallel 4
          coordinate file            : C:\Users\LENOVO GAMING\Documents\GitHub\molecular-conductivity-sim\dataset\1nm-Bdoped-1.5percent.xyz
          omp threads                :                     4


           -------------------------------------------------
          |                 G F N 2 - x T B                 |
           -------------------------------------------------

        Reference                      10.1021/acs.jctc.8b01176
      * Hamiltonian:
        H0-scaling (s, p, d)           1.850000    2.230000    2.230000
        zeta-weighting                 0.500000
      * Dispersion:
        s8                             2.700000
        a1                             0.520000
        a2                             5.000000
        s9                             5.000000
      * Repulsion:
        kExp                           1.500000    1.000000
        rExp                           1.000000
      * Coulomb:
        alpha                          2.000000
        third order                    shell-resolved
        anisotropic                    true
        a3                             3.000000
        a5                             4.000000
        cn-shift                       1.200000
        cn-exp                         4.000000
        max-rad                        5.000000


          ...................................................
          :                      SETUP                      :
          :.................................................:
          :  # basis functions                 235          :
          :  # atomic orbitals                 235          :
          :  # shells                          127          :
          :  # electrons                       234          :
          :  max. iterations                   250          :
          :  Hamiltonian                  GFN2-xTB          :
          :  restarted?                      false          :
          :  GBSA solvation                  false          :
          :  PC potential                    false          :
          :  electronic temp.          300.0000000     K    :
          :  accuracy                    1.0000000          :
          :  -> integral cutoff          0.2500000E+02      :
          :  -> integral neglect         0.1000000E-07      :
          :  -> SCF convergence          0.1000000E-05 Eh   :
          :  -> wf. convergence          0.1000000E-03 e    :
          :  Broyden damping             0.4000000          :
          :  net charge                          0          :
          :  unpaired electrons                  0          :
          ...................................................

 iter      E             dE          RMSdq      gap      omega  full diag
   1   -126.5928681 -0.126593E+03  0.561E+00    0.66       0.0  T
   2   -123.8272201  0.276565E+01  0.587E+00    0.24       1.0  T
   3   -125.9099388 -0.208272E+01  0.326E+00    0.34       1.0  T
   4   -126.6798201 -0.769881E+00  0.221E+00    0.50       1.0  T
   5   -126.7474394 -0.676194E-01  0.151E+00    0.52       1.0  T
   6   -126.7680071 -0.205677E-01  0.137E+00    0.44       1.0  T
   7   -126.8822439 -0.114237E+00  0.908E-01    0.17       1.0  T
   8   -126.8664515  0.157924E-01  0.904E-01    0.19       1.0  T
   9   -126.7301210  0.136331E+00  0.151E+00    0.38       1.0  T
  10   -126.7201459  0.997513E-02  0.155E+00    0.41       1.0  T
  11   -126.7645996 -0.444537E-01  0.131E+00    0.28       1.0  T
  12   -126.8898483 -0.125249E+00  0.488E-01    0.20       1.0  T
  13   -126.9222961 -0.324478E-01  0.807E-02    0.16       1.0  T
  14   -126.9224254 -0.129291E-03  0.677E-02    0.15       1.0  T
  15   -126.9210686  0.135685E-02  0.103E-01    0.15       1.0  T
  16   -126.9212714 -0.202818E-03  0.100E-01    0.15       1.0  T
  17   -126.9225629 -0.129148E-02  0.175E-02    0.15       1.0  T
  18   -126.9225731 -0.102127E-04  0.833E-03    0.15       1.4  T
  19   -126.9225337  0.393247E-04  0.178E-02    0.15       1.0  T
  20   -126.9225676 -0.338258E-04  0.817E-03    0.15       1.4  T
  21   -126.9225756 -0.807577E-05  0.778E-04    0.15      15.0  T
  22   -126.9225757 -0.507680E-07  0.481E-04    0.15      24.4  T
  23   -126.9225754  0.260097E-06  0.149E-03    0.15       7.8  T
  24   -126.9225757 -0.260966E-06  0.343E-04    0.15      34.1  T

   *** convergence criteria satisfied after 24 iterations ***

         #    Occupation            Energy/Eh            Energy/eV
      -------------------------------------------------------------
         1        2.0000           -0.6539117             -17.7938
       ...           ...                  ...                  ...
       111        2.0000           -0.3886285             -10.5751
       112        2.0000           -0.3869857             -10.5304
       113        2.0000           -0.3865311             -10.5180
       114        2.0000           -0.3816951             -10.3865
       115        2.0000           -0.3677570             -10.0072
       116        2.0000           -0.3531997              -9.6111
       117        1.8965           -0.3173720              -8.6361 (HOMO)
       118        0.1035           -0.3118462              -8.4858 (LUMO)
       119                         -0.2829847              -7.7004
       120                         -0.2668486              -7.2613
       121                         -0.2649048              -7.2084
       122                         -0.2472740              -6.7287
       ...                                ...                  ...
       235                          0.7783715              21.1806
      -------------------------------------------------------------
                  HL-Gap            0.0055258 Eh            0.1504 eV
             Fermi-level           -0.3146091 Eh           -8.5609 eV

 SCC (total)                   0 d,  0 h,  0 min,  0.443 sec
 SCC setup                      ...        0 min,  0.001 sec (  0.226%)
 Dispersion                     ...        0 min,  0.003 sec (  0.677%)
 classical contributions        ...        0 min,  0.000 sec (  0.000%)
 integral evaluation            ...        0 min,  0.013 sec (  2.935%)
 iterations                     ...        0 min,  0.375 sec ( 84.650%)
 molecular gradient             ...        0 min,  0.048 sec ( 10.835%)
 printout                       ...        0 min,  0.003 sec (  0.677%)

         :::::::::::::::::::::::::::::::::::::::::::::::::::::
         ::                     SUMMARY                     ::
         :::::::::::::::::::::::::::::::::::::::::::::::::::::
         :: total energy            -124.612123867572 Eh    ::
         :: gradient norm              0.040709960199 Eh/a0 ::
         :: HOMO-LUMO gap              0.150364532550 eV    ::
         ::.................................................::
         :: SCC energy              -126.924702612167 Eh    ::
         :: -> isotropic ES            0.018720893393 Eh    ::
         :: -> anisotropic ES          0.011133521986 Eh    ::
         :: -> anisotropic XC          0.054784492894 Eh    ::
         :: -> dispersion             -0.135495240021 Eh    ::
         :: repulsion energy           2.312578744595 Eh    ::
         :: add. restraining           0.000000000000 Eh    ::
         :: total charge              -0.000000000000 e     ::
         :::::::::::::::::::::::::::::::::::::::::::::::::::::

      ----------------------------------------------------------- 
     |                   =====================                   |
     |                        A N C O P T                        |
     |                   =====================                   |
     |               Approximate Normal Coordinate               |
     |                Rational Function Optimizer                |
      ----------------------------------------------------------- 
      ----------------------------------------------------------- 
     |                   =====================                   |
     |                        A N C O P T                        |
     |                   =====================                   |
     |               Approximate Normal Coordinate               |
     |                Rational Function Optimizer                |
      ----------------------------------------------------------- 

          ...................................................
          :                      SETUP                      :
          :.................................................:
          :   optimization level            normal          :
          :   max. optcycles                   219          :
          :   ANC micro-cycles                  20          :
          :   degrees of freedom               213          :
          :.................................................:
          :   RF solver                   davidson          :
          :   write xtbopt.log                true          :
          :   linear?                        false          :
          :   energy convergence         0.5000000E-05 Eh   :
          :   grad. convergence          0.1000000E-02 Eh/α :
          :   maxmium RF displ.          1.0000000          :
          :   Hlow (freq-cutoff)         0.1000000E-01      :
          :   Hmax (freq-cutoff)         5.0000000          :
          :   S6 in model hess.         20.0000000          :
          ...................................................

generating ANC from exact Hessian ...
Using Lindh-Hessian (1995)
 Shifting diagonal of input Hessian by   9.696698020838541E-003
 Lowest  eigenvalues of input Hessian
    0.000000    0.000000    0.000000    0.000000    0.000000    0.000000
    0.010000    0.010323    0.010760    0.011007    0.011451    0.013021
    0.013433    0.014013    0.014886    0.016269    0.016770    0.017011
 Highest eigenvalues
    2.011214    2.013041    2.037445    2.073651    2.075042    2.102559
 

........................................................................
.............................. CYCLE    1 ..............................
........................................................................

 iter      E             dE          RMSdq      gap      omega  full diag
   1   -126.9225757 -0.126923E+03  0.186E-04    0.15       0.0  T
   2   -126.9225747  0.102645E-05  0.281E-03    0.15       4.2  T
   3   -126.9225757 -0.102715E-05  0.163E-04    0.15      71.9  T
   4   -126.9225757 -0.245382E-08  0.842E-05    0.15     139.1  T
   5   -126.9225757 -0.745828E-09  0.279E-05    0.15     419.5  T
     SCC iter.                  ...        0 min,  0.072 sec
     gradient                   ...        0 min,  0.042 sec
 * total energy  :  -124.6121239 Eh     change       -0.1389095E-07 Eh
   gradient norm :     0.0407110 Eh/α   predicted     0.0000000E+00 (-100.00%)
   displ. norm   :     0.3938242 α      lambda       -0.1106438E-01
   maximum displ.:     0.3115979 α      in ANC's #34, #15, #48, ...

........................................................................
.............................. CYCLE    2 ..............................
........................................................................

 iter      E             dE          RMSdq      gap      omega  full diag
   1   -127.0223642 -0.127022E+03  0.142E-01    0.15       0.0  T
   2   -126.9992433  0.231209E-01  0.433E-01    0.18       1.0  T
   3   -127.0153189 -0.160756E-01  0.248E-01    0.15       1.0  T
   4   -127.0221085 -0.678963E-02  0.554E-02    0.15       1.0  T
   5   -127.0224911 -0.382589E-03  0.135E-02    0.15       1.0  T
   6   -127.0224890  0.209899E-05  0.129E-02    0.15       1.0  T
   7   -127.0225053 -0.163385E-04  0.555E-03    0.15       2.1  T
   8   -127.0225082 -0.289330E-05  0.152E-03    0.15       7.7  T
   9   -127.0225085 -0.215412E-06  0.404E-04    0.15      29.0  T
  10   -127.0225084  0.144765E-08  0.328E-04    0.15      35.7  T
     SCC iter.                  ...        0 min,  0.159 sec
     gradient                   ...        0 min,  0.051 sec
 * total energy  :  -124.6199479 Eh     change       -0.7824055E-02 Eh
   gradient norm :     0.0179409 Eh/α   predicted    -0.6390300E-02 ( -18.32%)
   displ. norm   :     0.3052667 α      lambda       -0.3502887E-02
   maximum displ.:     0.2407552 α      in ANC's #34, #15, #29, ...

........................................................................
.............................. CYCLE    3 ..............................
........................................................................

 iter      E             dE          RMSdq      gap      omega  full diag
   1   -127.0836306 -0.127084E+03  0.120E-01    0.15       0.0  T
   2   -127.0550339  0.285967E-01  0.477E-01    0.19       1.0  T
   3   -127.0801525 -0.251187E-01  0.182E-01    0.15       1.0  T
   4   -127.0834052 -0.325269E-02  0.551E-02    0.15       1.0  T
   5   -127.0837838 -0.378538E-03  0.158E-02    0.15       1.0  T
   6   -127.0837895 -0.567473E-05  0.132E-02    0.15       1.0  T
   7   -127.0838072 -0.177805E-04  0.514E-03    0.15       2.3  T
   8   -127.0838098 -0.253071E-05  0.138E-03    0.15       8.5  T
   9   -127.0838099 -0.161487E-06  0.476E-04    0.15      24.6  T
  10   -127.0838099 -0.236254E-07  0.141E-04    0.15      83.2  T
     SCC iter.                  ...        0 min,  0.152 sec
     gradient                   ...        0 min,  0.045 sec
 * total energy  :  -124.6219155 Eh     change       -0.1967574E-02 Eh
   gradient norm :     0.0075595 Eh/α   predicted    -0.1914657E-02 (  -2.69%)
   displ. norm   :     0.0533320 α      lambda       -0.1615331E-03
   maximum displ.:     0.0333616 α      in ANC's #34, #15, #29, ...

........................................................................
.............................. CYCLE    4 ..............................
........................................................................

 iter      E             dE          RMSdq      gap      omega  full diag
   1   -127.0884963 -0.127088E+03  0.362E-02    0.15       0.0  T
   2   -127.0853622  0.313406E-02  0.157E-01    0.16       1.0  T
   3   -127.0878720 -0.250979E-02  0.740E-02    0.15       1.0  T
   4   -127.0884880 -0.615985E-03  0.131E-02    0.15       1.0  T
   5   -127.0885097 -0.216920E-04  0.345E-03    0.15       3.4  T
   6   -127.0885098 -0.188320E-06  0.300E-03    0.15       3.9  T
   7   -127.0885107 -0.862056E-06  0.134E-03    0.15       8.7  T
   8   -127.0885109 -0.183025E-06  0.319E-04    0.15      36.7  T
   9   -127.0885109 -0.795502E-08  0.135E-04    0.15      86.6  T
     SCC iter.                  ...        0 min,  0.141 sec
     gradient                   ...        0 min,  0.052 sec
 * total energy  :  -124.6220221 Eh     change       -0.1065982E-03 Eh
   gradient norm :     0.0042806 Eh/α   predicted    -0.8102520E-04 ( -23.99%)
   displ. norm   :     0.0235751 α      lambda       -0.5515445E-04
   maximum displ.:     0.0078849 α      in ANC's #96, #4, #9, ...

........................................................................
.............................. CYCLE    5 ..............................
........................................................................

 iter      E             dE          RMSdq      gap      omega  full diag
   1   -127.0870436 -0.127087E+03  0.270E-02    0.15       0.0  T
   2   -127.0861999  0.843697E-03  0.817E-02    0.15       1.0  T
   3   -127.0862175 -0.176479E-04  0.825E-02    0.15       1.0  T
   4   -127.0870326 -0.815105E-03  0.108E-02    0.15       1.1  T
   5   -127.0870460 -0.133352E-04  0.380E-03    0.15       3.1  T
   6   -127.0870472 -0.118235E-05  0.220E-03    0.15       5.3  T
   7   -127.0870475 -0.315322E-06  0.132E-03    0.15       8.9  T
   8   -127.0870477 -0.203762E-06  0.182E-04    0.15      64.3  T
   9   -127.0870477 -0.239285E-08  0.575E-05    0.15     203.5  T
     SCC iter.                  ...        0 min,  0.139 sec
     gradient                   ...        0 min,  0.048 sec
 * total energy  :  -124.6220570 Eh     change       -0.3494047E-04 Eh
   gradient norm :     0.0017665 Eh/α   predicted    -0.2763860E-04 ( -20.90%)
   displ. norm   :     0.0270036 α      lambda       -0.1270585E-04
   maximum displ.:     0.0120163 α      in ANC's #15, #4, #9, ...

........................................................................
.............................. CYCLE    6 ..............................
........................................................................

 iter      E             dE          RMSdq      gap      omega  full diag
   1   -127.0841425 -0.127084E+03  0.186E-02    0.15       0.0  T
   2   -127.0841163  0.262326E-04  0.175E-02    0.15       1.0  T
   3   -127.0820114  0.210486E-02  0.130E-01    0.15       1.0  T
   4   -127.0841338 -0.212242E-02  0.836E-03    0.15       1.4  T
   5   -127.0841416 -0.778541E-05  0.320E-03    0.15       3.7  T
   6   -127.0841428 -0.116511E-05  0.118E-03    0.15       9.9  T
   7   -127.0841428 -0.542812E-07  0.830E-04    0.15      14.1  T
   8   -127.0841429 -0.749752E-07  0.200E-04    0.15      58.5  T
     SCC iter.                  ...        0 min,  0.116 sec
     gradient                   ...        0 min,  0.045 sec
 * total energy  :  -124.6220656 Eh     change       -0.8511189E-05 Eh
   gradient norm :     0.0007478 Eh/α   predicted    -0.6358218E-05 ( -25.30%)
   displ. norm   :     0.0117686 α      lambda       -0.1861563E-05
   maximum displ.:     0.0060798 α      in ANC's #4, #9, #15, ...

........................................................................
.............................. CYCLE    7 ..............................
........................................................................

 iter      E             dE          RMSdq      gap      omega  full diag
   1   -127.0843598 -0.127084E+03  0.455E-03    0.15       0.0  T
   2   -127.0842952  0.646158E-04  0.226E-02    0.15       1.0  T
   3   -127.0843576 -0.624340E-04  0.501E-03    0.15       2.3  T
   4   -127.0843597 -0.205903E-05  0.172E-03    0.15       6.8  T
   5   -127.0843600 -0.377818E-06  0.343E-04    0.15      34.2  T
   6   -127.0843600 -0.473094E-08  0.251E-04    0.15      46.7  T
     SCC iter.                  ...        0 min,  0.090 sec
     gradient                   ...        0 min,  0.043 sec
 * total energy  :  -124.6220675 Eh     change       -0.1987570E-05 Eh
   gradient norm :     0.0002318 Eh/α   predicted    -0.9715471E-06 ( -51.12%)
   displ. norm   :     0.0247909 α      lambda       -0.1623127E-05
   maximum displ.:     0.0148815 α      in ANC's #4, #9, #6, ...

   *** GEOMETRY OPTIMIZATION CONVERGED AFTER 7 ITERATIONS ***

------------------------------------------------------------------------
 total energy gain   :        -0.0099437 Eh       -6.2398 kcal/mol
 total RMSD          :         0.0857252 a0        0.0454 Å
 total power (kW/mol):        -3.7295900 (step)  -18.8499 (real)
------------------------------------------------------------------------

 ANCopt (total)                0 d,  0 h,  0 min,  1.385 sec
 optimizer setup                ...        0 min,  0.000 sec (  0.000%)
 model hessian                  ...        0 min,  0.049 sec (  3.538%)
 ANC generation                 ...        0 min,  0.009 sec (  0.650%)
 coordinate transformation      ...        0 min,  0.001 sec (  0.072%)
 single point calculation       ...        0 min,  1.316 sec ( 95.018%)
 optimization log               ...        0 min,  0.010 sec (  0.722%)
 hessian update                 ...        0 min,  0.000 sec (  0.000%)
 rational function              ...        0 min,  0.000 sec (  0.000%)

================
 final structure:
================
73
 xtb: 6.7.1pre (5071a88)
C           -3.67306512865025        4.85475356192533        0.05480046254121
C           -5.74502499386757        3.66926332078545        0.05500033168454
C           -0.76856555279126        4.86347160480879       -0.00626702980455
C           -5.06192030028967        4.85510753402379        0.06758069500617
C           -2.93410643455954        3.67267500807433        0.02943715541000
C           -5.04095521742141        2.44991518998289        0.03413900273284
C            4.90786137735915        4.89600575446219       -0.05360613572607
C            0.60195439342200        4.87441026075879       -0.02175613833048
C            0.71598768036117       -4.86263002474836        0.04809736211966
C            2.78459651447496        3.71321560313834       -0.03146688589545
C            4.90536196483879        2.48544190854964       -0.02721383924135
C           -3.57578954132243       -2.54076471903545       -0.02413740657472
C           -1.40646182545497       -3.71169274688165       -0.00129955628171
C           -1.49132997889508        3.67140977385141        0.00909082775084
C            0.63910657703761        2.46093299343532       -0.00968082317584
C            2.77487448709657        1.25168188334333       -0.01072027245348
C           -5.65272825262194       -3.91303899877535       -0.06542267580337
C            4.92288956806512        0.05269187583470       -0.00195274838594
C           -3.52671907459586       -4.97621150028047       -0.07362823152471
C           -3.61682060284415        2.43392148769533        0.02391447802577
C            4.96294548471733       -2.37871371863330        0.02258949509705
C           -1.48276286008440        1.20703660114327        0.00412801343786
C            0.65668620394036        0.00216146013536       -0.00122022420122
C            2.80361695143814       -1.19485576966082        0.00931085574653
C           -5.72492307787808        1.23833513192312        0.02210820552993
C            2.86880793577422       -3.65313105134818        0.03242856043437
C           -3.60030804163241       -0.03419612577349        0.00241346494089
C            5.01765144754583       -4.78831962988836        0.04506315122269
C           -1.47258883083078       -1.25076434027036       -0.00453725612162
C            0.69144994792323       -2.45016275424119        0.01209239802794
C            3.51748973045159        4.89852979956253       -0.04772973265746
C           -5.05622649179600        0.02255257985607        0.00469947398925
C            3.62763540208979       -4.82205998050288        0.04302780284046
C            5.59797371338919        3.71356202985767       -0.04266282082252
C           -2.90350481389705       -1.27581124423175       -0.00754998037005
C           -0.73300025122747       -2.46933612072368        0.00055552882917
C            1.42325238089553       -3.66303893650297        0.02969898011820
C            1.33951419947314        3.69214437332313       -0.02120474447939
C            3.47882771674436        2.48230596601909       -0.02292459250019
C           -5.02321570238216       -2.65897221273605       -0.03643526611770
C            5.59460553631829        1.27579870183222       -0.01573100343333
C           -2.84971659339308       -3.75561149855409       -0.03259453911393
C           -0.65351784254586       -4.88537281881107        0.03310559587079
C           -0.78330428736841        2.44691096381628        0.00186821904821
C            1.35168283373005        1.23360060365593       -0.00762288544558
C            3.49000418449644        0.03657740136468       -0.00116427429079
C           -4.90981812955455       -5.06288939261966       -0.08930774894485
C            5.62408463850216       -1.15341338805670        0.01046105354283
C           -2.90737962641151        1.19912237777732        0.00982089114080
C            5.68214995760979       -3.59140762706015        0.03536476689964
C           -0.77515388753686       -0.01631415281092       -0.00088297713138
C            1.38061033229818       -1.21015141704536        0.00620590367787
C            3.53668162045413       -2.40781786607718        0.02131630678035
H           -6.82485446681870        3.64526228188274        0.06216257827591
H            1.23594959858890       -5.80558707368843        0.07438148807803
H           -6.73196296172724       -3.94871803411382       -0.07230802205452
H           -2.97605833203258       -5.90053027568832       -0.09713626101970
H           -6.80532169412283        1.24265872643553        0.02581755179274
H            5.56853264169106       -5.71798743809025        0.05403352487255
H            3.15201483951017       -5.78874697864545        0.04913714407275
H           -1.13255395223042       -5.84939698261447        0.05231131498779
H           -5.38799603197671       -6.03052897412431       -0.11875648432608
H           -3.17545399091282        5.80982518979270        0.06641831511744
H           -1.27816806844688        5.81250574749535       -0.00793292770333
H           -5.59367651218501        5.79526549635259        0.08657337793955
H            5.43821256066617        5.83741412952997       -0.06636020904592
H            1.09943787131544        5.82987406666803       -0.03310676981799
H            3.01956946017438        5.85396686513756       -0.05642149136111
H            6.67806446855821        3.70002288454778       -0.04603440641588
H            6.67526750364285        1.28172915808846       -0.01766137890913
H            6.70448629036755       -1.13375900240498        0.01048372969439
H            6.76168490097267       -3.55444925654862        0.03676010003553
B           -5.56947156562854       -1.32657924567897       -0.01461536783123
 
 Bond Distances (Angstroems)
 ---------------------------
C1-C4=1.3889         C1-C5=1.3943         C1-H63=1.0770        C2-C4=1.3686         C2-C6=1.4082         C2-H54=1.0801        
C3-C8=1.3707         C3-C14=1.3941        C3-H64=1.0772        C4-C1=1.3889         C4-C2=1.3686         C4-H65=1.0803        
C5-C1=1.3943         C5-C14=1.4429        C5-C20=1.4144        C6-C2=1.4082         C6-C20=1.4243        C6-C25=1.3914        
C7-C31=1.3904        C7-C34=1.3691        C7-H66=1.0806        C8-C3=1.3707         C8-C38=1.3935        C8-H67=1.0773        
C9-C37=1.3927        C9-C43=1.3698        C9-H55=1.0771        C10-C31=1.3937       C10-C38=1.4453       C10-C39=1.4132       
C11-C34=1.4100       C11-C39=1.4265       C11-C41=1.3923       C12-C35=1.4326       C12-C40=1.4523       C12-C42=1.4153       
C13-C36=1.4132       C13-C42=1.4443       C13-C43=1.3949       C14-C3=1.3941        C14-C5=1.4429        C14-C44=1.4145       
C15-C38=1.4165       C15-C44=1.4225       C15-C45=1.4192       C16-C39=1.4178       C16-C45=1.4233       C16-C46=1.4100       
C17-C40=1.4035       C17-C47=1.3692       C17-H56=1.0798       C18-C41=1.3955       C18-C46=1.4330       C18-C48=1.3952       
C19-C42=1.3964       C19-C47=1.3859       C19-H57=1.0762       C20-C5=1.4144        C20-C6=1.4243        C20-C49=1.4242       
C21-C48=1.3923       C21-C50=1.4100       C21-C53=1.4266       C22-C44=1.4236       C22-C49=1.4247       C22-C51=1.4133       
C23-C45=1.4140       C23-C51=1.4320       C23-C52=1.4120       C24-C46=1.4098       C24-C52=1.4231       C24-C53=1.4173       
C25-C6=1.3914        C25-C32=1.3877       C25-H58=1.0804       C26-C33=1.3937       C26-C37=1.4456       C26-C53=1.4131       
C27-C32=1.4570       C27-C35=1.4238       C27-C49=1.4147       C28-C33=1.3904       C28-C50=1.3690       C28-H59=1.0807       
C29-C35=1.4311       C29-C36=1.4255       C29-C51=1.4178       C30-C36=1.4246       C30-C37=1.4167       C30-C52=1.4187       
C31-C7=1.3904        C31-C10=1.3937       C31-H68=1.0774       C32-C25=1.3877       C32-C27=1.4570       C32-B73=1.4436       
C33-C26=1.3937       C33-C28=1.3904       C33-H60=1.0774       C34-C7=1.3691        C34-C11=1.4100       C34-H69=1.0802       
C35-C12=1.4326       C35-C27=1.4238       C35-C29=1.4311       C36-C13=1.4132       C36-C29=1.4255       C36-C30=1.4246       
C37-C9=1.3927        C37-C26=1.4456       C37-C30=1.4167       C38-C8=1.3935        C38-C10=1.4453       C38-C15=1.4165       
C39-C10=1.4132       C39-C11=1.4265       C39-C16=1.4178       C40-C12=1.4523       C40-C17=1.4035       C40-B73=1.4402       
C41-C11=1.3923       C41-C18=1.3955       C41-H70=1.0807       C42-C12=1.4153       C42-C13=1.4443       C42-C19=1.3964       
C43-C9=1.3698        C43-C13=1.3949       C43-H61=1.0767       C44-C14=1.4145       C44-C15=1.4225       C44-C22=1.4236       
C45-C15=1.4192       C45-C16=1.4233       C45-C23=1.4140       C46-C16=1.4100       C46-C18=1.4330       C46-C24=1.4098       
C47-C17=1.3692       C47-C19=1.3859       C47-H62=1.0797       C48-C18=1.3952       C48-C21=1.3923       C48-H71=1.0806       
C49-C20=1.4242       C49-C22=1.4247       C49-C27=1.4147       C50-C21=1.4100       C50-C28=1.3690       C50-H72=1.0802       
C51-C22=1.4133       C51-C23=1.4320       C51-C29=1.4178       C52-C23=1.4120       C52-C24=1.4231       C52-C30=1.4187       
C53-C21=1.4266       C53-C24=1.4173       C53-C26=1.4131       H54-C2=1.0801        H55-C9=1.0771        H56-C17=1.0798       
H57-C19=1.0762       H58-C25=1.0804       H59-C28=1.0807       H60-C33=1.0774       H61-C43=1.0767       H62-C47=1.0797       
H63-C1=1.0770        H64-C3=1.0772        H65-C4=1.0803        H66-C7=1.0806        H67-C8=1.0773        H68-C31=1.0774       
H69-C34=1.0802       H70-C41=1.0807       H71-C48=1.0806       H72-C50=1.0802       B73-C32=1.4436       B73-C40=1.4402       
 C  H  Rav=1.0789 sigma=0.0017  Rmin=1.0762  Rmax=1.0807    19
 C  B  Rav=1.4419 sigma=0.0017  Rmin=1.4402  Rmax=1.4436     2
 C  C  Rav=1.4102 sigma=0.0207  Rmin=1.3686  Rmax=1.4570    69
 
 selected bond angles (degree)
 --------------------
C5-C1-C4=122.03                H63-C1-C4=117.50               H63-C1-C5=120.47               C6-C2-C4=120.06                
H54-C2-C4=121.21               H54-C2-C6=118.73               C14-C3-C8=121.69               H64-C3-C8=117.77               
H64-C3-C14=120.54              C2-C4-C1=119.92                H65-C4-C1=119.51               H65-C4-C2=120.57               
C14-C5-C1=122.07               C20-C5-C1=119.13               C20-C5-C14=118.80              C20-C6-C2=120.65               
C25-C6-C2=120.55               C25-C6-C20=118.80              C34-C7-C31=120.37              H66-C7-C31=119.29              
H66-C7-C34=120.34              C38-C8-C3=121.50               H67-C8-C3=117.97               H67-C8-C38=120.54              
C43-C9-C37=121.46              H55-C9-C37=120.61              H55-C9-C43=117.93              C38-C10-C31=122.57             
C39-C10-C31=118.85             C39-C10-C38=118.58             
 
 selected dihedral angles (degree)
 ---------------------------------
C2-C4-C1-C5=  0.00            C2-C4-C1-H63=180.06           H65-C4-C1-C5=180.04           H65-C4-C1-H63=  0.11          
C1-C4-C2-C6=  0.24            C1-C4-C2-H54=180.15           H65-C4-C2-C6=180.18           H65-C4-C2-H54=  0.10          
C14-C5-C1-C4=179.67           C14-C5-C1-H63=359.60          C20-C5-C1-C4=359.65           C20-C5-C1-H63=179.57          
C20-C6-C2-C4=359.91           C20-C6-C2-H54=179.99          C25-C6-C2-C4=179.96           C25-C6-C2-H54=  0.04          
C38-C8-C3-C14=359.92          C38-C8-C3-H64=180.02          H67-C8-C3-C14=180.00          H67-C8-C3-H64=  0.10          
           -------------------------------------------------
          |                Final Singlepoint                |
           -------------------------------------------------

          ...................................................
          :                      SETUP                      :
          :.................................................:
          :  # basis functions                 235          :
          :  # atomic orbitals                 235          :
          :  # shells                          127          :
          :  # electrons                       234          :
          :  max. iterations                   250          :
          :  Hamiltonian                  GFN2-xTB          :
          :  restarted?                      false          :
          :  GBSA solvation                  false          :
          :  PC potential                    false          :
          :  electronic temp.          300.0000000     K    :
          :  accuracy                    1.0000000          :
          :  -> integral cutoff          0.2500000E+02      :
          :  -> integral neglect         0.1000000E-07      :
          :  -> SCF convergence          0.1000000E-05 Eh   :
          :  -> wf. convergence          0.1000000E-03 e    :
          :  Broyden damping             0.4000000          :
          :  net charge                          0          :
          :  unpaired electrons                  0          :
          ...................................................

 iter      E             dE          RMSdq      gap      omega  full diag
   1   -127.0843600 -0.127084E+03  0.113E-04    0.15       0.0  T
   2   -127.0843598  0.290041E-06  0.150E-03    0.15       7.8  T
   3   -127.0843600 -0.289730E-06  0.113E-04    0.15     103.9  T
   4   -127.0843600 -0.138681E-08  0.430E-05    0.15     272.5  T

   *** convergence criteria satisfied after 4 iterations ***

         #    Occupation            Energy/Eh            Energy/eV
      -------------------------------------------------------------
         1        2.0000           -0.6571450             -17.8818
       ...           ...                  ...                  ...
       111        2.0000           -0.3876362             -10.5481
       112        2.0000           -0.3874176             -10.5422
       113        2.0000           -0.3854531             -10.4887
       114        2.0000           -0.3825300             -10.4092
       115        2.0000           -0.3686725             -10.0321
       116        2.0000           -0.3531902              -9.6108
       117        1.8955           -0.3170604              -8.6277 (HOMO)
       118        0.1045           -0.3115535              -8.4778 (LUMO)
       119                         -0.2823228              -7.6824
       120                         -0.2780593              -7.5664
       121                         -0.2633393              -7.1658
       122                         -0.2454980              -6.6803
       ...                                ...                  ...
       235                          0.7680044              20.8985
      -------------------------------------------------------------
                  HL-Gap            0.0055069 Eh            0.1499 eV
             Fermi-level           -0.3143069 Eh           -8.5527 eV

 SCC (total)                   0 d,  0 h,  0 min,  0.116 sec
 SCC setup                      ...        0 min,  0.001 sec (  0.862%)
 Dispersion                     ...        0 min,  0.001 sec (  0.862%)
 classical contributions        ...        0 min,  0.000 sec (  0.000%)
 integral evaluation            ...        0 min,  0.014 sec ( 12.069%)
 iterations                     ...        0 min,  0.055 sec ( 47.414%)
 molecular gradient             ...        0 min,  0.044 sec ( 37.931%)
 printout                       ...        0 min,  0.001 sec (  0.862%)

         :::::::::::::::::::::::::::::::::::::::::::::::::::::
         ::                     SUMMARY                     ::
         :::::::::::::::::::::::::::::::::::::::::::::::::::::
         :: total energy            -124.622067555136 Eh    ::
         :: gradient norm              0.000232369575 Eh/a0 ::
         :: HOMO-LUMO gap              0.149850391142 eV    ::
         ::.................................................::
         :: SCC energy              -127.086501736749 Eh    ::
         :: -> isotropic ES            0.019280168226 Eh    ::
         :: -> anisotropic ES          0.011001506005 Eh    ::
         :: -> anisotropic XC          0.051051388502 Eh    ::
         :: -> dispersion             -0.137270331437 Eh    ::
         :: repulsion energy           2.464434181613 Eh    ::
         :: add. restraining           0.000000000000 Eh    ::
         :: total charge              -0.000000000000 e     ::
         :::::::::::::::::::::::::::::::::::::::::::::::::::::

           -------------------------------------------------
          |                Property Printout                |
           -------------------------------------------------

    * Orbital Energies and Occupations

         #    Occupation            Energy/Eh            Energy/eV
      -------------------------------------------------------------
         1        2.0000           -0.6571450             -17.8818
       ...           ...                  ...                  ...
       105        2.0000           -0.4027082             -10.9582
       106        2.0000           -0.4016383             -10.9291
       107        2.0000           -0.4008555             -10.9078
       108        2.0000           -0.3989636             -10.8564
       109        2.0000           -0.3926560             -10.6847
       110        2.0000           -0.3918917             -10.6639
       111        2.0000           -0.3876362             -10.5481
       112        2.0000           -0.3874176             -10.5422
       113        2.0000           -0.3854531             -10.4887
       114        2.0000           -0.3825300             -10.4092
       115        2.0000           -0.3686725             -10.0321
       116        2.0000           -0.3531902              -9.6108
       117        1.8955           -0.3170604              -8.6277 (HOMO)
       118        0.1045           -0.3115535              -8.4778 (LUMO)
       119                         -0.2823228              -7.6824
       120                         -0.2780593              -7.5664
       121                         -0.2633393              -7.1658
       122                         -0.2454980              -6.6803
       123                         -0.2391999              -6.5090
       124                         -0.2359874              -6.4215
       125                         -0.2324833              -6.3262
       126                         -0.2253354              -6.1317
       127                         -0.2207336              -6.0065
       128                         -0.2184390              -5.9440
       ...                                ...                  ...
       235                          0.7680044              20.8985
      -------------------------------------------------------------
                  HL-Gap            0.0055069 Eh            0.1499 eV
             Fermi-level           -0.3143069 Eh           -8.5527 eV

     #   Z          covCN         q      C6AA      α(0)
     1   6 C        2.924    -0.039    28.964     8.826
     2   6 C        2.924    -0.041    29.008     8.832
     3   6 C        2.920    -0.038    28.949     8.823
     4   6 C        2.912    -0.030    28.744     8.791
     5   6 C        2.978     0.006    27.880     8.661
     6   6 C        2.983     0.012    27.741     8.640
     7   6 C        2.912    -0.031    28.769     8.795
     8   6 C        2.920    -0.038    28.943     8.822
     9   6 C        2.921    -0.038    28.942     8.822
    10   6 C        2.977     0.005    27.905     8.665
    11   6 C        2.980     0.011    27.754     8.642
    12   6 C        3.019     0.004    27.917     8.667
    13   6 C        2.982     0.001    27.997     8.680
    14   6 C        2.981     0.002    27.977     8.676
    15   6 C        2.989     0.001    28.002     8.680
    16   6 C        2.985    -0.000    28.027     8.684
    17   6 C        2.915    -0.031    28.775     8.796
    18   6 C        2.976     0.010    27.784     8.646
    19   6 C        2.925    -0.036    28.899     8.816
    20   6 C        2.992     0.003    27.946     8.672
    21   6 C        2.980     0.011    27.755     8.642
    22   6 C        2.983    -0.003    28.087     8.693
    23   6 C        2.983    -0.002    28.067     8.690
    24   6 C        2.985    -0.000    28.023     8.684
    25   6 C        2.917    -0.040    28.998     8.830
    26   6 C        2.977     0.005    27.912     8.666
    27   6 C        3.009     0.001    27.995     8.679
    28   6 C        2.912    -0.031    28.772     8.796
    29   6 C        2.980     0.000    28.016     8.682
    30   6 C        2.988     0.001    28.000     8.680
    31   6 C        2.922    -0.039    28.967     8.826
    32   6 C        2.889    -0.074    29.839     8.956
    33   6 C        2.922    -0.041    29.014     8.833
    34   6 C        2.922    -0.038    28.952     8.824
    35   6 C        2.967    -0.023    28.587     8.770
    36   6 C        2.986    -0.001    28.049     8.688
    37   6 C        2.981     0.004    27.926     8.668
    38   6 C        2.980     0.005    27.915     8.667
    39   6 C        2.994    -0.001    28.033     8.685
    40   6 C        2.894    -0.073    29.808     8.951
    41   6 C        2.927    -0.049    29.213     8.864
    42   6 C        2.976     0.011    27.777     8.645
    43   6 C        2.921    -0.040    28.997     8.831
    44   6 C        2.987     0.000    28.019     8.683
    45   6 C        2.985    -0.001    28.055     8.688
    46   6 C        2.992     0.000    28.016     8.683
    47   6 C        2.911    -0.030    28.747     8.792
    48   6 C        2.926    -0.052    29.282     8.874
    49   6 C        2.980     0.004    27.931     8.669
    50   6 C        2.922    -0.040    28.992     8.830
    51   6 C        2.981    -0.002    28.066     8.690
    52   6 C        2.985    -0.005    28.146     8.703
    53   6 C        2.994    -0.000    28.022     8.683
    54   1 H        0.926     0.028     2.618     2.530
    55   1 H        0.926     0.033     2.540     2.492
    56   1 H        0.926     0.026     2.643     2.543
    57   1 H        0.926     0.036     2.507     2.476
    58   1 H        0.926     0.025     2.656     2.549
    59   1 H        0.926     0.026     2.648     2.545
    60   1 H        0.926     0.028     2.611     2.527
    61   1 H        0.926     0.032     2.562     2.503
    62   1 H        0.926     0.028     2.608     2.525
    63   1 H        0.926     0.033     2.549     2.497
    64   1 H        0.926     0.032     2.558     2.501
    65   1 H        0.926     0.028     2.612     2.527
    66   1 H        0.926     0.027     2.633     2.538
    67   1 H        0.926     0.033     2.549     2.497
    68   1 H        0.926     0.030     2.591     2.517
    69   1 H        0.926     0.029     2.602     2.522
    70   1 H        0.926     0.028     2.609     2.526
    71   1 H        0.926     0.027     2.626     2.534
    72   1 H        0.926     0.028     2.618     2.530
    73   5 B        1.905     0.253    36.242    12.673

 Mol. C6AA /au·bohr⁶  :     101690.452894
 Mol. C8AA /au·bohr⁸  :    2763355.067443
 Mol. α(0) /au        :        523.734420


Wiberg/Mayer (AO) data.
largest (>0.10) Wiberg bond orders for each atom

 ---------------------------------------------------------------------------
     #   Z sym  total        # sym  WBO       # sym  WBO       # sym  WBO
 ---------------------------------------------------------------------------
     1   6 C    3.902 --     4 C    1.386     5 C    1.386    63 H    0.961
     2   6 C    3.905 --     4 C    1.504     6 C    1.273    54 H    0.969
     3   6 C    3.970 --     8 C    1.475    14 C    1.353    64 H    0.960
     4   6 C    3.983 --     2 C    1.504     1 C    1.386    65 H    0.970
     5   6 C    3.982 --     1 C    1.386    20 C    1.269    14 C    1.135
     6   6 C    3.985 --    25 C    1.326     2 C    1.273    20 C    1.219
     7   6 C    3.983 --    34 C    1.507    31 C    1.383    66 H    0.970
     8   6 C    3.971 --     3 C    1.475    38 C    1.355    67 H    0.960
     9   6 C    3.971 --    43 C    1.477    37 C    1.354    55 H    0.960
    10   6 C    3.982 --    31 C    1.386    39 C    1.269    38 C    1.134
    11   6 C    3.985 --    41 C    1.343    34 C    1.269    39 C    1.212
    12   6 C    3.941 --    42 C    1.274    35 C    1.241    40 C    1.144
    13   6 C    3.964 --    43 C    1.350    36 C    1.279    42 C    1.129
    14   6 C    3.963 --     3 C    1.353    44 C    1.276     5 C    1.135
    15   6 C    3.978 --    38 C    1.273    44 C    1.245    45 C    1.236
    16   6 C    3.979 --    46 C    1.280    39 C    1.249    45 C    1.224
    17   6 C    3.909 --    47 C    1.486    40 C    1.303    56 H    0.970
    18   6 C    3.989 --    48 C    1.327    41 C    1.326    46 C    1.175
    19   6 C    3.902 --    47 C    1.397    42 C    1.376    57 H    0.959
    20   6 C    3.951 --     5 C    1.269    49 C    1.242     6 C    1.219
    21   6 C    3.985 --    48 C    1.342    50 C    1.269    53 C    1.212
    22   6 C    3.948 --    51 C    1.278    44 C    1.230    49 C    1.220
    23   6 C    3.971 --    52 C    1.275    45 C    1.274    51 C    1.199
    24   6 C    3.979 --    46 C    1.281    53 C    1.250    52 C    1.223
    25   6 C    3.817 --    32 C    1.365     6 C    1.326    58 H    0.968
    26   6 C    3.982 --    33 C    1.386    53 C    1.269    37 C    1.134
    27   6 C    3.958 --    49 C    1.284    35 C    1.275    32 C    1.109
    28   6 C    3.983 --    50 C    1.508    33 C    1.382    59 H    0.970
    29   6 C    3.949 --    51 C    1.271    36 C    1.230    35 C    1.230
    30   6 C    3.978 --    37 C    1.274    36 C    1.243    52 C    1.235
    31   6 C    3.896 --    10 C    1.386     7 C    1.383    68 H    0.962
    32   6 C    3.977 --    25 C    1.365    73 B    1.340    27 C    1.109
    33   6 C    3.897 --    26 C    1.386    28 C    1.382    60 H    0.962
    34   6 C    3.900 --     7 C    1.507    11 C    1.269    69 H    0.969
    35   6 C    3.966 --    27 C    1.275    12 C    1.241    29 C    1.230
    36   6 C    3.978 --    13 C    1.279    30 C    1.243    29 C    1.230
    37   6 C    3.961 --     9 C    1.354    30 C    1.274    26 C    1.134
    38   6 C    3.962 --     8 C    1.355    15 C    1.273    10 C    1.134
    39   6 C    3.948 --    10 C    1.269    16 C    1.249    11 C    1.212
    40   6 C    3.970 --    73 B    1.359    17 C    1.303    12 C    1.144
    41   6 C    3.799 --    11 C    1.343    18 C    1.326    70 H    0.966
    42   6 C    3.981 --    19 C    1.376    12 C    1.274    13 C    1.129
    43   6 C    3.967 --     9 C    1.477    13 C    1.350    61 H    0.958
    44   6 C    3.976 --    14 C    1.276    15 C    1.245    22 C    1.230
    45   6 C    3.947 --    23 C    1.274    15 C    1.236    16 C    1.224
    46   6 C    3.965 --    24 C    1.281    16 C    1.280    18 C    1.175
    47   6 C    3.981 --    17 C    1.486    19 C    1.397    62 H    0.970
    48   6 C    3.800 --    21 C    1.342    18 C    1.327    71 H    0.966
    49   6 C    3.978 --    27 C    1.284    20 C    1.242    22 C    1.220
    50   6 C    3.901 --    28 C    1.508    21 C    1.269    72 H    0.969
    51   6 C    3.971 --    22 C    1.278    29 C    1.271    23 C    1.199
    52   6 C    3.948 --    23 C    1.275    30 C    1.235    24 C    1.223
    53   6 C    3.949 --    26 C    1.269    24 C    1.250    21 C    1.212
    54   1 H    0.998 --     2 C    0.969
    55   1 H    0.997 --     9 C    0.960
    56   1 H    0.999 --    17 C    0.970
    57   1 H    0.998 --    19 C    0.959
    58   1 H    0.998 --    25 C    0.968
    59   1 H    0.998 --    28 C    0.970
    60   1 H    0.999 --    33 C    0.962
    61   1 H    0.998 --    43 C    0.958
    62   1 H    0.998 --    47 C    0.970
    63   1 H    0.998 --     1 C    0.961
    64   1 H    0.998 --     3 C    0.960
    65   1 H    0.998 --     4 C    0.970
    66   1 H    0.998 --     7 C    0.970
    67   1 H    0.998 --     8 C    0.960
    68   1 H    0.999 --    31 C    0.962
    69   1 H    0.998 --    34 C    0.969
    70   1 H    0.998 --    41 C    0.966
    71   1 H    0.998 --    48 C    0.966
    72   1 H    0.998 --    50 C    0.969
    73   5 B    3.043 --    40 C    1.359    32 C    1.340
 ---------------------------------------------------------------------------

Topologies differ in total number of bonds
Writing topology from bond orders to xtbtopo.mol

molecular dipole:
                 x           y           z       tot (Debye)
 q only:       -1.472      -0.235      -0.004
   full:       -1.683      -0.240      -0.006       4.321
molecular quadrupole (traceless):
                xx          xy          yy          xz          yz          zz
 q only:       11.693       6.406       0.033       0.058       0.021     -11.726
  q+dip:       27.301       7.106      15.963       0.073       0.051     -43.264
   full:       19.094       7.162       3.131       0.094       0.041     -22.225

           -------------------------------------------------
          |                Geometry Summary                 |
           -------------------------------------------------

      molecular mass/u    :      666.5309050
   center of mass at/Å    :       -0.0170178      -0.0031837      -0.0000605
  moments of inertia/u·Å² :        0.6990379E+04   0.9058708E+04   0.1604757E+05
rotational constants/cm⁻¹ :        0.2411548E-02   0.1860931E-02   0.1050479E-02

 * 84 selected distances

     #   Z          #   Z                                           value/Å
     1   6 C        4   6 C                                       1.3889141
     2   6 C        4   6 C                                       1.3685822
     1   6 C        5   6 C                                       1.3942788
     2   6 C        6   6 C                                       1.4081760
     3   6 C        8   6 C                                       1.3706512
     3   6 C       14   6 C                                       1.3941435
     5   6 C       20   6 C                                       1.4144397
     6   6 C       20   6 C                                       1.4242613
     6   6 C       25   6 C                                       1.3913603
     7   6 C       31   6 C                                       1.3903865
    10   6 C       31   6 C                                       1.3936883
    25   6 C       32   6 C                                       1.3876548
    26   6 C       33   6 C                                       1.3936738
    28   6 C       33   6 C                                       1.3904271
     7   6 C       34   6 C                                       1.3691414
    11   6 C       34   6 C                                       1.4100458
    12   6 C       35   6 C                                       1.4326024
    27   6 C       35   6 C                                       1.4238127
    29   6 C       35   6 C                                       1.4311385
    13   6 C       36   6 C                                       1.4131540
    29   6 C       36   6 C                                       1.4254595
    30   6 C       36   6 C                                       1.4246261
     9   6 C       37   6 C                                       1.3926884
    30   6 C       37   6 C                                       1.4166559
     8   6 C       38   6 C                                       1.3934661
    15   6 C       38   6 C                                       1.4165400
    10   6 C       39   6 C                                       1.4132122
    11   6 C       39   6 C                                       1.4265443
    16   6 C       39   6 C                                       1.4177923
    17   6 C       40   6 C                                       1.4034993
    11   6 C       41   6 C                                       1.3922735
    18   6 C       41   6 C                                       1.3954866
    12   6 C       42   6 C                                       1.4153115
    19   6 C       42   6 C                                       1.3963813
     9   6 C       43   6 C                                       1.3697765
    13   6 C       43   6 C                                       1.3948597
    14   6 C       44   6 C                                       1.4144788
    15   6 C       44   6 C                                       1.4225270
    22   6 C       44   6 C                                       1.4235646
    15   6 C       45   6 C                                       1.4191950
    16   6 C       45   6 C                                       1.4233100
    23   6 C       45   6 C                                       1.4140382
    16   6 C       46   6 C                                       1.4099578
    18   6 C       46   6 C                                       1.4329763
    24   6 C       46   6 C                                       1.4098458
    17   6 C       47   6 C                                       1.3691757
    19   6 C       47   6 C                                       1.3859012
    18   6 C       48   6 C                                       1.3951770
    21   6 C       48   6 C                                       1.3923410
    20   6 C       49   6 C                                       1.4241609
    22   6 C       49   6 C                                       1.4246503
    27   6 C       49   6 C                                       1.4146659
    21   6 C       50   6 C                                       1.4099806
    28   6 C       50   6 C                                       1.3690329
    22   6 C       51   6 C                                       1.4132668
    23   6 C       51   6 C                                       1.4319595
    29   6 C       51   6 C                                       1.4178492
    23   6 C       52   6 C                                       1.4120284
    24   6 C       52   6 C                                       1.4230923
    30   6 C       52   6 C                                       1.4186632
    21   6 C       53   6 C                                       1.4265615
    24   6 C       53   6 C                                       1.4173233
    26   6 C       53   6 C                                       1.4131469
     2   6 C       54   1 H                                       1.0801200
     9   6 C       55   1 H                                       1.0771348
    17   6 C       56   1 H                                       1.0798464
    19   6 C       57   1 H                                       1.0761716 (min)
    25   6 C       58   1 H                                       1.0804137
    28   6 C       59   1 H                                       1.0806632
    33   6 C       60   1 H                                       1.0773747
    43   6 C       61   1 H                                       1.0766556
    47   6 C       62   1 H                                       1.0797444
     1   6 C       63   1 H                                       1.0769930
     3   6 C       64   1 H                                       1.0772017
     4   6 C       65   1 H                                       1.0802882
     7   6 C       66   1 H                                       1.0805947
     8   6 C       67   1 H                                       1.0772790
    31   6 C       68   1 H                                       1.0774323
    34   6 C       69   1 H                                       1.0801810
    41   6 C       70   1 H                                       1.0806801
    48   6 C       71   1 H                                       1.0805805
    50   6 C       72   1 H                                       1.0801684
    32   6 C       73   5 B                                       1.4435895 (max)
    40   6 C       73   5 B                                       1.4401885

 * 3 distinct bonds (by element types)

   Z      Z             #   av. dist./Å        max./Å        min./Å
   1 H    6 C          19     1.0789223     1.0806801     1.0761716
   5 B    6 C           2     1.4418890     1.4435895     1.4401885
   6 C    6 C          63     1.4065710     1.4329763     1.3685822


optimized geometry written to: xtbopt.xyz


           -------------------------------------------------
          | TOTAL ENERGY             -124.622067555136 Eh   |
          | GRADIENT NORM               0.000232369575 Eh/α |
          | HOMO-LUMO GAP               0.149850391142 eV   |
           -------------------------------------------------

------------------------------------------------------------------------
 * finished run on 2025/12/08 at 00:35:02.253     
------------------------------------------------------------------------
 total:
 * wall-time:     0 d,  0 h,  0 min,  2.013 sec
 *  cpu-time:     0 d,  0 h,  0 min,  7.734 sec
 * ratio c/w:     3.842 speedup
 SCF:
 * wall-time:     0 d,  0 h,  0 min,  0.444 sec
 *  cpu-time:     0 d,  0 h,  0 min,  1.719 sec
 * ratio c/w:     3.871 speedup
 ANC optimizer:
 * wall-time:     0 d,  0 h,  0 min,  1.507 sec
 *  cpu-time:     0 d,  0 h,  0 min,  5.828 sec
 * ratio c/w:     3.867 speedup

normal termination of xtb
