      -----------------------------------------------------------      
     |                   =====================                   |     
     |                           x T B                           |     
     |                   =====================                   |     
     |                         S. Grimme                         |     
     |          Mulliken Center for Theoretical Chemistry        |     
     |                    University of Bonn                     |     
      -----------------------------------------------------------      

   * xtb version 6.7.1pre (5071a88) compiled by 'Marcel@Raven' on 2024-07-23

   xtb is free software: you can redistribute it and/or modify it under
   the terms of the GNU Lesser General Public License as published by
   the Free Software Foundation, either version 3 of the License, or
   (at your option) any later version.
   
   xtb is distributed in the hope that it will be useful,
   but WITHOUT ANY WARRANTY; without even the implied warranty of
   MERCHANTABILITY or FITNESS FOR A PARTICULAR PURPOSE.  See the
   GNU Lesser General Public License for more details.
   
   Cite this work as:
   * C. Bannwarth, E. Caldeweyher, S. Ehlert, A. Hansen, P. Pracht,
     J. Seibert, S. Spicher, S. Grimme, WIREs Comput. Mol. Sci., 2020, 11,
     e01493. DOI: 10.1002/wcms.1493
   
   for GFN2-xTB:
   * C. Bannwarth, S. Ehlert and S. Grimme., J. Chem. Theory Comput., 2019,
     15, 1652-1671. DOI: 10.1021/acs.jctc.8b01176
   for GFN1-xTB:
   * S. Grimme, C. Bannwarth, P. Shushkov, J. Chem. Theory Comput., 2017,
     13, 1989-2009. DOI: 10.1021/acs.jctc.7b00118
   for GFN0-xTB:
   * P. Pracht, E. Caldeweyher, S. Ehlert, S. Grimme, ChemRxiv, 2019, preprint.
     DOI: 10.26434/chemrxiv.8326202.v1
   for GFN-FF:
   * S. Spicher and S. Grimme, Angew. Chem. Int. Ed., 2020, 59, 15665-15673.
     DOI: 10.1002/anie.202004239
   
   for ALPB and GBSA implicit solvation:
   * S. Ehlert, M. Stahn, S. Spicher, S. Grimme, J. Chem. Theory Comput.,
     2021, 17, 4250-4261. DOI: 10.1021/acs.jctc.1c00471
   
   for ddCOSMO and CPCM-X implicit solvation:
   * M. Stahn, S. Ehlert, S. Grimme, J. Phys. Chem. A,
     2023, XX, XXXX-XXXX. DOI: 10.1021/acs.jpca.3c04382
   
   for DFT-D4:
   * E. Caldeweyher, C. Bannwarth and S. Grimme, J. Chem. Phys., 2017,
     147, 034112. DOI: 10.1063/1.4993215
   * E. Caldeweyher, S. Ehlert, A. Hansen, H. Neugebauer, S. Spicher,
     C. Bannwarth and S. Grimme, J. Chem. Phys., 2019, 150, 154122.
     DOI: 10.1063/1.5090222
   * E. Caldeweyher, J.-M. Mewes, S. Ehlert and S. Grimme, Phys. Chem. Chem. Phys.
     2020, 22, 8499-8512. DOI: 10.1039/D0CP00502A
   
   for sTDA-xTB:
   * S. Grimme and C. Bannwarth, J. Chem. Phys., 2016, 145, 054103.
     DOI: 10.1063/1.4959605
   
   in the mass-spec context:
   * V. Asgeirsson, C. Bauer and S. Grimme, Chem. Sci., 2017, 8, 4879.
     DOI: 10.1039/c7sc00601b
   * J. Koopman and S. Grimme, ACS Omega 2019, 4, 12, 15120-15133.
     DOI: 10.1021/acsomega.9b02011
   
   for metadynamics refer to:
   * S. Grimme, J. Chem. Theory Comput., 2019, 155, 2847-2862
     DOI: 10.1021/acs.jctc.9b00143
   
   for SPH calculations refer to:
   * S. Spicher and S. Grimme, J. Chem. Theory Comput., 2021, 17, 1701-1714
     DOI: 10.1021/acs.jctc.0c01306
   
   for ONIOM refer to:
   * C. Plett, A. Katbashev, S. Ehlert, S. Grimme, M. Bursch,
     Phys. Chem. Chem. Phys., 2023, 25, 17860-17868. DOI: 10.1039/D3CP02178E
   
   for DIPRO refer to:
   * J. Kohn, N. Gildemeister, S. Grimme, D. Fazzi, A. Hansen,
     J. Chem. Phys., 2023, just accepted.
   
   for PTB refer to:
   * S. Grimme, M. Mueller, A. Hansen, J. Chem. Phys., 2023, 158, 124111.
     DOI: 10.1063/5.0137838
   
   with help from (in alphabetical order)
   P. Atkinson, C. Bannwarth, F. Bohle, G. Brandenburg, E. Caldeweyher
   M. Checinski, S. Dohm, S. Ehlert, S. Ehrlich, I. Gerasimov, C. Hölzer
   A. Katbashev, J. Kohn, J. Koopman, C. Lavigne, S. Lehtola, F. März, M. Müller,
   F. Musil, H. Neugebauer, J. Pisarek, C. Plett, P. Pracht, F. Pultar,
   J. Seibert, P. Shushkov, S. Spicher, M. Stahn, M. Steiner, T. Strunk,
   J. Stückrath, T. Rose, and J. Unsleber
   
 * started run on 2025/12/08 at 00:34:31.123     
   ID    Z sym.   atoms
    1    6 C      1-50
    2    1 H      51-70
    3    5 B      71-74

           -------------------------------------------------
          |                Calculation Setup                |
           -------------------------------------------------

          program call               : xtb "C:\Users\LENOVO GAMING\Documents\GitHub\molecular-conductivity-sim\dataset\1nm-4Bdoped-5percent.xyz" --opt --parallel 4
          coordinate file            : C:\Users\LENOVO GAMING\Documents\GitHub\molecular-conductivity-sim\dataset\1nm-4Bdoped-5percent.xyz
          omp threads                :                     4


           -------------------------------------------------
          |                 G F N 2 - x T B                 |
           -------------------------------------------------

        Reference                      10.1021/acs.jctc.8b01176
      * Hamiltonian:
        H0-scaling (s, p, d)           1.850000    2.230000    2.230000
        zeta-weighting                 0.500000
      * Dispersion:
        s8                             2.700000
        a1                             0.520000
        a2                             5.000000
        s9                             5.000000
      * Repulsion:
        kExp                           1.500000    1.000000
        rExp                           1.000000
      * Coulomb:
        alpha                          2.000000
        third order                    shell-resolved
        anisotropic                    true
        a3                             3.000000
        a5                             4.000000
        cn-shift                       1.200000
        cn-exp                         4.000000
        max-rad                        5.000000


          ...................................................
          :                      SETUP                      :
          :.................................................:
          :  # basis functions                 236          :
          :  # atomic orbitals                 236          :
          :  # shells                          128          :
          :  # electrons                       232          :
          :  max. iterations                   250          :
          :  Hamiltonian                  GFN2-xTB          :
          :  restarted?                      false          :
          :  GBSA solvation                  false          :
          :  PC potential                    false          :
          :  electronic temp.          300.0000000     K    :
          :  accuracy                    1.0000000          :
          :  -> integral cutoff          0.2500000E+02      :
          :  -> integral neglect         0.1000000E-07      :
          :  -> SCF convergence          0.1000000E-05 Eh   :
          :  -> wf. convergence          0.1000000E-03 e    :
          :  Broyden damping             0.4000000          :
          :  net charge                          0          :
          :  unpaired electrons                  0          :
          ...................................................

 iter      E             dE          RMSdq      gap      omega  full diag
   1   -124.1688873 -0.124169E+03  0.715E+00    0.89       0.0  T
   2   -124.4460453 -0.277158E+00  0.471E+00    0.72       1.0  T
   3   -124.1459734  0.300072E+00  0.235E+00    0.81       1.0  T
   4   -124.4861072 -0.340134E+00  0.125E+00    0.87       1.0  T
   5   -124.5899185 -0.103811E+00  0.609E-01    0.85       1.0  T
   6   -124.5861200  0.379858E-02  0.461E-01    0.80       1.0  T
   7   -124.5963413 -0.102214E-01  0.261E-01    0.84       1.0  T
   8   -124.6025059 -0.616459E-02  0.928E-02    0.81       1.0  T
   9   -124.6030716 -0.565659E-03  0.438E-02    0.81       1.0  T
  10   -124.6031117 -0.401479E-04  0.199E-02    0.81       1.0  T
  11   -124.6031145 -0.276762E-05  0.639E-03    0.81       1.8  T
  12   -124.6031164 -0.188455E-05  0.395E-03    0.81       2.9  T
  13   -124.6031168 -0.383282E-06  0.128E-03    0.81       9.1  T
  14   -124.6031169 -0.936947E-07  0.461E-04    0.81      25.2  T
  15   -124.6031169 -0.116612E-07  0.186E-04    0.81      62.4  T

   *** convergence criteria satisfied after 15 iterations ***

         #    Occupation            Energy/Eh            Energy/eV
      -------------------------------------------------------------
         1        2.0000           -0.6640675             -18.0702
       ...           ...                  ...                  ...
       110        2.0000           -0.3871436             -10.5347
       111        2.0000           -0.3859495             -10.5022
       112        2.0000           -0.3839214             -10.4470
       113        2.0000           -0.3811659             -10.3721
       114        2.0000           -0.3783828             -10.2963
       115        2.0000           -0.3745293             -10.1915
       116        2.0000           -0.3612367              -9.8298 (HOMO)
       117        0.0000           -0.3315995              -9.0233 (LUMO)
       118                         -0.3020009              -8.2179
       119                         -0.2894379              -7.8760
       120                         -0.2816628              -7.6644
       121                         -0.2652037              -7.2166
       ...                                ...                  ...
       236                          0.7307121              19.8837
      -------------------------------------------------------------
                  HL-Gap            0.0296373 Eh            0.8065 eV
             Fermi-level           -0.3464181 Eh           -9.4265 eV

 SCC (total)                   0 d,  0 h,  0 min,  0.301 sec
 SCC setup                      ...        0 min,  0.001 sec (  0.332%)
 Dispersion                     ...        0 min,  0.002 sec (  0.664%)
 classical contributions        ...        0 min,  0.000 sec (  0.000%)
 integral evaluation            ...        0 min,  0.017 sec (  5.648%)
 iterations                     ...        0 min,  0.229 sec ( 76.080%)
 molecular gradient             ...        0 min,  0.051 sec ( 16.944%)
 printout                       ...        0 min,  0.001 sec (  0.332%)

         :::::::::::::::::::::::::::::::::::::::::::::::::::::
         ::                     SUMMARY                     ::
         :::::::::::::::::::::::::::::::::::::::::::::::::::::
         :: total energy            -122.398991448593 Eh    ::
         :: gradient norm              0.054700344482 Eh/a0 ::
         :: HOMO-LUMO gap              0.806471422991 eV    ::
         ::.................................................::
         :: SCC energy              -124.605163997691 Eh    ::
         :: -> isotropic ES            0.079624219131 Eh    ::
         :: -> anisotropic ES          0.016414423609 Eh    ::
         :: -> anisotropic XC          0.054029125753 Eh    ::
         :: -> dispersion             -0.133945753428 Eh    ::
         :: repulsion energy           2.206172549097 Eh    ::
         :: add. restraining           0.000000000000 Eh    ::
         :: total charge               0.000000000000 e     ::
         :::::::::::::::::::::::::::::::::::::::::::::::::::::

      ----------------------------------------------------------- 
     |                   =====================                   |
     |                        A N C O P T                        |
     |                   =====================                   |
     |               Approximate Normal Coordinate               |
     |                Rational Function Optimizer                |
      ----------------------------------------------------------- 
      ----------------------------------------------------------- 
     |                   =====================                   |
     |                        A N C O P T                        |
     |                   =====================                   |
     |               Approximate Normal Coordinate               |
     |                Rational Function Optimizer                |
      ----------------------------------------------------------- 

          ...................................................
          :                      SETUP                      :
          :.................................................:
          :   optimization level            normal          :
          :   max. optcycles                   222          :
          :   ANC micro-cycles                  20          :
          :   degrees of freedom               216          :
          :.................................................:
          :   RF solver                   davidson          :
          :   write xtbopt.log                true          :
          :   linear?                        false          :
          :   energy convergence         0.5000000E-05 Eh   :
          :   grad. convergence          0.1000000E-02 Eh/α :
          :   maxmium RF displ.          1.0000000          :
          :   Hlow (freq-cutoff)         0.1000000E-01      :
          :   Hmax (freq-cutoff)         5.0000000          :
          :   S6 in model hess.         20.0000000          :
          ...................................................

generating ANC from exact Hessian ...
Using Lindh-Hessian (1995)
 Shifting diagonal of input Hessian by   9.736562489335618E-003
 Lowest  eigenvalues of input Hessian
    0.000000    0.000000    0.000000    0.000000    0.000000    0.000000
    0.010000    0.010279    0.010581    0.010848    0.011062    0.012402
    0.012688    0.012771    0.013038    0.015025    0.015346    0.015510
 Highest eigenvalues
    1.975045    1.991651    2.024521    2.042212    2.081324    2.090461
 

........................................................................
.............................. CYCLE    1 ..............................
........................................................................

 iter      E             dE          RMSdq      gap      omega  full diag
   1   -124.6031169 -0.124603E+03  0.119E-04    0.81       0.0  T
   2   -124.6031169  0.366299E-09  0.103E-04    0.81     112.5  T
   3   -124.6031169 -0.840060E-09  0.531E-05    0.81     218.8  T
     SCC iter.                  ...        0 min,  0.040 sec
     gradient                   ...        0 min,  0.048 sec
 * total energy  :  -122.3989914 Eh     change       -0.1127091E-08 Eh
   gradient norm :     0.0546996 Eh/α   predicted     0.0000000E+00 (-100.00%)
   displ. norm   :     0.3544272 α      lambda       -0.1035441E-01
   maximum displ.:     0.1923153 α      in ANC's #44, #34, #56, ...

........................................................................
.............................. CYCLE    2 ..............................
........................................................................

 iter      E             dE          RMSdq      gap      omega  full diag
   1   -124.6957745 -0.124696E+03  0.136E-01    0.80       0.0  T
   2   -124.6957745 -0.142879E-07  0.823E-02    0.80       1.0  T
   3   -124.6955141  0.260429E-03  0.491E-02    0.80       1.0  T
   4   -124.6957606 -0.246565E-03  0.151E-02    0.80       1.0  T
   5   -124.6957855 -0.248740E-04  0.301E-03    0.80       3.9  T
   6   -124.6957858 -0.341709E-06  0.196E-03    0.80       5.9  T
   7   -124.6957860 -0.165674E-06  0.756E-04    0.80      15.4  T
   8   -124.6957861 -0.480663E-07  0.283E-04    0.80      41.1  T
     SCC iter.                  ...        0 min,  0.120 sec
     gradient                   ...        0 min,  0.053 sec
 * total energy  :  -122.4060903 Eh     change       -0.7098875E-02 Eh
   gradient norm :     0.0195551 Eh/α   predicted    -0.5827725E-02 ( -17.91%)
   displ. norm   :     0.2411477 α      lambda       -0.2448207E-02
   maximum displ.:     0.1553891 α      in ANC's #34, #44, #16, ...

........................................................................
.............................. CYCLE    3 ..............................
........................................................................

 iter      E             dE          RMSdq      gap      omega  full diag
   1   -124.7483631 -0.124748E+03  0.813E-02    0.80       0.0  T
   2   -124.7483640 -0.897549E-06  0.501E-02    0.80       1.0  T
   3   -124.7482722  0.918213E-04  0.294E-02    0.80       1.0  T
   4   -124.7483602 -0.879875E-04  0.889E-03    0.80       1.3  T
   5   -124.7483686 -0.839645E-05  0.273E-03    0.80       4.3  T
   6   -124.7483693 -0.678204E-06  0.124E-03    0.80       9.4  T
   7   -124.7483693 -0.380981E-07  0.628E-04    0.80      18.5  T
   8   -124.7483693 -0.334237E-07  0.201E-04    0.80      57.8  T
     SCC iter.                  ...        0 min,  0.116 sec
     gradient                   ...        0 min,  0.053 sec
 * total energy  :  -122.4073650 Eh     change       -0.1274665E-02 Eh
   gradient norm :     0.0038255 Eh/α   predicted    -0.1295416E-02 (   1.63%)
   displ. norm   :     0.0232559 α      lambda       -0.2951590E-04
   maximum displ.:     0.0121133 α      in ANC's #34, #44, #16, ...

........................................................................
.............................. CYCLE    4 ..............................
........................................................................

 iter      E             dE          RMSdq      gap      omega  full diag
   1   -124.7505880 -0.124751E+03  0.951E-03    0.80       0.0  T
   2   -124.7505879  0.902334E-07  0.616E-03    0.80       1.9  T
   3   -124.7505841  0.384370E-05  0.574E-03    0.80       2.0  T
   4   -124.7505879 -0.383695E-05  0.179E-03    0.80       6.5  T
   5   -124.7505883 -0.379059E-06  0.514E-04    0.80      22.6  T
   6   -124.7505883 -0.230102E-07  0.169E-04    0.80      68.6  T
     SCC iter.                  ...        0 min,  0.091 sec
     gradient                   ...        0 min,  0.052 sec
 * total energy  :  -122.4073836 Eh     change       -0.1860609E-04 Eh
   gradient norm :     0.0015789 Eh/α   predicted    -0.1482771E-04 ( -20.31%)
   displ. norm   :     0.0121263 α      lambda       -0.4382558E-05
   maximum displ.:     0.0050594 α      in ANC's #32, #16, #34, ...

........................................................................
.............................. CYCLE    5 ..............................
........................................................................

 iter      E             dE          RMSdq      gap      omega  full diag
   1   -124.7509995 -0.124751E+03  0.608E-03    0.80       0.0  T
   2   -124.7509994  0.106935E-07  0.368E-03    0.80       3.2  T
   3   -124.7509983  0.114839E-05  0.318E-03    0.80       3.7  T
   4   -124.7509994 -0.111469E-05  0.110E-03    0.80      10.6  T
   5   -124.7509996 -0.143151E-06  0.296E-04    0.80      39.2  T
   6   -124.7509996 -0.713787E-08  0.103E-04    0.80     112.7  T
     SCC iter.                  ...        0 min,  0.089 sec
     gradient                   ...        0 min,  0.047 sec
 * total energy  :  -122.4073857 Eh     change       -0.2149640E-05 Eh
   gradient norm :     0.0006088 Eh/α   predicted    -0.2243293E-05 (   4.36%)
   displ. norm   :     0.0041472 α      lambda       -0.6039194E-06
   maximum displ.:     0.0018577 α      in ANC's #34, #32, #16, ...

   *** GEOMETRY OPTIMIZATION CONVERGED AFTER 5 ITERATIONS ***

------------------------------------------------------------------------
 total energy gain   :        -0.0083943 Eh       -5.2675 kcal/mol
 total RMSD          :         0.0710677 a0        0.0376 Å
 total power (kW/mol):        -4.4078442 (step)  -25.6568 (real)
------------------------------------------------------------------------

 ANCopt (total)                0 d,  0 h,  0 min,  0.859 sec
 optimizer setup                ...        0 min,  0.001 sec (  0.116%)
 model hessian                  ...        0 min,  0.042 sec (  4.889%)
 ANC generation                 ...        0 min,  0.007 sec (  0.815%)
 coordinate transformation      ...        0 min,  0.000 sec (  0.000%)
 single point calculation       ...        0 min,  0.800 sec ( 93.132%)
 optimization log               ...        0 min,  0.008 sec (  0.931%)
 hessian update                 ...        0 min,  0.000 sec (  0.000%)
 rational function              ...        0 min,  0.000 sec (  0.000%)

================
 final structure:
================
74
 xtb: 6.7.1pre (5071a88)
C           -5.77824087859521        3.62670569603449       -0.00024254377599
C           -0.73265794941073        4.88178758247089       -0.00093681145270
C           -5.23152922522366        4.85874185405962       -0.00052993042061
C           -2.88410026793279        3.69276205992496       -0.00054669924460
C           -4.98667936691075        2.42875991042951       -0.00010946609812
C            4.86842745369333        5.08142652620139        0.00101649129934
C            0.61765509501828        4.89872227216947       -0.00073941878523
C            0.76201523152365       -4.86982994343473       -0.00105515537472
C            2.80099310402306        3.72511202006172        0.00026874220309
C            4.94261274136804        2.50400221900053        0.00077265418249
C           -3.52744801678292       -2.53075656503476        0.00037475735363
C           -1.36040835883486       -3.70671806671462       -0.00023560824207
C           -1.47799171369522        3.67200560101985       -0.00058813083905
C            0.67416554187709        2.47056150644298       -0.00016599908956
C            2.80372414691105        1.26918734671977        0.00019047809971
C           -5.57885596869980       -3.83360713102264        0.00111209430243
C            4.92836236850087        0.06452149101508        0.00041106984246
C           -3.48686790313039       -4.96501111425301        0.00078722777712
C           -3.56514385179684        2.44843895047504       -0.00025656295608
C            5.00272088302683       -2.36607729739384       -0.00005299963272
C           -1.43961218195647        1.21735238035641       -0.00016650456845
C            0.68980143773381        0.01130689033171       -0.00007492122528
C            2.83510568004370       -1.19948209002827       -0.00008757782337
C           -5.63775450173361        1.20809782920732        0.00019425336459
C            2.90472136409968       -3.66254453196269       -0.00061206479982
C           -3.55842615395497       -0.02656618604726        0.00010957361578
C            5.26880649014560       -4.79388721274353       -0.00058617836391
C           -1.42908504157712       -1.24988595800000       -0.00002552063842
C            0.73674724618506       -2.44670679125711       -0.00034980260793
C            3.52031099264689        4.97295106701366        0.00062220079283
C           -4.97281946237549       -0.01440175301234        0.00030590394335
C           -2.83816423565072       -1.27050146604339        0.00013451811115
C           -0.68560986283425       -2.47141513049552       -0.00019537554434
C            1.48596059322284       -3.65589607520988       -0.00066352497398
C            1.38912523222254        3.70434572513140       -0.00019054559678
C            3.51417376394538        2.49762196182541        0.00042206481825
C           -4.94815417997914       -2.59804824785645        0.00073552842671
C            5.60229390881334        1.29496245363630        0.00075064539746
C           -2.79134855777111       -3.74102168631348        0.00028320821246
C           -0.59367249137945       -4.89296219553990       -0.00084104284645
C           -0.74275653032918        2.45125660349030       -0.00031247232926
C            1.38693543793071        1.24812971164223       -0.00000336214222
C            3.51570248121774        0.04439045780946        0.00017826399821
C           -4.85665841292843       -5.01878615691483        0.00120311985543
C            5.63742864191796       -1.14916495543479        0.00030136479126
C           -2.85644165525503        1.21005022671616       -0.00011821809310
C            5.80614037565925       -3.55919285159150       -0.00020470182117
C           -0.72232777160831       -0.00944593016967       -0.00008587225672
C            1.42240017264125       -1.21178924306917       -0.00016448195579
C            3.56739177528311       -2.42095679458662       -0.00024936807183
H           -6.85285090993815        3.47821903218648       -0.00009856399340
H            1.30156229062042       -5.79933824633256       -0.00151792588793
H           -6.65857542738294       -3.86485971171117        0.00138306958460
H           -2.94531166953538       -5.89617434140537        0.00092756255302
H           -6.71927223576421        1.19675330276651        0.00034467185909
H            5.94744434484326       -5.63849409348378       -0.00069410163973
H            3.30019566304712       -6.04591068815965       -0.00125240546611
H           -1.08113602079852       -5.85310103889961       -0.00120776515145
H           -5.36439752476610       -5.97227785107562        0.00159670186566
H           -3.24669730236920        6.08229635668586       -0.00095919128004
H           -1.26634914090944        5.81467371355633       -0.00136662471249
H           -5.90244291044249        5.70949777887020       -0.00061705134842
H            5.27851067947890        6.08460194991891        0.00128017334256
H            1.10674218354167        5.85791725089351       -0.00107131642472
H            2.93473689205561        5.88040980111891        0.00063332259483
H            6.68350077204707        1.28441673837468        0.00097986128032
H            6.71856030947900       -1.10839349743028        0.00048053296433
H            6.87947572793989       -3.40236395536739       -0.00000856970483
H            6.90636777601060        3.84518873111704        0.00148998683100
H           -6.94867300129101       -1.32281625439911        0.00090064366789
B            5.73531489969479        3.82965559115328        0.00111451177298
B            3.75102152826105       -4.96541622447783       -0.00087400906766
B           -3.71453666175034        5.00890920115482       -0.00072029929588
B           -5.77781288137620       -1.31273551410980        0.00067948683888
 
 Bond Distances (Angstroems)
 ---------------------------
C1-C3=1.3479         C1-C5=1.4358         C1-H51=1.0848        C2-C7=1.3504         C2-C13=1.4209        C2-H61=1.0748        
C3-C1=1.3479         C3-H62=1.0835        C3-B73=1.5244        C4-C13=1.4063        C4-C19=1.4185        C4-B73=1.5562        
C5-C1=1.4358         C5-C19=1.4217        C5-C24=1.3834        C6-C30=1.3525        C6-H63=1.0838        C6-B71=1.5226        
C7-C2=1.3504         C7-C35=1.4219        C7-H64=1.0767        C8-C34=1.4134        C8-C40=1.3559        C8-H52=1.0748        
C9-C30=1.4403        C9-C35=1.4120        C9-C36=1.4196        C10-C36=1.4285       C10-C38=1.3773       C10-B71=1.5446       
C11-C32=1.4364       C11-C37=1.4223       C11-C39=1.4165       C12-C33=1.4076       C12-C39=1.4314       C12-C40=1.4125       
C13-C2=1.4209        C13-C4=1.4063        C13-C41=1.4251       C14-C35=1.4260       C14-C41=1.4171       C14-C42=1.4151       
C15-C36=1.4191       C15-C42=1.4169       C15-C43=1.4167       C16-C37=1.3872       C16-C44=1.3879       C16-H53=1.0802       
C17-C38=1.4029       C17-C43=1.4128       C17-C45=1.4056       C18-C39=1.4078       C18-C44=1.3708       C18-H54=1.0772       
C19-C4=1.4185        C19-C5=1.4217        C19-C46=1.4268       C20-C45=1.3725       C20-C47=1.4384       C20-C50=1.4364       
C21-C41=1.4171       C21-C46=1.4168       C21-C48=1.4211       C22-C42=1.4198       C22-C48=1.4123       C22-C49=1.4257       
C23-C43=1.4179       C23-C49=1.4128       C23-C50=1.4242       C24-C5=1.3834        C24-C31=1.3916       C24-H55=1.0816       
C25-C34=1.4188       C25-C50=1.4074       C25-B72=1.5536       C26-C31=1.4144       C26-C32=1.4374       C26-C46=1.4220       
C27-C47=1.3466       C27-H56=1.0835       C27-B72=1.5274       C28-C32=1.4092       C28-C33=1.4300       C28-C48=1.4277       
C29-C33=1.4226       C29-C34=1.4225       C29-C49=1.4125       C30-C6=1.3525        C30-C9=1.4403        C30-H65=1.0800       
C31-C24=1.3916       C31-C26=1.4144       C31-B74=1.5276       C32-C11=1.4364       C32-C26=1.4374       C32-C28=1.4092       
C33-C12=1.4076       C33-C28=1.4300       C33-C29=1.4226       C34-C8=1.4134        C34-C25=1.4188       C34-C29=1.4225       
C35-C7=1.4219        C35-C9=1.4120        C35-C14=1.4260       C36-C9=1.4196        C36-C10=1.4285       C36-C15=1.4191       
C37-C11=1.4223       C37-C16=1.3872       C37-B74=1.5298       C38-C10=1.3773       C38-C17=1.4029       C38-H66=1.0813       
C39-C11=1.4165       C39-C12=1.4314       C39-C18=1.4078       C40-C8=1.3559        C40-C12=1.4125       C40-H58=1.0768       
C41-C13=1.4251       C41-C14=1.4171       C41-C21=1.4171       C42-C14=1.4151       C42-C15=1.4169       C42-C22=1.4198       
C43-C15=1.4167       C43-C17=1.4128       C43-C23=1.4179       C44-C16=1.3879       C44-C18=1.3708       C44-H59=1.0803       
C45-C17=1.4056       C45-C20=1.3725       C45-H67=1.0819       C46-C19=1.4268       C46-C21=1.4168       C46-C26=1.4220       
C47-C20=1.4384       C47-C27=1.3466       C47-H68=1.0847       C48-C21=1.4211       C48-C22=1.4123       C48-C28=1.4277       
C49-C22=1.4257       C49-C23=1.4128       C49-C29=1.4125       C50-C20=1.4364       C50-C23=1.4242       C50-C25=1.4074       
H51-C1=1.0848        H52-C8=1.0748        H53-C16=1.0802       H54-C18=1.0772       H55-C24=1.0816       H56-C27=1.0835       
H57-B72=1.1708       H58-C40=1.0768       H59-C44=1.0803       H60-B73=1.1709       H61-C2=1.0748        H62-C3=1.0835        
H63-C6=1.0838        H64-C7=1.0767        H65-C30=1.0800       H66-C38=1.0813       H67-C45=1.0819       H68-C47=1.0847       
H69-B71=1.1712       H70-B74=1.1709       B71-C6=1.5226        B71-C10=1.5446       B71-H69=1.1712       B72-C25=1.5536       
B72-C27=1.5274       B72-H57=1.1708       B73-C3=1.5244        B73-C4=1.5562        B73-H60=1.1709       B74-C31=1.5276       
B74-C37=1.5298       B74-H70=1.1709       
 B  H  Rav=1.1709 sigma=0.0001  Rmin=1.1708  Rmax=1.1712     4
 C  H  Rav=1.0803 sigma=0.0033  Rmin=1.0748  Rmax=1.0848    16
 C  B  Rav=1.5358 sigma=0.0127  Rmin=1.5226  Rmax=1.5562     8
 C  C  Rav=1.4103 sigma=0.0229  Rmin=1.3466  Rmax=1.4403    63
 
 selected bond angles (degree)
 --------------------
C5-C1-C3=122.62                H51-C1-C3=121.80               H51-C1-C5=115.59               C13-C2-C7=122.36               
H61-C2-C7=119.05               H61-C2-C13=118.59              H62-C3-C1=117.81               B73-C3-C1=119.58               
B73-C3-H62=122.61              C19-C4-C13=117.85              B73-C4-C13=123.10              B73-C4-C19=119.06              
C19-C5-C1=122.66               C24-C5-C1=118.47               C24-C5-C19=118.87              H63-C6-C30=116.83              
B71-C6-C30=120.10              B71-C6-H63=123.06              C35-C7-C2=122.14               H64-C7-C2=117.74               
H64-C7-C35=120.12              C40-C8-C34=121.79              H52-C8-C34=119.06              H52-C8-C40=119.16              
C35-C9-C30=120.80              C36-C9-C30=119.88              C36-C9-C35=119.31              C38-C10-C36=118.36             
B71-C10-C36=121.13             B71-C10-C38=120.50             
 
 selected dihedral angles (degree)
 ---------------------------------
H62-C3-C1-C5=180.00           H62-C3-C1-H51=  0.00          B73-C3-C1-C5=  0.00           B73-C3-C1-H51=180.00          
C19-C5-C1-C3=  0.00           C19-C5-C1-H51=180.00          C24-C5-C1-C3=180.00           C24-C5-C1-H51=  0.00          
C35-C7-C2-C13=  0.00          C35-C7-C2-H61=180.00          H64-C7-C2-C13=180.00          H64-C7-C2-H61=  0.00          
           -------------------------------------------------
          |                Final Singlepoint                |
           -------------------------------------------------

          ...................................................
          :                      SETUP                      :
          :.................................................:
          :  # basis functions                 236          :
          :  # atomic orbitals                 236          :
          :  # shells                          128          :
          :  # electrons                       232          :
          :  max. iterations                   250          :
          :  Hamiltonian                  GFN2-xTB          :
          :  restarted?                      false          :
          :  GBSA solvation                  false          :
          :  PC potential                    false          :
          :  electronic temp.          300.0000000     K    :
          :  accuracy                    1.0000000          :
          :  -> integral cutoff          0.2500000E+02      :
          :  -> integral neglect         0.1000000E-07      :
          :  -> SCF convergence          0.1000000E-05 Eh   :
          :  -> wf. convergence          0.1000000E-03 e    :
          :  Broyden damping             0.4000000          :
          :  net charge                          0          :
          :  unpaired electrons                  0          :
          ...................................................

 iter      E             dE          RMSdq      gap      omega  full diag
   1   -124.7509996 -0.124751E+03  0.549E-05    0.80       0.0  T
   2   -124.7509996  0.162956E-09  0.633E-05    0.80     183.5  T
   3   -124.7509996 -0.381405E-09  0.162E-05    0.80     718.2  T

   *** convergence criteria satisfied after 3 iterations ***

         #    Occupation            Energy/Eh            Energy/eV
      -------------------------------------------------------------
         1        2.0000           -0.6671065             -18.1529
       ...           ...                  ...                  ...
       110        2.0000           -0.3857488             -10.4968
       111        2.0000           -0.3844983             -10.4627
       112        2.0000           -0.3842115             -10.4549
       113        2.0000           -0.3816971             -10.3865
       114        2.0000           -0.3770378             -10.2597
       115        2.0000           -0.3746357             -10.1944
       116        2.0000           -0.3609110              -9.8209 (HOMO)
       117        0.0000           -0.3316695              -9.0252 (LUMO)
       118                         -0.3012364              -8.1971
       119                         -0.2883012              -7.8451
       120                         -0.2797490              -7.6124
       121                         -0.2637060              -7.1758
       ...                                ...                  ...
       236                          0.7616938              20.7267
      -------------------------------------------------------------
                  HL-Gap            0.0292415 Eh            0.7957 eV
             Fermi-level           -0.3462902 Eh           -9.4230 eV

 SCC (total)                   0 d,  0 h,  0 min,  0.107 sec
 SCC setup                      ...        0 min,  0.000 sec (  0.000%)
 Dispersion                     ...        0 min,  0.001 sec (  0.935%)
 classical contributions        ...        0 min,  0.001 sec (  0.935%)
 integral evaluation            ...        0 min,  0.013 sec ( 12.150%)
 iterations                     ...        0 min,  0.042 sec ( 39.252%)
 molecular gradient             ...        0 min,  0.048 sec ( 44.860%)
 printout                       ...        0 min,  0.002 sec (  1.869%)

         :::::::::::::::::::::::::::::::::::::::::::::::::::::
         ::                     SUMMARY                     ::
         :::::::::::::::::::::::::::::::::::::::::::::::::::::
         :: total energy            -122.407385744900 Eh    ::
         :: gradient norm              0.000608092546 Eh/a0 ::
         :: HOMO-LUMO gap              0.795701522554 eV    ::
         ::.................................................::
         :: SCC energy              -124.753058495274 Eh    ::
         :: -> isotropic ES            0.080180559124 Eh    ::
         :: -> anisotropic ES          0.016020331674 Eh    ::
         :: -> anisotropic XC          0.050494310217 Eh    ::
         :: -> dispersion             -0.135372510186 Eh    ::
         :: repulsion energy           2.345672750374 Eh    ::
         :: add. restraining           0.000000000000 Eh    ::
         :: total charge               0.000000000000 e     ::
         :::::::::::::::::::::::::::::::::::::::::::::::::::::

           -------------------------------------------------
          |                Property Printout                |
           -------------------------------------------------

    * Orbital Energies and Occupations

         #    Occupation            Energy/Eh            Energy/eV
      -------------------------------------------------------------
         1        2.0000           -0.6671065             -18.1529
       ...           ...                  ...                  ...
       104        2.0000           -0.3996353             -10.8746
       105        2.0000           -0.3978173             -10.8252
       106        2.0000           -0.3973815             -10.8133
       107        2.0000           -0.3959508             -10.7744
       108        2.0000           -0.3920031             -10.6669
       109        2.0000           -0.3918660             -10.6632
       110        2.0000           -0.3857488             -10.4968
       111        2.0000           -0.3844983             -10.4627
       112        2.0000           -0.3842115             -10.4549
       113        2.0000           -0.3816971             -10.3865
       114        2.0000           -0.3770378             -10.2597
       115        2.0000           -0.3746357             -10.1944
       116        2.0000           -0.3609110              -9.8209 (HOMO)
       117        0.0000           -0.3316695              -9.0252 (LUMO)
       118                         -0.3012364              -8.1971
       119                         -0.2883012              -7.8451
       120                         -0.2797490              -7.6124
       121                         -0.2637060              -7.1758
       122                         -0.2495990              -6.7919
       123                         -0.2397680              -6.5244
       124                         -0.2341241              -6.3708
       125                         -0.2322370              -6.3195
       126                         -0.2271046              -6.1798
       127                         -0.2188052              -5.9540
       ...                                ...                  ...
       236                          0.7616938              20.7267
      -------------------------------------------------------------
                  HL-Gap            0.0292415 Eh            0.7957 eV
             Fermi-level           -0.3462902 Eh           -9.4230 eV

     #   Z          covCN         q      C6AA      α(0)
     1   6 C        2.909    -0.024    28.598     8.769
     2   6 C        2.917    -0.038    28.955     8.824
     3   6 C        2.819    -0.113    30.848     9.100
     4   6 C        2.888    -0.070    29.753     8.943
     5   6 C        2.974     0.005    27.910     8.666
     6   6 C        2.817    -0.109    30.731     9.083
     7   6 C        2.914    -0.035    28.859     8.809
     8   6 C        2.919    -0.039    28.973     8.827
     9   6 C        2.971     0.005    27.914     8.666
    10   6 C        2.886    -0.068    29.686     8.933
    11   6 C        2.981     0.004    27.921     8.668
    12   6 C        2.981     0.008    27.828     8.653
    13   6 C        2.979     0.018    27.599     8.617
    14   6 C        2.988     0.000    28.009     8.681
    15   6 C        2.985     0.000    28.020     8.683
    16   6 C        2.923    -0.021    28.533     8.760
    17   6 C        2.979     0.009    27.819     8.652
    18   6 C        2.925    -0.027    28.687     8.783
    19   6 C        2.985     0.005    27.909     8.666
    20   6 C        2.973     0.008    27.847     8.656
    21   6 C        2.985     0.002    27.979     8.677
    22   6 C        2.984     0.003    27.953     8.673
    23   6 C        2.985    -0.000    28.024     8.684
    24   6 C        2.929    -0.026    28.655     8.779
    25   6 C        2.888    -0.071    29.778     8.946
    26   6 C        2.979     0.006    27.886     8.662
    27   6 C        2.819    -0.111    30.787     9.091
    28   6 C        2.981     0.002    27.972     8.676
    29   6 C        2.988     0.000    28.019     8.683
    30   6 C        2.903    -0.024    28.593     8.768
    31   6 C        2.889    -0.073    29.816     8.952
    32   6 C        2.974    -0.002    28.070     8.691
    33   6 C        2.986    -0.001    28.034     8.685
    34   6 C        2.981     0.015    27.680     8.630
    35   6 C        2.979     0.012    27.741     8.640
    36   6 C        2.985     0.004    27.935     8.670
    37   6 C        2.891    -0.070    29.751     8.943
    38   6 C        2.924    -0.024    28.611     8.772
    39   6 C        2.979     0.007    27.863     8.659
    40   6 C        2.917    -0.036    28.886     8.813
    41   6 C        2.986     0.001    28.000     8.680
    42   6 C        2.986    -0.001    28.042     8.687
    43   6 C        2.994     0.004    27.920     8.668
    44   6 C        2.910    -0.031    28.770     8.795
    45   6 C        2.930    -0.031    28.770     8.796
    46   6 C        2.982    -0.000    28.029     8.684
    47   6 C        2.909    -0.024    28.606     8.770
    48   6 C        2.983     0.002    27.964     8.674
    49   6 C        2.987     0.004    27.917     8.667
    50   6 C        2.983     0.004    27.928     8.669
    51   1 H        0.925     0.024     2.675     2.558
    52   1 H        0.926     0.049     2.337     2.391
    53   1 H        0.926     0.036     2.498     2.472
    54   1 H        0.926     0.037     2.495     2.470
    55   1 H        0.925     0.035     2.512     2.479
    56   1 H        0.925     0.020     2.740     2.588
    57   1 H        0.939    -0.109     5.867     3.787
    58   1 H        0.926     0.037     2.493     2.469
    59   1 H        0.926     0.031     2.577     2.511
    60   1 H        0.939    -0.110     5.928     3.807
    61   1 H        0.926     0.050     2.319     2.381
    62   1 H        0.925     0.018     2.770     2.603
    63   1 H        0.925     0.020     2.730     2.584
    64   1 H        0.926     0.039     2.457     2.451
    65   1 H        0.926     0.030     2.580     2.512
    66   1 H        0.925     0.038     2.475     2.460
    67   1 H        0.925     0.038     2.482     2.464
    68   1 H        0.925     0.024     2.669     2.555
    69   1 H        0.939    -0.104     5.702     3.733
    70   1 H        0.939    -0.105     5.722     3.740
    71   5 B        2.756     0.209    18.190     7.136
    72   5 B        2.755     0.212    18.156     7.130
    73   5 B        2.755     0.211    18.170     7.133
    74   5 B        2.758     0.211    18.166     7.131

 Mol. C6AA /au·bohr⁶  :     101759.454848
 Mol. C8AA /au·bohr⁸  :    2770964.519755
 Mol. α(0) /au        :        521.166413


Wiberg/Mayer (AO) data.
largest (>0.10) Wiberg bond orders for each atom

 ---------------------------------------------------------------------------
     #   Z sym  total        # sym  WBO       # sym  WBO       # sym  WBO
 ---------------------------------------------------------------------------
     1   6 C    3.973 --     3 C    1.720     5 C    1.154    51 H    0.964
     2   6 C    3.953 --     7 C    1.633    13 C    1.211    61 H    0.958
     3   6 C    3.932 --     1 C    1.720    73 B    1.111    62 H    0.973
     4   6 C    3.861 --    13 C    1.337    19 C    1.278    73 B    1.046
     5   6 C    3.937 --    24 C    1.398    19 C    1.233     1 C    1.154
     6   6 C    3.905 --    30 C    1.710    71 B    1.106    63 H    0.973
     7   6 C    3.973 --     2 C    1.633    35 C    1.218    64 H    0.955
     8   6 C    3.956 --    40 C    1.588    34 C    1.247    52 H    0.959
     9   6 C    3.916 --    35 C    1.303    36 C    1.254    30 C    1.169
    10   6 C    3.917 --    38 C    1.486    36 C    1.229    71 B    1.044
    11   6 C    3.974 --    39 C    1.279    37 C    1.267    32 C    1.207
    12   6 C    3.962 --    33 C    1.305    40 C    1.259    39 C    1.184
    13   6 C    3.973 --     4 C    1.337    41 C    1.222     2 C    1.211
    14   6 C    3.972 --    41 C    1.266    42 C    1.253    35 C    1.229
    15   6 C    3.974 --    36 C    1.259    42 C    1.247    43 C    1.246
    16   6 C    3.966 --    37 C    1.438    44 C    1.377    53 H    0.969
    17   6 C    3.956 --    38 C    1.284    45 C    1.265    43 C    1.250
    18   6 C    3.976 --    44 C    1.502    39 C    1.311    54 H    0.959
                            37 C    0.100
    19   6 C    3.980 --     4 C    1.278    46 C    1.239     5 C    1.233
    20   6 C    3.961 --    45 C    1.486    50 C    1.176    47 C    1.146
    21   6 C    3.980 --    41 C    1.256    46 C    1.256    48 C    1.235
    22   6 C    3.959 --    48 C    1.287    42 C    1.243    49 C    1.211
    23   6 C    3.970 --    49 C    1.270    43 C    1.239    50 C    1.239
    24   6 C    3.976 --     5 C    1.398    31 C    1.377    55 H    0.965
    25   6 C    3.878 --    50 C    1.338    34 C    1.280    72 B    1.054
    26   6 C    3.978 --    31 C    1.292    46 C    1.254    32 C    1.195
    27   6 C    3.935 --    47 C    1.733    72 B    1.102    56 H    0.972
    28   6 C    3.979 --    32 C    1.325    48 C    1.217    33 C    1.206
    29   6 C    3.974 --    49 C    1.262    34 C    1.243    33 C    1.242
    30   6 C    3.978 --     6 C    1.710     9 C    1.169    65 H    0.955
    31   6 C    3.901 --    24 C    1.377    26 C    1.292    74 B    1.074
    32   6 C    3.952 --    28 C    1.325    11 C    1.207    26 C    1.195
    33   6 C    3.983 --    12 C    1.305    29 C    1.242    28 C    1.206
    34   6 C    3.970 --    25 C    1.280     8 C    1.247    29 C    1.243
    35   6 C    3.973 --     9 C    1.303    14 C    1.229     7 C    1.218
    36   6 C    3.962 --    15 C    1.259     9 C    1.254    10 C    1.229
    37   6 C    3.949 --    16 C    1.438    11 C    1.267    74 B    1.065
                            18 C    0.100
    38   6 C    3.950 --    10 C    1.486    17 C    1.284    66 H    0.966
    39   6 C    3.967 --    18 C    1.311    11 C    1.279    12 C    1.184
    40   6 C    3.975 --     8 C    1.588    12 C    1.259    58 H    0.958
    41   6 C    3.966 --    14 C    1.266    21 C    1.256    13 C    1.222
    42   6 C    3.979 --    14 C    1.253    15 C    1.247    22 C    1.243
    43   6 C    3.982 --    17 C    1.250    15 C    1.246    23 C    1.239
    44   6 C    3.974 --    18 C    1.502    16 C    1.377    59 H    0.970
    45   6 C    3.972 --    20 C    1.486    17 C    1.265    67 H    0.964
    46   6 C    3.974 --    21 C    1.256    26 C    1.254    19 C    1.239
    47   6 C    3.975 --    27 C    1.733    20 C    1.146    68 H    0.964
    48   6 C    3.960 --    22 C    1.287    21 C    1.235    28 C    1.217
    49   6 C    3.982 --    23 C    1.270    29 C    1.262    22 C    1.211
    50   6 C    3.973 --    25 C    1.338    23 C    1.239    20 C    1.176
    51   1 H    0.999 --     1 C    0.964
    52   1 H    0.996 --     8 C    0.959
    53   1 H    0.998 --    16 C    0.969
    54   1 H    0.998 --    18 C    0.959
    55   1 H    0.998 --    24 C    0.965
    56   1 H    0.998 --    27 C    0.972
    57   1 H    0.988 --    72 B    0.963
    58   1 H    0.998 --    40 C    0.958
    59   1 H    0.998 --    44 C    0.970
    60   1 H    0.987 --    73 B    0.962
    61   1 H    0.996 --     2 C    0.958
    62   1 H    0.998 --     3 C    0.973
    63   1 H    0.998 --     6 C    0.973
    64   1 H    0.997 --     7 C    0.955
    65   1 H    0.998 --    30 C    0.955
    66   1 H    0.997 --    38 C    0.966
    67   1 H    0.997 --    45 C    0.964
    68   1 H    0.999 --    47 C    0.964
    69   1 H    0.989 --    71 B    0.971
    70   1 H    0.988 --    74 B    0.970
    71   5 B    3.329 --     6 C    1.106    10 C    1.044    69 H    0.971
    72   5 B    3.339 --    27 C    1.102    25 C    1.054    57 H    0.963
    73   5 B    3.336 --     3 C    1.111     4 C    1.046    60 H    0.962
    74   5 B    3.340 --    31 C    1.074    37 C    1.065    70 H    0.970
 ---------------------------------------------------------------------------

Topologies differ in total number of bonds
Writing topology from bond orders to xtbtopo.mol

molecular dipole:
                 x           y           z       tot (Debye)
 q only:       -0.035      -0.421      -0.000
   full:       -0.039      -0.517       0.000       1.318
molecular quadrupole (traceless):
                xx          xy          yy          xz          yz          zz
 q only:       -2.093       8.566       2.066      -0.002      -0.002       0.028
  q+dip:       11.847       8.490      12.124      -0.003      -0.004     -23.972
   full:       -1.518       8.018      -0.570      -0.003      -0.004       2.088

           -------------------------------------------------
          |                Geometry Summary                 |
           -------------------------------------------------

      molecular mass/u    :      663.9397222
   center of mass at/Å    :        0.0000280       0.0027302       0.0000012
  moments of inertia/u·Å² :        0.6984581E+04   0.9115611E+04   0.1610019E+05
rotational constants/cm⁻¹ :        0.2413550E-02   0.1849315E-02   0.1047045E-02

 * 85 selected distances

     #   Z          #   Z                                           value/Å
     1   6 C        3   6 C                                       1.3478899
     2   6 C        7   6 C                                       1.3504194
     2   6 C       13   6 C                                       1.4209488
     4   6 C       13   6 C                                       1.4062619
     4   6 C       19   6 C                                       1.4185065
     5   6 C       19   6 C                                       1.4216719
     5   6 C       24   6 C                                       1.3834432
     6   6 C       30   6 C                                       1.3524738
    24   6 C       31   6 C                                       1.3916336
    26   6 C       31   6 C                                       1.4144458
    28   6 C       32   6 C                                       1.4092301
    12   6 C       33   6 C                                       1.4075961
    28   6 C       33   6 C                                       1.4299962
    29   6 C       33   6 C                                       1.4225718
     8   6 C       34   6 C                                       1.4134118
    25   6 C       34   6 C                                       1.4187765
    29   6 C       34   6 C                                       1.4224837
     7   6 C       35   6 C                                       1.4218657
     9   6 C       35   6 C                                       1.4120208
    14   6 C       35   6 C                                       1.4259703
     9   6 C       36   6 C                                       1.4196334
    10   6 C       36   6 C                                       1.4284534
    15   6 C       36   6 C                                       1.4190809
    11   6 C       37   6 C                                       1.4222991
    16   6 C       37   6 C                                       1.3872242
    10   6 C       38   6 C                                       1.3773005
    17   6 C       38   6 C                                       1.4029145
    11   6 C       39   6 C                                       1.4165396
    12   6 C       39   6 C                                       1.4313515
    18   6 C       39   6 C                                       1.4077990
     8   6 C       40   6 C                                       1.3558852
    12   6 C       40   6 C                                       1.4124658
    13   6 C       41   6 C                                       1.4250612
    14   6 C       41   6 C                                       1.4170537
    21   6 C       41   6 C                                       1.4170843
    14   6 C       42   6 C                                       1.4150551
    15   6 C       42   6 C                                       1.4169453
    22   6 C       42   6 C                                       1.4197630
    15   6 C       43   6 C                                       1.4167007
    17   6 C       43   6 C                                       1.4128035
    23   6 C       43   6 C                                       1.4178968
    16   6 C       44   6 C                                       1.3878829
    18   6 C       44   6 C                                       1.3708458
    17   6 C       45   6 C                                       1.4056351
    20   6 C       45   6 C                                       1.3724905
    19   6 C       46   6 C                                       1.4268377
    21   6 C       46   6 C                                       1.4168484
    26   6 C       46   6 C                                       1.4219715
    27   6 C       47   6 C                                       1.3465505
    21   6 C       48   6 C                                       1.4211022
    22   6 C       48   6 C                                       1.4122818
    28   6 C       48   6 C                                       1.4276546
    22   6 C       49   6 C                                       1.4257158
    23   6 C       49   6 C                                       1.4127592
    29   6 C       49   6 C                                       1.4124948
    23   6 C       50   6 C                                       1.4241642
    25   6 C       50   6 C                                       1.4073637
     1   6 C       51   1 H                                       1.0848204
     8   6 C       52   1 H                                       1.0747545 (min)
    16   6 C       53   1 H                                       1.0801718
    18   6 C       54   1 H                                       1.0771947
    24   6 C       55   1 H                                       1.0815773
    27   6 C       56   1 H                                       1.0834714
    40   6 C       58   1 H                                       1.0767951
    44   6 C       59   1 H                                       1.0802527
     2   6 C       61   1 H                                       1.0747573
     3   6 C       62   1 H                                       1.0834718
     6   6 C       63   1 H                                       1.0837571
     7   6 C       64   1 H                                       1.0766901
    30   6 C       65   1 H                                       1.0799901
    38   6 C       66   1 H                                       1.0812584
    45   6 C       67   1 H                                       1.0819003
    47   6 C       68   1 H                                       1.0847324
     6   6 C       71   5 B                                       1.5226374
    10   6 C       71   5 B                                       1.5445822
    69   1 H       71   5 B                                       1.1711561
    25   6 C       72   5 B                                       1.5536084
    27   6 C       72   5 B                                       1.5274469
    57   1 H       72   5 B                                       1.1707744
     3   6 C       73   5 B                                       1.5244071
     4   6 C       73   5 B                                       1.5562353 (max)
    60   1 H       73   5 B                                       1.1709116
    31   6 C       74   5 B                                       1.5276405
    37   6 C       74   5 B                                       1.5298244
    70   1 H       74   5 B                                       1.1709036

 * 4 distinct bonds (by element types)

   Z      Z             #   av. dist./Å        max./Å        min./Å
   1 H    5 B           4     1.1709364     1.1711561     1.1707744
   1 H    6 C          16     1.0803497     1.0848204     1.0747545
   5 B    6 C           8     1.5357978     1.5562353     1.5226374
   6 C    6 C          57     1.4074303     1.4313515     1.3465505


optimized geometry written to: xtbopt.xyz


           -------------------------------------------------
          | TOTAL ENERGY             -122.407385744900 Eh   |
          | GRADIENT NORM               0.000608092546 Eh/α |
          | HOMO-LUMO GAP               0.795701522554 eV   |
           -------------------------------------------------

------------------------------------------------------------------------
 * finished run on 2025/12/08 at 00:34:32.465     
------------------------------------------------------------------------
 total:
 * wall-time:     0 d,  0 h,  0 min,  1.340 sec
 *  cpu-time:     0 d,  0 h,  0 min,  5.266 sec
 * ratio c/w:     3.930 speedup
 SCF:
 * wall-time:     0 d,  0 h,  0 min,  0.302 sec
 *  cpu-time:     0 d,  0 h,  0 min,  1.172 sec
 * ratio c/w:     3.880 speedup
 ANC optimizer:
 * wall-time:     0 d,  0 h,  0 min,  0.973 sec
 *  cpu-time:     0 d,  0 h,  0 min,  3.906 sec
 * ratio c/w:     4.015 speedup

normal termination of xtb
