      -----------------------------------------------------------      
     |                   =====================                   |     
     |                           x T B                           |     
     |                   =====================                   |     
     |                         S. Grimme                         |     
     |          Mulliken Center for Theoretical Chemistry        |     
     |                    University of Bonn                     |     
      -----------------------------------------------------------      

   * xtb version 6.7.1pre (5071a88) compiled by 'Marcel@Raven' on 2024-07-23

   xtb is free software: you can redistribute it and/or modify it under
   the terms of the GNU Lesser General Public License as published by
   the Free Software Foundation, either version 3 of the License, or
   (at your option) any later version.
   
   xtb is distributed in the hope that it will be useful,
   but WITHOUT ANY WARRANTY; without even the implied warranty of
   MERCHANTABILITY or FITNESS FOR A PARTICULAR PURPOSE.  See the
   GNU Lesser General Public License for more details.
   
   Cite this work as:
   * C. Bannwarth, E. Caldeweyher, S. Ehlert, A. Hansen, P. Pracht,
     J. Seibert, S. Spicher, S. Grimme, WIREs Comput. Mol. Sci., 2020, 11,
     e01493. DOI: 10.1002/wcms.1493
   
   for GFN2-xTB:
   * C. Bannwarth, S. Ehlert and S. Grimme., J. Chem. Theory Comput., 2019,
     15, 1652-1671. DOI: 10.1021/acs.jctc.8b01176
   for GFN1-xTB:
   * S. Grimme, C. Bannwarth, P. Shushkov, J. Chem. Theory Comput., 2017,
     13, 1989-2009. DOI: 10.1021/acs.jctc.7b00118
   for GFN0-xTB:
   * P. Pracht, E. Caldeweyher, S. Ehlert, S. Grimme, ChemRxiv, 2019, preprint.
     DOI: 10.26434/chemrxiv.8326202.v1
   for GFN-FF:
   * S. Spicher and S. Grimme, Angew. Chem. Int. Ed., 2020, 59, 15665-15673.
     DOI: 10.1002/anie.202004239
   
   for ALPB and GBSA implicit solvation:
   * S. Ehlert, M. Stahn, S. Spicher, S. Grimme, J. Chem. Theory Comput.,
     2021, 17, 4250-4261. DOI: 10.1021/acs.jctc.1c00471
   
   for ddCOSMO and CPCM-X implicit solvation:
   * M. Stahn, S. Ehlert, S. Grimme, J. Phys. Chem. A,
     2023, XX, XXXX-XXXX. DOI: 10.1021/acs.jpca.3c04382
   
   for DFT-D4:
   * E. Caldeweyher, C. Bannwarth and S. Grimme, J. Chem. Phys., 2017,
     147, 034112. DOI: 10.1063/1.4993215
   * E. Caldeweyher, S. Ehlert, A. Hansen, H. Neugebauer, S. Spicher,
     C. Bannwarth and S. Grimme, J. Chem. Phys., 2019, 150, 154122.
     DOI: 10.1063/1.5090222
   * E. Caldeweyher, J.-M. Mewes, S. Ehlert and S. Grimme, Phys. Chem. Chem. Phys.
     2020, 22, 8499-8512. DOI: 10.1039/D0CP00502A
   
   for sTDA-xTB:
   * S. Grimme and C. Bannwarth, J. Chem. Phys., 2016, 145, 054103.
     DOI: 10.1063/1.4959605
   
   in the mass-spec context:
   * V. Asgeirsson, C. Bauer and S. Grimme, Chem. Sci., 2017, 8, 4879.
     DOI: 10.1039/c7sc00601b
   * J. Koopman and S. Grimme, ACS Omega 2019, 4, 12, 15120-15133.
     DOI: 10.1021/acsomega.9b02011
   
   for metadynamics refer to:
   * S. Grimme, J. Chem. Theory Comput., 2019, 155, 2847-2862
     DOI: 10.1021/acs.jctc.9b00143
   
   for SPH calculations refer to:
   * S. Spicher and S. Grimme, J. Chem. Theory Comput., 2021, 17, 1701-1714
     DOI: 10.1021/acs.jctc.0c01306
   
   for ONIOM refer to:
   * C. Plett, A. Katbashev, S. Ehlert, S. Grimme, M. Bursch,
     Phys. Chem. Chem. Phys., 2023, 25, 17860-17868. DOI: 10.1039/D3CP02178E
   
   for DIPRO refer to:
   * J. Kohn, N. Gildemeister, S. Grimme, D. Fazzi, A. Hansen,
     J. Chem. Phys., 2023, just accepted.
   
   for PTB refer to:
   * S. Grimme, M. Mueller, A. Hansen, J. Chem. Phys., 2023, 158, 124111.
     DOI: 10.1063/5.0137838
   
   with help from (in alphabetical order)
   P. Atkinson, C. Bannwarth, F. Bohle, G. Brandenburg, E. Caldeweyher
   M. Checinski, S. Dohm, S. Ehlert, S. Ehrlich, I. Gerasimov, C. Hölzer
   A. Katbashev, J. Kohn, J. Koopman, C. Lavigne, S. Lehtola, F. März, M. Müller,
   F. Musil, H. Neugebauer, J. Pisarek, C. Plett, P. Pracht, F. Pultar,
   J. Seibert, P. Shushkov, S. Spicher, M. Stahn, M. Steiner, T. Strunk,
   J. Stückrath, T. Rose, and J. Unsleber
   
 * started run on 2025/12/08 at 00:35:06.511     
   ID    Z sym.   atoms
    1    6 C      1-53
    2    1 H      54-72
    3   15 P      73

           -------------------------------------------------
          |                Calculation Setup                |
           -------------------------------------------------

          program call               : xtb "C:\Users\LENOVO GAMING\Documents\GitHub\molecular-conductivity-sim\dataset\1nm-Pdoped-1.5percent.xyz" --opt --parallel 4
          coordinate file            : C:\Users\LENOVO GAMING\Documents\GitHub\molecular-conductivity-sim\dataset\1nm-Pdoped-1.5percent.xyz
          omp threads                :                     4


           -------------------------------------------------
          |                 G F N 2 - x T B                 |
           -------------------------------------------------

        Reference                      10.1021/acs.jctc.8b01176
      * Hamiltonian:
        H0-scaling (s, p, d)           1.850000    2.230000    2.230000
        zeta-weighting                 0.500000
      * Dispersion:
        s8                             2.700000
        a1                             0.520000
        a2                             5.000000
        s9                             5.000000
      * Repulsion:
        kExp                           1.500000    1.000000
        rExp                           1.000000
      * Coulomb:
        alpha                          2.000000
        third order                    shell-resolved
        anisotropic                    true
        a3                             3.000000
        a5                             4.000000
        cn-shift                       1.200000
        cn-exp                         4.000000
        max-rad                        5.000000


          ...................................................
          :                      SETUP                      :
          :.................................................:
          :  # basis functions                 241          :
          :  # atomic orbitals                 240          :
          :  # shells                          128          :
          :  # electrons                       236          :
          :  max. iterations                   250          :
          :  Hamiltonian                  GFN2-xTB          :
          :  restarted?                      false          :
          :  GBSA solvation                  false          :
          :  PC potential                    false          :
          :  electronic temp.          300.0000000     K    :
          :  accuracy                    1.0000000          :
          :  -> integral cutoff          0.2500000E+02      :
          :  -> integral neglect         0.1000000E-07      :
          :  -> SCF convergence          0.1000000E-05 Eh   :
          :  -> wf. convergence          0.1000000E-03 e    :
          :  Broyden damping             0.4000000          :
          :  net charge                          0          :
          :  unpaired electrons                  0          :
          ...................................................

 iter      E             dE          RMSdq      gap      omega  full diag
   1   -128.1235433 -0.128124E+03  0.511E+00    0.19       0.0  T
   2   -127.8851476  0.238396E+00  0.386E+00    1.49       1.0  T
   3   -127.7036042  0.181543E+00  0.301E+00    1.20       1.0  T
   4   -128.0656811 -0.362077E+00  0.129E+00    0.30       1.0  T
   5   -128.0578484  0.783272E-02  0.173E+00    0.68       1.0  T
   6   -128.1129876 -0.551392E-01  0.139E+00    0.32       1.0  T
   7   -128.1545614 -0.415737E-01  0.113E+00    0.23       1.0  T
   8   -128.2130955 -0.585341E-01  0.636E-01    0.15       1.0  T
   9   -128.2324163 -0.193208E-01  0.318E-01    0.14       1.0  T
  10   -128.2384524 -0.603614E-02  0.821E-02    0.14       1.0  T
  11   -128.2372057  0.124667E-02  0.165E-01    0.14       1.0  T
  12   -128.2388951 -0.168936E-02  0.414E-02    0.14       1.0  T
  13   -128.2389335 -0.383858E-04  0.329E-02    0.14       1.0  T
  14   -128.2389932 -0.597165E-04  0.130E-02    0.14       1.0  T
  15   -128.2389922  0.101962E-05  0.137E-02    0.14       1.0  T
  16   -128.2390028 -0.106337E-04  0.529E-03    0.14       2.2  T
  17   -128.2390046 -0.182655E-05  0.512E-04    0.14      22.8  T
  18   -128.2390047 -0.125854E-07  0.264E-04    0.14      44.3  T
  19   -128.2390047 -0.369988E-08  0.118E-04    0.14      99.3  T

   *** convergence criteria satisfied after 19 iterations ***

         #    Occupation            Energy/Eh            Energy/eV
      -------------------------------------------------------------
         1        2.0000           -0.6657976             -18.1173
       ...           ...                  ...                  ...
       112        2.0000           -0.3916712             -10.6579
       113        2.0000           -0.3904856             -10.6257
       114        2.0000           -0.3884499             -10.5703
       115        2.0000           -0.3865392             -10.5183
       116        2.0000           -0.3727800             -10.1439
       117        2.0000           -0.3582497              -9.7485
       118        1.8653           -0.3268705              -8.8946 (HOMO)
       119        0.1347           -0.3218774              -8.7587 (LUMO)
       120                         -0.2892262              -7.8702
       121                         -0.2723000              -7.4097
       122                         -0.2551436              -6.9428
       123                         -0.2495272              -6.7900
       ...                                ...                  ...
       240                          0.9146378              24.8886
      -------------------------------------------------------------
                  HL-Gap            0.0049931 Eh            0.1359 eV
             Fermi-level           -0.3243740 Eh           -8.8267 eV

 SCC (total)                   0 d,  0 h,  0 min,  0.348 sec
 SCC setup                      ...        0 min,  0.002 sec (  0.575%)
 Dispersion                     ...        0 min,  0.002 sec (  0.575%)
 classical contributions        ...        0 min,  0.000 sec (  0.000%)
 integral evaluation            ...        0 min,  0.017 sec (  4.885%)
 iterations                     ...        0 min,  0.275 sec ( 79.023%)
 molecular gradient             ...        0 min,  0.050 sec ( 14.368%)
 printout                       ...        0 min,  0.002 sec (  0.575%)

         :::::::::::::::::::::::::::::::::::::::::::::::::::::
         ::                     SUMMARY                     ::
         :::::::::::::::::::::::::::::::::::::::::::::::::::::
         :: total energy            -125.947263118845 Eh    ::
         :: gradient norm              0.036890221470 Eh/a0 ::
         :: HOMO-LUMO gap              0.135869146705 eV    ::
         ::.................................................::
         :: SCC energy              -128.241112399086 Eh    ::
         :: -> isotropic ES            0.002008143837 Eh    ::
         :: -> anisotropic ES          0.007983591366 Eh    ::
         :: -> anisotropic XC          0.058619684754 Eh    ::
         :: -> dispersion             -0.138259686403 Eh    ::
         :: repulsion energy           2.293849280242 Eh    ::
         :: add. restraining           0.000000000000 Eh    ::
         :: total charge              -0.000000000000 e     ::
         :::::::::::::::::::::::::::::::::::::::::::::::::::::

      ----------------------------------------------------------- 
     |                   =====================                   |
     |                        A N C O P T                        |
     |                   =====================                   |
     |               Approximate Normal Coordinate               |
     |                Rational Function Optimizer                |
      ----------------------------------------------------------- 
      ----------------------------------------------------------- 
     |                   =====================                   |
     |                        A N C O P T                        |
     |                   =====================                   |
     |               Approximate Normal Coordinate               |
     |                Rational Function Optimizer                |
      ----------------------------------------------------------- 

          ...................................................
          :                      SETUP                      :
          :.................................................:
          :   optimization level            normal          :
          :   max. optcycles                   219          :
          :   ANC micro-cycles                  20          :
          :   degrees of freedom               213          :
          :.................................................:
          :   RF solver                   davidson          :
          :   write xtbopt.log                true          :
          :   linear?                        false          :
          :   energy convergence         0.5000000E-05 Eh   :
          :   grad. convergence          0.1000000E-02 Eh/α :
          :   maxmium RF displ.          1.0000000          :
          :   Hlow (freq-cutoff)         0.1000000E-01      :
          :   Hmax (freq-cutoff)         5.0000000          :
          :   S6 in model hess.         20.0000000          :
          ...................................................

generating ANC from exact Hessian ...
Using Lindh-Hessian (1995)
 Shifting diagonal of input Hessian by   9.693881036942962E-003
 Lowest  eigenvalues of input Hessian
    0.000000    0.000000    0.000000    0.000000    0.000000    0.000000
    0.010000    0.010304    0.010672    0.010992    0.011302    0.012809
    0.013411    0.013961    0.014580    0.015981    0.016646    0.016983
 Highest eigenvalues
    2.005858    2.016849    2.041159    2.056157    2.081883    2.109442
 

........................................................................
.............................. CYCLE    1 ..............................
........................................................................

 iter      E             dE          RMSdq      gap      omega  full diag
   1   -128.2390047 -0.128239E+03  0.338E-05    0.14       0.0  T
   2   -128.2390046  0.200186E-07  0.537E-04    0.14      21.8  T
   3   -128.2390047 -0.200430E-07  0.260E-05    0.14     450.5  T
     SCC iter.                  ...        0 min,  0.048 sec
     gradient                   ...        0 min,  0.048 sec
 * total energy  :  -125.9472631 Eh     change       -0.8588188E-09 Eh
   gradient norm :     0.0368902 Eh/α   predicted     0.0000000E+00 (-100.00%)
   displ. norm   :     0.3944398 α      lambda       -0.1058741E-01
   maximum displ.:     0.2801871 α      in ANC's #33, #34, #31, ...

........................................................................
.............................. CYCLE    2 ..............................
........................................................................

 iter      E             dE          RMSdq      gap      omega  full diag
   1   -128.3406477 -0.128341E+03  0.133E-01    0.14       0.0  T
   2   -128.3083790  0.322687E-01  0.701E-01    0.16       1.0  T
   3   -128.3360652 -0.276862E-01  0.282E-01    0.14       1.0  T
   4   -128.3368315 -0.766368E-03  0.236E-01    0.14       1.0  T
   5   -128.3404992 -0.366765E-02  0.660E-02    0.14       1.0  T
   6   -128.3407889 -0.289689E-03  0.101E-02    0.14       1.2  T
   7   -128.3407907 -0.181814E-05  0.791E-03    0.14       1.5  T
   8   -128.3407933 -0.257681E-05  0.507E-03    0.14       2.3  T
   9   -128.3407936 -0.352925E-06  0.412E-03    0.14       2.8  T
  10   -128.3407948 -0.115666E-05  0.291E-04    0.14      40.2  T
  11   -128.3407947  0.135572E-07  0.513E-04    0.14      22.8  T
  12   -128.3407948 -0.111554E-07  0.318E-04    0.14      36.8  T
     SCC iter.                  ...        0 min,  0.178 sec
     gradient                   ...        0 min,  0.051 sec
 * total energy  :  -125.9546245 Eh     change       -0.7361399E-02 Eh
   gradient norm :     0.0130493 Eh/α   predicted    -0.6117358E-02 ( -16.90%)
   displ. norm   :     0.2821925 α      lambda       -0.2771809E-02
   maximum displ.:     0.2022343 α      in ANC's #33, #34, #31, ...

........................................................................
.............................. CYCLE    3 ..............................
........................................................................

 iter      E             dE          RMSdq      gap      omega  full diag
   1   -128.3995778 -0.128400E+03  0.885E-02    0.13       0.0  T
   2   -128.3748660  0.247118E-01  0.613E-01    0.15       1.0  T
   3   -128.3966677 -0.218017E-01  0.224E-01    0.14       1.0  T
   4   -128.3990735 -0.240575E-02  0.898E-02    0.13       1.0  T
   5   -128.3996494 -0.575958E-03  0.215E-02    0.13       1.0  T
   6   -128.3996775 -0.280309E-04  0.638E-03    0.13       1.8  T
   7   -128.3996760  0.142772E-05  0.751E-03    0.13       1.6  T
   8   -128.3996796 -0.354220E-05  0.187E-03    0.13       6.3  T
   9   -128.3996794  0.188056E-06  0.238E-03    0.13       4.9  T
  10   -128.3996797 -0.341865E-06  0.667E-04    0.13      17.6  T
  11   -128.3996797 -0.257210E-07  0.168E-04    0.13      69.8  T
     SCC iter.                  ...        0 min,  0.160 sec
     gradient                   ...        0 min,  0.051 sec
 * total energy  :  -125.9561207 Eh     change       -0.1496141E-02 Eh
   gradient norm :     0.0033095 Eh/α   predicted    -0.1496399E-02 (   0.02%)
   displ. norm   :     0.0472822 α      lambda       -0.5539684E-04
   maximum displ.:     0.0197375 α      in ANC's #33, #4, #31, ...

........................................................................
.............................. CYCLE    4 ..............................
........................................................................

 iter      E             dE          RMSdq      gap      omega  full diag
   1   -128.4031088 -0.128403E+03  0.152E-02    0.13       0.0  T
   2   -128.4018809  0.122793E-02  0.135E-01    0.13       1.0  T
   3   -128.4030929 -0.121200E-02  0.200E-02    0.13       1.0  T
   4   -128.4031089 -0.160500E-04  0.761E-03    0.13       1.5  T
   5   -128.4031103 -0.137663E-05  0.634E-03    0.13       1.8  T
   6   -128.4031131 -0.281475E-05  0.906E-04    0.13      12.9  T
   7   -128.4031131  0.411287E-07  0.117E-03    0.13      10.0  T
   8   -128.4031132 -0.916967E-07  0.907E-05    0.13     129.1  T
   9   -128.4031132 -0.472653E-09  0.345E-05    0.13     338.8  T
     SCC iter.                  ...        0 min,  0.139 sec
     gradient                   ...        0 min,  0.048 sec
 * total energy  :  -125.9561575 Eh     change       -0.3681405E-04 Eh
   gradient norm :     0.0014933 Eh/α   predicted    -0.2787409E-04 ( -24.28%)
   displ. norm   :     0.0762593 α      lambda       -0.2325957E-04
   maximum displ.:     0.0439601 α      in ANC's #4, #1, #6, ...

........................................................................
.............................. CYCLE    5 ..............................
........................................................................

 iter      E             dE          RMSdq      gap      omega  full diag
   1   -128.4036470 -0.128404E+03  0.201E-02    0.13       0.0  T
   2   -128.4028937  0.753272E-03  0.106E-01    0.13       1.0  T
   3   -128.4036424 -0.748703E-03  0.149E-02    0.13       1.0  T
   4   -128.4036476 -0.516353E-05  0.426E-03    0.13       2.7  T
   5   -128.4036488 -0.124068E-05  0.337E-03    0.13       3.5  T
   6   -128.4036496 -0.815428E-06  0.598E-04    0.13      19.6  T
   7   -128.4036496  0.338108E-07  0.891E-04    0.13      13.1  T
     SCC iter.                  ...        0 min,  0.109 sec
     gradient                   ...        0 min,  0.048 sec
 * total energy  :  -125.9561791 Eh     change       -0.2159162E-04 Eh
   gradient norm :     0.0013280 Eh/α   predicted    -0.1170658E-04 ( -45.78%)
   displ. norm   :     0.0843090 α      lambda       -0.1694772E-04
   maximum displ.:     0.0514518 α      in ANC's #4, #1, #6, ...

........................................................................
.............................. CYCLE    6 ..............................
........................................................................

 iter      E             dE          RMSdq      gap      omega  full diag
   1   -128.4027499 -0.128403E+03  0.198E-02    0.13       0.0  T
   2   -128.4027441  0.576113E-05  0.150E-02    0.13       1.0  T
   3   -128.4009900  0.175413E-02  0.160E-01    0.13       1.0  T
   4   -128.4027424 -0.175246E-02  0.101E-02    0.13       1.2  T
   5   -128.4027496 -0.719626E-05  0.202E-03    0.13       5.8  T
   6   -128.4027500 -0.308779E-06  0.441E-04    0.13      26.5  T
   7   -128.4027500 -0.119114E-07  0.138E-04    0.13      84.8  T
     SCC iter.                  ...        0 min,  0.098 sec
     gradient                   ...        0 min,  0.046 sec
 * total energy  :  -125.9562014 Eh     change       -0.2231022E-04 Eh
   gradient norm :     0.0017057 Eh/α   predicted    -0.8502046E-05 ( -61.89%)
   displ. norm   :     0.1891261 α      lambda       -0.3533510E-04
   maximum displ.:     0.1111145 α      in ANC's #4, #1, #6, ...

........................................................................
.............................. CYCLE    7 ..............................
........................................................................

 iter      E             dE          RMSdq      gap      omega  full diag
   1   -128.4017573 -0.128402E+03  0.437E-02    0.13       0.0  T
   2   -128.4010804  0.676892E-03  0.103E-01    0.13       1.0  T
   3   -128.4007577  0.322746E-03  0.123E-01    0.13       1.0  T
   4   -128.4017147 -0.957035E-03  0.246E-02    0.13       1.0  T
   5   -128.4017595 -0.448194E-04  0.219E-03    0.13       5.4  T
   6   -128.4017597 -0.177360E-06  0.172E-03    0.13       6.8  T
   7   -128.4017598 -0.126481E-06  0.939E-04    0.13      12.5  T
   8   -128.4017599 -0.592352E-07  0.147E-04    0.13      79.6  T
     SCC iter.                  ...        0 min,  0.118 sec
     gradient                   ...        0 min,  0.053 sec
 * total energy  :  -125.9562424 Eh     change       -0.4107040E-04 Eh
   gradient norm :     0.0016901 Eh/α   predicted    -0.1795754E-04 ( -56.28%)
   displ. norm   :     0.1867546 α      lambda       -0.2359000E-04
   maximum displ.:     0.1136056 α      in ANC's #4, #1, #6, ...

........................................................................
.............................. CYCLE    8 ..............................
........................................................................

 iter      E             dE          RMSdq      gap      omega  full diag
   1   -128.4017752 -0.128402E+03  0.404E-02    0.13       0.0  T
   2   -128.4014234  0.351727E-03  0.757E-02    0.13       1.0  T
   3   -128.4002423  0.118111E-02  0.151E-01    0.13       1.0  T
   4   -128.4017230 -0.148071E-02  0.267E-02    0.13       1.0  T
   5   -128.4017762 -0.531277E-04  0.249E-03    0.13       4.7  T
   6   -128.4017764 -0.219711E-06  0.196E-03    0.13       6.0  T
   7   -128.4017766 -0.196146E-06  0.880E-04    0.13      13.3  T
   8   -128.4017766 -0.506611E-07  0.102E-04    0.13     114.5  T
     SCC iter.                  ...        0 min,  0.118 sec
     gradient                   ...        0 min,  0.044 sec
 * total energy  :  -125.9562672 Eh     change       -0.2477631E-04 Eh
   gradient norm :     0.0011692 Eh/α   predicted    -0.1197802E-04 ( -51.66%)
   displ. norm   :     0.0947761 α      lambda       -0.9906955E-05
   maximum displ.:     0.0612675 α      in ANC's #4, #1, #2, ...

........................................................................
.............................. CYCLE    9 ..............................
........................................................................

 iter      E             dE          RMSdq      gap      omega  full diag
   1   -128.4023489 -0.128402E+03  0.177E-02    0.13       0.0  T
   2   -128.4022551  0.937520E-04  0.384E-02    0.13       1.0  T
   3   -128.4020774  0.177735E-03  0.637E-02    0.13       1.0  T
   4   -128.4023325 -0.255066E-03  0.150E-02    0.13       1.0  T
   5   -128.4023493 -0.167890E-04  0.524E-04    0.13      22.4  T
   6   -128.4023492  0.693900E-07  0.118E-03    0.13      10.0  T
   7   -128.4023492 -0.594090E-07  0.692E-04    0.13      16.9  T
   8   -128.4023493 -0.290700E-07  0.162E-04    0.13      72.4  T
     SCC iter.                  ...        0 min,  0.115 sec
     gradient                   ...        0 min,  0.052 sec
 * total energy  :  -125.9562791 Eh     change       -0.1187313E-04 Eh
   gradient norm :     0.0005367 Eh/α   predicted    -0.4977071E-05 ( -58.08%)
   displ. norm   :     0.0941964 α      lambda       -0.1072583E-04
   maximum displ.:     0.0602178 α      in ANC's #4, #1, #2, ...

........................................................................
.............................. CYCLE   10 ..............................
........................................................................

 iter      E             dE          RMSdq      gap      omega  full diag
   1   -128.4029777 -0.128403E+03  0.168E-02    0.13       0.0  T
   2   -128.4029604  0.172953E-04  0.185E-02    0.13       1.0  T
   3   -128.4022118  0.748680E-03  0.106E-01    0.13       1.0  T
   4   -128.4029704 -0.758648E-03  0.992E-03    0.13       1.2  T
   5   -128.4029776 -0.720306E-05  0.179E-03    0.13       6.5  T
   6   -128.4029778 -0.185260E-06  0.915E-04    0.13      12.8  T
   7   -128.4029778 -0.443240E-07  0.401E-04    0.13      29.2  T
     SCC iter.                  ...        0 min,  0.104 sec
     gradient                   ...        0 min,  0.050 sec
 * total energy  :  -125.9562924 Eh     change       -0.1332963E-04 Eh
   gradient norm :     0.0007033 Eh/α   predicted    -0.5386812E-05 ( -59.59%)
   displ. norm   :     0.1342154 α      lambda       -0.1393844E-04
   maximum displ.:     0.0819410 α      in ANC's #1, #4, #8, ...

........................................................................
.............................. CYCLE   11 ..............................
........................................................................

 iter      E             dE          RMSdq      gap      omega  full diag
   1   -128.4033706 -0.128403E+03  0.253E-02    0.13       0.0  T
   2   -128.4033123  0.582484E-04  0.323E-02    0.13       1.0  T
   3   -128.4020083  0.130403E-02  0.142E-01    0.13       1.0  T
   4   -128.4033605 -0.135217E-02  0.117E-02    0.13       1.0  T
   5   -128.4033702 -0.972083E-05  0.301E-03    0.13       3.9  T
   6   -128.4033708 -0.650379E-06  0.825E-04    0.13      14.2  T
   7   -128.4033709 -0.450312E-07  0.110E-04    0.13     106.1  T
     SCC iter.                  ...        0 min,  0.101 sec
     gradient                   ...        0 min,  0.051 sec
 * total energy  :  -125.9563089 Eh     change       -0.1649063E-04 Eh
   gradient norm :     0.0012486 Eh/α   predicted    -0.7027623E-05 ( -57.38%)
   displ. norm   :     0.1509442 α      lambda       -0.1245738E-04
   maximum displ.:     0.0949167 α      in ANC's #1, #4, #8, ...

........................................................................
.............................. CYCLE   12 ..............................
........................................................................

 iter      E             dE          RMSdq      gap      omega  full diag
   1   -128.4033534 -0.128403E+03  0.286E-02    0.13       0.0  T
   2   -128.4033213  0.320861E-04  0.269E-02    0.13       1.0  T
   3   -128.4005320  0.278933E-02  0.203E-01    0.13       1.0  T
   4   -128.4033466 -0.281456E-02  0.970E-03    0.13       1.2  T
   5   -128.4033524 -0.586168E-05  0.399E-03    0.13       2.9  T
   6   -128.4033536 -0.117190E-05  0.899E-04    0.13      13.0  T
   7   -128.4033537 -0.456581E-07  0.361E-04    0.13      32.5  T
   8   -128.4033537 -0.982166E-08  0.662E-05    0.13     176.8  T
     SCC iter.                  ...        0 min,  0.113 sec
     gradient                   ...        0 min,  0.046 sec
 * total energy  :  -125.9563228 Eh     change       -0.1387837E-04 Eh
   gradient norm :     0.0011427 Eh/α   predicted    -0.6292021E-05 ( -54.66%)
   displ. norm   :     0.1113468 α      lambda       -0.6955603E-05
   maximum displ.:     0.0740243 α      in ANC's #1, #4, #8, ...

........................................................................
.............................. CYCLE   13 ..............................
........................................................................

 iter      E             dE          RMSdq      gap      omega  full diag
   1   -128.4031417 -0.128403E+03  0.210E-02    0.13       0.0  T
   2   -128.4031291  0.125892E-04  0.179E-02    0.13       1.0  T
   3   -128.4013772  0.175185E-02  0.160E-01    0.13       1.0  T
   4   -128.4031370 -0.175979E-02  0.801E-03    0.13       1.5  T
   5   -128.4031411 -0.413069E-05  0.285E-03    0.13       4.1  T
   6   -128.4031418 -0.633258E-06  0.272E-04    0.13      43.1  T
   7   -128.4031418 -0.751669E-09  0.231E-04    0.13      50.6  T
     SCC iter.                  ...        0 min,  0.104 sec
     gradient                   ...        0 min,  0.053 sec
 * total energy  :  -125.9563305 Eh     change       -0.7676056E-05 Eh
   gradient norm :     0.0005907 Eh/α   predicted    -0.3497511E-05 ( -54.44%)
   displ. norm   :     0.0660535 α      lambda       -0.3795310E-05
   maximum displ.:     0.0476079 α      in ANC's #1, #4, #5, ...

........................................................................
.............................. CYCLE   14 ..............................
........................................................................

 iter      E             dE          RMSdq      gap      omega  full diag
   1   -128.4029274 -0.128403E+03  0.125E-02    0.13       0.0  T
   2   -128.4029208  0.663676E-05  0.121E-02    0.13       1.0  T
   3   -128.4023941  0.526701E-03  0.882E-02    0.13       1.0  T
   4   -128.4029252 -0.531153E-03  0.547E-03    0.13       2.1  T
   5   -128.4029273 -0.207645E-05  0.142E-03    0.13       8.3  T
   6   -128.4029275 -0.161086E-06  0.103E-04    0.13     113.6  T
   7   -128.4029275 -0.261934E-09  0.786E-05    0.13     148.9  T
     SCC iter.                  ...        0 min,  0.099 sec
     gradient                   ...        0 min,  0.053 sec
 * total energy  :  -125.9563350 Eh     change       -0.4521651E-05 Eh
   gradient norm :     0.0002306 Eh/α   predicted    -0.1904000E-05 ( -57.89%)
   displ. norm   :     0.0556085 α      lambda       -0.3674998E-05
   maximum displ.:     0.0398743 α      in ANC's #1, #4, #3, ...

   *** GEOMETRY OPTIMIZATION CONVERGED AFTER 14 ITERATIONS ***

------------------------------------------------------------------------
 total energy gain   :        -0.0090719 Eh       -5.6927 kcal/mol
 total RMSD          :         0.1575460 a0        0.0834 Å
 total power (kW/mol):        -1.7012999 (step)   -9.1573 (real)
------------------------------------------------------------------------

 ANCopt (total)                0 d,  0 h,  0 min,  2.602 sec
 optimizer setup                ...        0 min,  0.000 sec (  0.000%)
 model hessian                  ...        0 min,  0.038 sec (  1.460%)
 ANC generation                 ...        0 min,  0.009 sec (  0.346%)
 coordinate transformation      ...        0 min,  0.001 sec (  0.038%)
 single point calculation       ...        0 min,  2.534 sec ( 97.387%)
 optimization log               ...        0 min,  0.012 sec (  0.461%)
 hessian update                 ...        0 min,  0.000 sec (  0.000%)
 rational function              ...        0 min,  0.004 sec (  0.154%)

================
 final structure:
================
73
 xtb: 6.7.1pre (5071a88)
C            1.73630372864120        3.63032405738887       -0.16532901096210
C            1.60477155879041        1.17828077366052       -0.04894383581895
C            1.48679253386806       -1.25821767209941        0.07127599909749
C            1.36977238437544       -3.70413641200471        0.26178315585571
C            3.49803347759323       -4.99501695029756        0.32299301420305
C            3.98150560550417        4.69316062216022       -0.35033168817664
C            3.80013810856540        2.29130963294203       -0.17008896668595
C            3.66518812509348       -0.14581026177499       -0.00400541673906
C            3.55880574307631       -2.58526564504274        0.16781570562973
C            5.62594642745206       -3.89777901804113        0.22955952154431
C            5.98776695116660        3.38480269986140       -0.31673832337903
C            5.83944029865114        0.95762674345560       -0.12560729897380
C            5.71936758347837       -1.46506492296552        0.05829228449979
C           -4.55395095354583        5.15449494250527        0.50321092119636
C           -4.68436800745377        2.76226232149035        0.30107176074503
C           -4.84680415112858        0.34343173539741        0.06661413864705
C           -4.94867946132526       -2.32794710584697       -0.30224231410151
C           -4.92324937400375       -4.71387301030112       -0.69241875177475
C           -2.51445017607024        3.86213925154315        0.20519661074552
C           -2.64686275437381        1.39242376048447        0.08480762415784
C           -2.78857619770766       -1.06672254541051       -0.03755275581839
C           -2.85901611301287       -3.53152891393800       -0.20773094281593
C           -0.29673869121536        4.92655189293172       -0.07210328238933
C           -0.45143664393700        2.51713470401820        0.00837703734772
C           -0.59183820928076        0.06265296682424        0.01133307933945
C           -0.69438928695249       -2.38258461428796        0.04593122436106
C           -0.78494600075418       -4.78494044344093        0.28602042238224
C            3.17887752889403        3.55954903037190       -0.23442090325831
C            3.02495902539478        1.10794753146937       -0.07507053576296
C            2.90572872261335       -1.32992189281151        0.08399572012719
C            2.81310097303001       -3.78247929198305        0.26217589244207
C            4.88725894662110       -5.04875129825311        0.30901431193330
C            5.36837491543217        4.60404877705256       -0.39288296371841
C            5.22360664367055        2.20535217556530       -0.20447424790707
C            5.09559852416693       -0.21877742097649       -0.02194281800484
C            4.98374327921171       -2.64501731389116        0.15374064630759
C           -5.30922457783104        4.01263513078047        0.45683837467230
C           -5.43339638216505        1.58958274626649        0.22581935708462
C           -5.61550820400096       -3.53800655928170       -0.55462305554378
C           -3.17293999013488        5.07812918968885        0.37502074087997
C           -3.27087766647049        2.66614021259383        0.19306972865370
C           -3.42172746412620        0.20346779194593        0.03280924143271
C           -3.53429389405587       -2.28497529877904       -0.16999233634324
C           -3.55262303588656       -4.70417176132691       -0.50788422368392
C           -1.08255379560046        3.78069821458779        0.04862737731805
C           -1.22615711784278        1.32199191176856        0.03599799675062
C           -1.36353127990838       -1.12544342013089       -0.00508168459250
C           -1.44010423706682       -3.57800173596890        0.03659975463032
C            1.06815150447566        4.85399547249988       -0.18256973225972
C            0.96612319000131        2.44566856974731       -0.07375214616464
C            0.83741102268212       -0.00643419780017        0.00849245883520
C            0.72307574118571       -2.45208310478669        0.12836640155233
C            0.57938718940882       -4.84513621265755        0.40342554096543
H            2.95976520630327       -5.92708316229112        0.37405663550163
H            3.54079802580335        5.67447485136476       -0.41106497169235
H           -5.43479551377292       -5.63496939890855       -0.92827398868214
H           -1.34962961085776       -5.69499497529173        0.40792900577342
H            5.37934715419792       -6.00932777278493        0.35825432831480
H            5.95339703018333        5.50782192745250       -0.48347548422485
H           -3.01431704234526       -5.63073716517107       -0.62153908319983
H            1.03183558359420       -5.80277217987892        0.60180376846616
H           -5.02381003236119        6.11836836152744        0.63340595329121
H           -0.75460035181082        5.90175967816354       -0.08986692643989
H           -2.61381928637367        5.99806155940454        0.42001967302750
H            1.61794718029233        5.77610801111533       -0.27348246218178
H            6.70544464657411       -3.93012874652735        0.21804116149086
H            7.06460201202282        3.30585350541610       -0.34306661396839
H            6.91823620173062        0.89792121939113       -0.14641064682259
H            6.79880584812945       -1.51446454535298        0.04414286508866
H           -6.38521300546561        4.04899283196254        0.54014859765696
H           -6.51290363552234        1.65053468150190        0.27441827488627
H           -6.69211853745436       -3.51315800058067       -0.65372080353475
P           -6.02693994006239       -0.95056251541477       -0.13334209121379
 
 Bond Distances (Angstroems)
 ---------------------------
C1-C28=1.4460        C1-C49=1.3943        C1-C50=1.4160        C2-C29=1.4222        C2-C50=1.4194        C2-C51=1.4127        
C3-C30=1.4208        C3-C51=1.4116        C3-C52=1.4184        C4-C31=1.4455        C4-C52=1.4155        C4-C53=1.3952        
C5-C31=1.3939        C5-C32=1.3903        C5-H54=1.0775        C6-C28=1.3938        C6-C33=1.3904        C6-H55=1.0774        
C7-C28=1.4137        C7-C29=1.4178        C7-C34=1.4265        C8-C29=1.4096        C8-C30=1.4095        C8-C35=1.4324        
C9-C30=1.4175        C9-C31=1.4136        C9-C36=1.4263        C10-C32=1.3699       C10-C36=1.4098       C10-H66=1.0800       
C11-C33=1.3697       C11-C34=1.4098       C11-H67=1.0800       C12-C34=1.3937       C12-C35=1.3957       C12-H68=1.0806       
C13-C35=1.3960       C13-C36=1.3938       C13-H69=1.0807       C14-C37=1.3698       C14-C40=1.3890       C14-H62=1.0802       
C15-C37=1.4065       C15-C38=1.3935       C15-C41=1.4209       C16-C38=1.3865       C16-C42=1.4323       C16-P73=1.7627       
C17-C39=1.4045       C17-C43=1.4212       C17-P73=1.7574       C18-C39=1.3714       C18-C44=1.3830       C18-H56=1.0797       
C19-C40=1.3932       C19-C41=1.4152       C19-C45=1.4427       C20-C41=1.4225       C20-C42=1.4201       C20-C46=1.4233       
C21-C42=1.4210       C21-C43=1.4345       C21-C47=1.4266       C22-C43=1.4182       C22-C44=1.3951       C22-C48=1.4405       
C23-C45=1.3947       C23-C49=1.3713       C23-H63=1.0775       C24-C45=1.4130       C24-C46=1.4245       C24-C50=1.4217       
C25-C46=1.4103       C25-C47=1.4168       C25-C51=1.4309       C26-C47=1.4250       C26-C48=1.4090       C26-C52=1.4216       
C27-C48=1.3958       C27-C53=1.3707       C27-H57=1.0779       C28-C1=1.4460        C28-C6=1.3938        C28-C7=1.4137        
C29-C2=1.4222        C29-C7=1.4178        C29-C8=1.4096        C30-C3=1.4208        C30-C8=1.4095        C30-C9=1.4175        
C31-C4=1.4455        C31-C5=1.3939        C31-C9=1.4136        C32-C5=1.3903        C32-C10=1.3699       C32-H58=1.0804       
C33-C6=1.3904        C33-C11=1.3697       C33-H59=1.0804       C34-C7=1.4265        C34-C11=1.4098       C34-C12=1.3937       
C35-C8=1.4324        C35-C12=1.3957       C35-C13=1.3960       C36-C9=1.4263        C36-C10=1.4098       C36-C13=1.3938       
C37-C14=1.3698       C37-C15=1.4065       C37-H70=1.0798       C38-C15=1.3935       C38-C16=1.3865       C38-H71=1.0823       
C39-C17=1.4045       C39-C18=1.3714       C39-H72=1.0814       C40-C14=1.3890       C40-C19=1.3932       C40-H64=1.0775       
C41-C15=1.4209       C41-C19=1.4152       C41-C20=1.4225       C42-C16=1.4323       C42-C20=1.4201       C42-C21=1.4210       
C43-C17=1.4212       C43-C21=1.4345       C43-C22=1.4182       C44-C18=1.3830       C44-C22=1.3951       C44-H60=1.0776       
C45-C19=1.4427       C45-C23=1.3947       C45-C24=1.4130       C46-C20=1.4233       C46-C24=1.4245       C46-C25=1.4103       
C47-C21=1.4266       C47-C25=1.4168       C47-C26=1.4250       C48-C22=1.4405       C48-C26=1.4090       C48-C27=1.3958       
C49-C1=1.3943        C49-C23=1.3713       C49-H65=1.0774       C50-C1=1.4160        C50-C2=1.4194        C50-C24=1.4217       
C51-C2=1.4127        C51-C3=1.4116        C51-C25=1.4309       C52-C3=1.4184        C52-C4=1.4155        C52-C26=1.4216       
C53-C4=1.3952        C53-C27=1.3707       C53-H61=1.0776       H54-C5=1.0775        H55-C6=1.0774        H56-C18=1.0797       
H57-C27=1.0779       H58-C32=1.0804       H59-C33=1.0804       H60-C44=1.0776       H61-C53=1.0776       H62-C14=1.0802       
H63-C23=1.0775       H64-C40=1.0775       H65-C49=1.0774       H66-C10=1.0800       H67-C11=1.0800       H68-C12=1.0806       
H69-C13=1.0807       H70-C37=1.0798       H71-C38=1.0823       H72-C39=1.0814       P73-C16=1.7627       P73-C17=1.7574       
 C  H  Rav=1.0793 sigma=0.0016  Rmin=1.0774  Rmax=1.0823    19
 C  C  Rav=1.4091 sigma=0.0189  Rmin=1.3697  Rmax=1.4460    69
 P  C  Rav=1.7600 sigma=0.0027  Rmin=1.7574  Rmax=1.7627     2
 
 selected bond angles (degree)
 --------------------
C49-C1-C28=121.36              C50-C1-C28=120.32              C50-C1-C49=118.32              C50-C2-C29=119.55              
C51-C2-C29=120.11              C51-C2-C50=120.34              C51-C3-C30=120.30              C52-C3-C30=119.66              
C52-C3-C51=120.03              C52-C4-C31=120.28              C53-C4-C31=121.42              C53-C4-C52=118.30              
C32-C5-C31=121.61              H54-C5-C31=120.60              H54-C5-C32=117.79              C33-C6-C28=121.66              
H55-C6-C28=120.66              H55-C6-C33=117.69              C29-C7-C28=120.77              C34-C7-C28=119.44              
C34-C7-C29=119.80              C30-C8-C29=120.38              C35-C8-C29=119.88              C35-C8-C30=119.74              
C31-C9-C30=120.73              C36-C9-C30=119.79              C36-C9-C31=119.49              C36-C10-C32=120.27             
H66-C10-C32=120.96             H66-C10-C36=118.77             
 
 selected dihedral angles (degree)
 ---------------------------------

           -------------------------------------------------
          |                Final Singlepoint                |
           -------------------------------------------------

          ...................................................
          :                      SETUP                      :
          :.................................................:
          :  # basis functions                 241          :
          :  # atomic orbitals                 240          :
          :  # shells                          128          :
          :  # electrons                       236          :
          :  max. iterations                   250          :
          :  Hamiltonian                  GFN2-xTB          :
          :  restarted?                      false          :
          :  GBSA solvation                  false          :
          :  PC potential                    false          :
          :  electronic temp.          300.0000000     K    :
          :  accuracy                    1.0000000          :
          :  -> integral cutoff          0.2500000E+02      :
          :  -> integral neglect         0.1000000E-07      :
          :  -> SCF convergence          0.1000000E-05 Eh   :
          :  -> wf. convergence          0.1000000E-03 e    :
          :  Broyden damping             0.4000000          :
          :  net charge                          0          :
          :  unpaired electrons                  0          :
          ...................................................

 iter      E             dE          RMSdq      gap      omega  full diag
   1   -128.4029275 -0.128403E+03  0.228E-05    0.13       0.0  T
   2   -128.4029275  0.883915E-09  0.118E-04    0.13      99.3  T
   3   -128.4029275 -0.224304E-09  0.966E-05    0.13     121.1  T

   *** convergence criteria satisfied after 3 iterations ***

         #    Occupation            Energy/Eh            Energy/eV
      -------------------------------------------------------------
         1        2.0000           -0.6682489             -18.1840
       ...           ...                  ...                  ...
       112        2.0000           -0.3919472             -10.6654
       113        2.0000           -0.3902886             -10.6203
       114        2.0000           -0.3882965             -10.5661
       115        2.0000           -0.3872989             -10.5389
       116        2.0000           -0.3739470             -10.1756
       117        2.0000           -0.3585144              -9.7557
       118        1.8585           -0.3268058              -8.8928 (HOMO)
       119        0.1415           -0.3219132              -8.7597 (LUMO)
       120                         -0.2890477              -7.8654
       121                         -0.2712408              -7.3808
       122                         -0.2541824              -6.9167
       123                         -0.2481263              -6.7519
       ...                                ...                  ...
       240                          0.9316024              25.3502
      -------------------------------------------------------------
                  HL-Gap            0.0048926 Eh            0.1331 eV
             Fermi-level           -0.3243595 Eh           -8.8263 eV

 SCC (total)                   0 d,  0 h,  0 min,  0.120 sec
 SCC setup                      ...        0 min,  0.001 sec (  0.833%)
 Dispersion                     ...        0 min,  0.001 sec (  0.833%)
 classical contributions        ...        0 min,  0.000 sec (  0.000%)
 integral evaluation            ...        0 min,  0.016 sec ( 13.333%)
 iterations                     ...        0 min,  0.046 sec ( 38.333%)
 molecular gradient             ...        0 min,  0.054 sec ( 45.000%)
 printout                       ...        0 min,  0.002 sec (  1.667%)

         :::::::::::::::::::::::::::::::::::::::::::::::::::::
         ::                     SUMMARY                     ::
         :::::::::::::::::::::::::::::::::::::::::::::::::::::
         :: total energy            -125.956334991494 Eh    ::
         :: gradient norm              0.000230548233 Eh/a0 ::
         :: HOMO-LUMO gap              0.133133790320 eV    ::
         ::.................................................::
         :: SCC energy              -128.405009126125 Eh    ::
         :: -> isotropic ES            0.002342997384 Eh    ::
         :: -> anisotropic ES          0.007412213281 Eh    ::
         :: -> anisotropic XC          0.055201833420 Eh    ::
         :: -> dispersion             -0.140009158128 Eh    ::
         :: repulsion energy           2.448674134631 Eh    ::
         :: add. restraining           0.000000000000 Eh    ::
         :: total charge               0.000000000000 e     ::
         :::::::::::::::::::::::::::::::::::::::::::::::::::::

           -------------------------------------------------
          |                Property Printout                |
           -------------------------------------------------

    * Orbital Energies and Occupations

         #    Occupation            Energy/Eh            Energy/eV
      -------------------------------------------------------------
         1        2.0000           -0.6682489             -18.1840
       ...           ...                  ...                  ...
       106        2.0000           -0.4060402             -11.0489
       107        2.0000           -0.4039904             -10.9931
       108        2.0000           -0.4032565             -10.9732
       109        2.0000           -0.4010394             -10.9128
       110        2.0000           -0.4007554             -10.9051
       111        2.0000           -0.3974058             -10.8140
       112        2.0000           -0.3919472             -10.6654
       113        2.0000           -0.3902886             -10.6203
       114        2.0000           -0.3882965             -10.5661
       115        2.0000           -0.3872989             -10.5389
       116        2.0000           -0.3739470             -10.1756
       117        2.0000           -0.3585144              -9.7557
       118        1.8585           -0.3268058              -8.8928 (HOMO)
       119        0.1415           -0.3219132              -8.7597 (LUMO)
       120                         -0.2890477              -7.8654
       121                         -0.2712408              -7.3808
       122                         -0.2541824              -6.9167
       123                         -0.2481263              -6.7519
       124                         -0.2412785              -6.5655
       125                         -0.2388162              -6.4985
       126                         -0.2321683              -6.3176
       127                         -0.2305583              -6.2738
       128                         -0.2281278              -6.2077
       129                         -0.2131798              -5.8009
       ...                                ...                  ...
       240                          0.9316024              25.3502
      -------------------------------------------------------------
                  HL-Gap            0.0048926 Eh            0.1331 eV
             Fermi-level           -0.3243595 Eh           -8.8263 eV

     #   Z          covCN         q      C6AA      α(0)
     1   6 C        2.980     0.004    27.927     8.669
     2   6 C        2.986    -0.001    28.040     8.686
     3   6 C        2.987    -0.001    28.033     8.685
     4   6 C        2.980     0.004    27.935     8.670
     5   6 C        2.922    -0.037    28.918     8.819
     6   6 C        2.922    -0.037    28.912     8.818
     7   6 C        2.994     0.002    27.982     8.677
     8   6 C        2.993    -0.000    28.023     8.684
     9   6 C        2.994     0.002    27.980     8.677
    10   6 C        2.922    -0.037    28.928     8.820
    11   6 C        2.922    -0.037    28.924     8.819
    12   6 C        2.926    -0.045    29.121     8.850
    13   6 C        2.926    -0.045    29.121     8.850
    14   6 C        2.913    -0.029    28.731     8.789
    15   6 C        2.983     0.011    27.754     8.642
    16   6 C        2.912    -0.003    28.097     8.692
    17   6 C        2.918    -0.000    28.041     8.684
    18   6 C        2.911    -0.031    28.762     8.794
    19   6 C        2.978     0.006    27.875     8.660
    20   6 C        2.983    -0.000    28.024     8.684
    21   6 C        2.971     0.001    28.005     8.680
    22   6 C        2.984     0.005    27.892     8.663
    23   6 C        2.920    -0.037    28.931     8.820
    24   6 C        2.988     0.001    28.002     8.680
    25   6 C        2.984    -0.000    28.028     8.684
    26   6 C        2.989     0.001    27.993     8.679
    27   6 C        2.920    -0.038    28.953     8.824
    28   6 C        2.976     0.006    27.878     8.661
    29   6 C        2.985     0.001    28.008     8.681
    30   6 C        2.986     0.000    28.010     8.682
    31   6 C        2.976     0.006    27.878     8.661
    32   6 C        2.912    -0.030    28.743     8.791
    33   6 C        2.912    -0.030    28.744     8.791
    34   6 C        2.980     0.012    27.731     8.638
    35   6 C        2.975     0.011    27.759     8.642
    36   6 C        2.980     0.012    27.730     8.638
    37   6 C        2.923    -0.036    28.907     8.817
    38   6 C        3.138    -0.042    28.799     8.783
    39   6 C        3.113    -0.035    28.702     8.776
    40   6 C        2.923    -0.036    28.906     8.817
    41   6 C        2.994     0.002    27.961     8.674
    42   6 C        3.017     0.003    27.948     8.672
    43   6 C        3.029     0.005    27.889     8.662
    44   6 C        2.928    -0.036    28.887     8.814
    45   6 C        2.981     0.004    27.929     8.669
    46   6 C        2.984    -0.000    28.033     8.685
    47   6 C        2.982    -0.001    28.050     8.688
    48   6 C        2.985     0.004    27.933     8.670
    49   6 C        2.920    -0.037    28.916     8.818
    50   6 C        2.989     0.001    27.990     8.678
    51   6 C        2.985    -0.001    28.053     8.688
    52   6 C        2.990     0.001    27.997     8.680
    53   6 C        2.920    -0.037    28.914     8.818
    54   1 H        0.926     0.032     2.553     2.498
    55   1 H        0.926     0.032     2.551     2.498
    56   1 H        0.926     0.032     2.564     2.504
    57   1 H        0.926     0.034     2.536     2.490
    58   1 H        0.926     0.030     2.593     2.518
    59   1 H        0.926     0.030     2.592     2.518
    60   1 H        0.926     0.036     2.508     2.476
    61   1 H        0.926     0.033     2.538     2.491
    62   1 H        0.926     0.031     2.576     2.510
    63   1 H        0.926     0.033     2.538     2.491
    64   1 H        0.926     0.034     2.532     2.488
    65   1 H        0.926     0.033     2.538     2.491
    66   1 H        0.926     0.031     2.572     2.508
    67   1 H        0.926     0.031     2.570     2.507
    68   1 H        0.926     0.032     2.563     2.503
    69   1 H        0.926     0.032     2.563     2.503
    70   1 H        0.926     0.033     2.541     2.493
    71   1 H        0.925     0.040     2.445     2.445
    72   1 H        0.925     0.040     2.455     2.450
    73  15 P        2.372    -0.034   174.949    24.630

 Mol. C6AA /au·bohr⁶  :     105770.902376
 Mol. C8AA /au·bohr⁸  :    2953308.395953
 Mol. α(0) /au        :        534.307166


Wiberg/Mayer (AO) data.
largest (>0.10) Wiberg bond orders for each atom

 ---------------------------------------------------------------------------
     #   Z sym  total        # sym  WBO       # sym  WBO       # sym  WBO
 ---------------------------------------------------------------------------
     1   6 C    3.961 --    49 C    1.354    50 C    1.274    28 C    1.134
     2   6 C    3.945 --    51 C    1.275    50 C    1.233    29 C    1.226
     3   6 C    3.942 --    51 C    1.275    52 C    1.231    30 C    1.228
     4   6 C    3.960 --    53 C    1.349    52 C    1.277    31 C    1.135
     5   6 C    3.893 --    32 C    1.385    31 C    1.384    54 H    0.962
     6   6 C    3.894 --    28 C    1.385    33 C    1.384    55 H    0.962
     7   6 C    3.946 --    28 C    1.270    29 C    1.247    34 C    1.213
     8   6 C    3.965 --    29 C    1.281    30 C    1.280    35 C    1.175
     9   6 C    3.947 --    31 C    1.270    30 C    1.247    36 C    1.213
    10   6 C    3.897 --    32 C    1.505    36 C    1.270    66 H    0.969
    11   6 C    3.898 --    33 C    1.506    34 C    1.270    67 H    0.969
    12   6 C    3.792 --    34 C    1.340    35 C    1.327    68 H    0.966
    13   6 C    3.791 --    36 C    1.340    35 C    1.327    69 H    0.966
    14   6 C    3.982 --    37 C    1.500    40 C    1.389    62 H    0.970
    15   6 C    3.986 --    38 C    1.308    37 C    1.282    41 C    1.226
    16   6 C    3.983 --    38 C    1.410    73 P    1.225    42 C    1.195
    17   6 C    3.981 --    39 C    1.331    43 C    1.253    73 P    1.240
    18   6 C    3.983 --    39 C    1.470    44 C    1.411    56 H    0.969
    19   6 C    3.982 --    40 C    1.390    41 C    1.265    45 C    1.134
    20   6 C    3.978 --    42 C    1.273    41 C    1.245    46 C    1.228
    21   6 C    3.973 --    42 C    1.271    47 C    1.246    43 C    1.217
    22   6 C    3.981 --    44 C    1.377    43 C    1.269    48 C    1.134
    23   6 C    3.969 --    49 C    1.477    45 C    1.351    63 H    0.960
    24   6 C    3.977 --    45 C    1.280    50 C    1.247    46 C    1.225
    25   6 C    3.965 --    46 C    1.283    47 C    1.266    51 C    1.198
    26   6 C    3.972 --    48 C    1.283    52 C    1.245    47 C    1.223
    27   6 C    3.966 --    53 C    1.482    48 C    1.345    57 H    0.961
    28   6 C    3.981 --     6 C    1.385     7 C    1.270     1 C    1.134
    29   6 C    3.979 --     8 C    1.281     7 C    1.247     2 C    1.226
    30   6 C    3.978 --     8 C    1.280     9 C    1.247     3 C    1.228
    31   6 C    3.981 --     5 C    1.384     9 C    1.270     4 C    1.135
    32   6 C    3.983 --    10 C    1.505     5 C    1.385    58 H    0.970
    33   6 C    3.983 --    11 C    1.506     6 C    1.384    59 H    0.970
    34   6 C    3.985 --    12 C    1.340    11 C    1.270     7 C    1.213
    35   6 C    3.989 --    12 C    1.327    13 C    1.327     8 C    1.175
    36   6 C    3.985 --    13 C    1.340    10 C    1.270     9 C    1.213
    37   6 C    3.916 --    14 C    1.500    15 C    1.282    70 H    0.968
    38   6 C    3.844 --    16 C    1.410    15 C    1.308    71 H    0.959
    39   6 C    3.921 --    18 C    1.470    17 C    1.331    72 H    0.962
    40   6 C    3.915 --    19 C    1.390    14 C    1.389    64 H    0.962
    41   6 C    3.958 --    19 C    1.265    20 C    1.245    15 C    1.226
    42   6 C    3.964 --    20 C    1.273    21 C    1.271    16 C    1.195
    43   6 C    3.953 --    22 C    1.269    17 C    1.253    21 C    1.217
    44   6 C    3.921 --    18 C    1.411    22 C    1.377    60 H    0.962
    45   6 C    3.964 --    23 C    1.351    24 C    1.280    19 C    1.134
    46   6 C    3.950 --    25 C    1.283    20 C    1.228    24 C    1.225
    47   6 C    3.953 --    25 C    1.266    21 C    1.246    26 C    1.223
    48   6 C    3.965 --    27 C    1.345    26 C    1.283    22 C    1.134
    49   6 C    3.971 --    23 C    1.477     1 C    1.354    65 H    0.960
    50   6 C    3.979 --     1 C    1.274    24 C    1.247     2 C    1.233
    51   6 C    3.972 --     2 C    1.275     3 C    1.275    25 C    1.198
    52   6 C    3.979 --     4 C    1.277    26 C    1.245     3 C    1.231
    53   6 C    3.971 --    27 C    1.482     4 C    1.349    61 H    0.961
    54   1 H    0.998 --     5 C    0.962
    55   1 H    0.998 --     6 C    0.962
    56   1 H    0.998 --    18 C    0.969
    57   1 H    0.998 --    27 C    0.961
    58   1 H    0.998 --    32 C    0.970
    59   1 H    0.998 --    33 C    0.970
    60   1 H    0.998 --    44 C    0.962
    61   1 H    0.998 --    53 C    0.961
    62   1 H    0.998 --    14 C    0.970
    63   1 H    0.998 --    23 C    0.960
    64   1 H    0.998 --    40 C    0.962
    65   1 H    0.998 --    49 C    0.960
    66   1 H    0.998 --    10 C    0.969
    67   1 H    0.998 --    11 C    0.969
    68   1 H    0.998 --    12 C    0.966
    69   1 H    0.998 --    13 C    0.966
    70   1 H    0.998 --    37 C    0.968
    71   1 H    0.997 --    38 C    0.959
    72   1 H    0.998 --    39 C    0.962
    73  15 P    2.740 --    17 C    1.240    16 C    1.225
 ---------------------------------------------------------------------------

Topologies differ in total number of bonds
Writing topology from bond orders to xtbtopo.mol

molecular dipole:
                 x           y           z       tot (Debye)
 q only:        0.178       0.054       0.000
   full:        0.543       0.037      -0.001       1.384
molecular quadrupole (traceless):
                xx          xy          yy          xz          yz          zz
 q only:        1.261      -0.672       9.819      -0.136       0.172     -11.080
  q+dip:        7.054      -1.473      29.329      -0.558       0.014     -36.383
   full:       -3.365      -1.424      18.629      -0.389       0.226     -15.264

           -------------------------------------------------
          |                Geometry Summary                 |
           -------------------------------------------------

      molecular mass/u    :      686.6936390
   center of mass at/Å    :       -0.0204023      -0.0031669       0.0019593
  moments of inertia/u·Å² :        0.7019628E+04   0.9844709E+04   0.1677404E+05
rotational constants/cm⁻¹ :        0.2401499E-02   0.1712354E-02   0.1004983E-02

 * 86 selected distances

     #   Z          #   Z                                           value/Å
     6   6 C       28   6 C                                       1.3938159
     7   6 C       28   6 C                                       1.4136955
     2   6 C       29   6 C                                       1.4221681
     7   6 C       29   6 C                                       1.4178425
     8   6 C       29   6 C                                       1.4095576
     3   6 C       30   6 C                                       1.4208038
     8   6 C       30   6 C                                       1.4094834
     9   6 C       30   6 C                                       1.4175414
     5   6 C       31   6 C                                       1.3939438
     9   6 C       31   6 C                                       1.4136125
     5   6 C       32   6 C                                       1.3903347
    10   6 C       32   6 C                                       1.3699306
     6   6 C       33   6 C                                       1.3903807
    11   6 C       33   6 C                                       1.3696736
     7   6 C       34   6 C                                       1.4264761
    11   6 C       34   6 C                                       1.4098397
    12   6 C       34   6 C                                       1.3936607
     8   6 C       35   6 C                                       1.4323827
    12   6 C       35   6 C                                       1.3956984
    13   6 C       35   6 C                                       1.3959794
     9   6 C       36   6 C                                       1.4262593
    10   6 C       36   6 C                                       1.4098176
    13   6 C       36   6 C                                       1.3937509
    14   6 C       37   6 C                                       1.3698295
    15   6 C       37   6 C                                       1.4064642
    15   6 C       38   6 C                                       1.3935150
    16   6 C       38   6 C                                       1.3864810
    17   6 C       39   6 C                                       1.4044931
    18   6 C       39   6 C                                       1.3714489
    14   6 C       40   6 C                                       1.3890486
    19   6 C       40   6 C                                       1.3932268
    15   6 C       41   6 C                                       1.4208657
    19   6 C       41   6 C                                       1.4151833
    20   6 C       41   6 C                                       1.4224870
    16   6 C       42   6 C                                       1.4323326
    20   6 C       42   6 C                                       1.4201182
    21   6 C       42   6 C                                       1.4209909
    17   6 C       43   6 C                                       1.4212050
    21   6 C       43   6 C                                       1.4344948
    22   6 C       43   6 C                                       1.4182103
    18   6 C       44   6 C                                       1.3830271
    22   6 C       44   6 C                                       1.3950893
    23   6 C       45   6 C                                       1.3946549
    24   6 C       45   6 C                                       1.4129834
    20   6 C       46   6 C                                       1.4232877
    24   6 C       46   6 C                                       1.4245425
    25   6 C       46   6 C                                       1.4102850
    21   6 C       47   6 C                                       1.4266240
    25   6 C       47   6 C                                       1.4168109
    26   6 C       47   6 C                                       1.4250466
    26   6 C       48   6 C                                       1.4089714
    27   6 C       48   6 C                                       1.3957594
     1   6 C       49   6 C                                       1.3943087
    23   6 C       49   6 C                                       1.3712742
     1   6 C       50   6 C                                       1.4159708
     2   6 C       50   6 C                                       1.4194222
    24   6 C       50   6 C                                       1.4217345
     2   6 C       51   6 C                                       1.4126893
     3   6 C       51   6 C                                       1.4115950
    25   6 C       51   6 C                                       1.4309210
     3   6 C       52   6 C                                       1.4183926
     4   6 C       52   6 C                                       1.4155050
    26   6 C       52   6 C                                       1.4215601
     4   6 C       53   6 C                                       1.3952248
    27   6 C       53   6 C                                       1.3706980
     5   6 C       54   1 H                                       1.0775379
     6   6 C       55   1 H                                       1.0774458
    18   6 C       56   1 H                                       1.0796879
    27   6 C       57   1 H                                       1.0779280
    32   6 C       58   1 H                                       1.0804086
    33   6 C       59   1 H                                       1.0803999
    44   6 C       60   1 H                                       1.0775966
    53   6 C       61   1 H                                       1.0775576
    14   6 C       62   1 H                                       1.0801715
    23   6 C       63   1 H                                       1.0774893
    40   6 C       64   1 H                                       1.0774584
    49   6 C       65   1 H                                       1.0774192 (min)
    10   6 C       66   1 H                                       1.0800444
    11   6 C       67   1 H                                       1.0800464
    12   6 C       68   1 H                                       1.0806472
    13   6 C       69   1 H                                       1.0806608
    37   6 C       70   1 H                                       1.0798212
    38   6 C       71   1 H                                       1.0823184
    39   6 C       72   1 H                                       1.0814471
    16   6 C       73  15 P                                       1.7627038 (max)
    17   6 C       73  15 P                                       1.7573736

 * 3 distinct bonds (by element types)

   Z      Z             #   av. dist./Å        max./Å        min./Å
   1 H    6 C          19     1.0792677     1.0823184     1.0774192
   6 C    6 C          65     1.4069757     1.4344948     1.3696736
   6 C   15 P           2     1.7600387     1.7627038     1.7573736


optimized geometry written to: xtbopt.xyz


           -------------------------------------------------
          | TOTAL ENERGY             -125.956334991494 Eh   |
          | GRADIENT NORM               0.000230548233 Eh/α |
          | HOMO-LUMO GAP               0.133133790320 eV   |
           -------------------------------------------------

------------------------------------------------------------------------
 * finished run on 2025/12/08 at 00:35:09.655     
------------------------------------------------------------------------
 total:
 * wall-time:     0 d,  0 h,  0 min,  3.140 sec
 *  cpu-time:     0 d,  0 h,  0 min, 12.312 sec
 * ratio c/w:     3.921 speedup
 SCF:
 * wall-time:     0 d,  0 h,  0 min,  0.349 sec
 *  cpu-time:     0 d,  0 h,  0 min,  1.375 sec
 * ratio c/w:     3.940 speedup
 ANC optimizer:
 * wall-time:     0 d,  0 h,  0 min,  2.727 sec
 *  cpu-time:     0 d,  0 h,  0 min, 10.734 sec
 * ratio c/w:     3.936 speedup

normal termination of xtb
